id,created_at,text
1252494703146102784,2020-04-21 07:09:42,"b'Pemerintah mulai menggulirkan paket bantuan sosial untuk wilayah DKI Jakarta, disusul wilayah Bodetabek. Program Kartu Prakerja mulai berjalan, bansos tunai juga mulai dikerjakan minggu ini.\n\nMaka itu, pemerintah pun menetapkan larangan mudik bagi seluruh masyarakat. https://t.co/cPZJNQ3V0i'"
1252406586238136320,2020-04-21 01:19:33,"b'\xe2\x80\x9cTerkadang, kesulitan harus kamu rasakan terlebih dahulu sebelum kebahagiaan yang sempurna datang kepadamu.\xe2\x80\x9d\n\nRaden Adjeng Kartini (1879 \xe2\x80\x931904) https://t.co/yTghJOkZyD'"
1252192434500456449,2020-04-20 11:08:35,"b'Menyangkut penanganan Covid-19 ini, kepada seluruh daerah, ada tiga hal yang terus-menerus saya tekankan untuk dilaksanakan yakni: pengujian sampel yang masif, pelacakan yang agresif, dan isolasi yang ketat. https://t.co/cHBBuPCaDI'"
1252138437689217024,2020-04-20 07:34:01,"b'Keluarga-keluarga yang terdampak Covid-19 tersebut akan menerima paket bantuan tersebut di kediaman masing-masing. Bantuan ini akan dikirimkan dua kali dalam sebulan, selama tiga bulan.\n\nSemoga bermanfaat.'"
1252138336174526464,2020-04-20 07:33:37,"b'Bantuan sosial berupa paket sembako untuk 1,2 juta kk di DKI Jakarta, dan akan menyusul kepada 600.000 kk di Bodetabek, mulai disalurkan. \n\nPengirimannya mengikutsertakan PT Pos Indonesia, operator ojek daring, pihak Karang Taruna, Pasar Tani, dan pengemudi ojek pangkalan. https://t.co/K5kHGwZLeE'"
1251518014664486919,2020-04-18 14:28:41,"b'Tinggal di rumah saja, tidak membuat kita semakin individualistis, tapi justru semakin peduli satu sama lain. \n\nSaya percaya, jika kita bisa melalui kesulitan ini, kita akan keluar menjadi bangsa yang semakin kuat dan siap menyongsong masa depan yang lebih sejahtera. (2/2) https://t.co/5D93Kuyfq4'"
1251516698915569669,2020-04-18 14:23:27,"b'Masa-masa sulit yang kita hadapi saat ini tetap menyisakan harapan berupa kepedulian warga untuk bergotong-royong dan saling membantu. \n\nKita tidak saja bersama-sama mengatasi penyebaran virus korona ini, tapi juga menjaga perekonomian tetap bergerak dan berputar. (1/2) https://t.co/wtDiweCSbz'"
1251411181903831040,2020-04-18 07:24:10,b'Tak mudik bukan karena tak rindu. \nTapi karena sayang pada ayah dan ibu. https://t.co/5w3cZOr4p9'
1250698007122571264,2020-04-16 08:10:16,"b'Pertama, program perlindungan sosial bagi mereka. Kedua, realokasi anggaran yang ada di Kementerian Pariwisata ke kegiatan semacam program padat karya, atau yang lain. Ketiga, stimulus ekonomi bagi para pelaku usaha di sektor pariwisata dan ekonomi kreatif.'"
1250697896292265984,2020-04-16 08:09:49,"b'Sektor pariwisata kita, hotel, restoran, kedai kerajinan, paling terdampak oleh pandemi Covid-19. Untuk para pekerja di sektor pariwisata ini perlu langkah mitigasi secepat-cepatnya agar tetap bertahan dan tidak terjadi PHK secara besar-besaran. https://t.co/0qf1lqYsgb'"
1250395887831879686,2020-04-15 12:09:45,"b'Hari ini, saya melantik Ahmad Riza Patria sebagai Wakil Gubernur DKI Jakarta, I Dewa Made Wiarsa Raka Sandi sebagai Anggota KPU, dan Benny Rhamdani sebagai Kepala Badan Perlindungan Pekerja Migran Indonesia. Pelantikan digelar dengan protokol kesehatan ketat. \n\nSelamat bekerja. https://t.co/aXu8IgULlA'"
1250384417672974337,2020-04-15 11:24:10,"b'Semua negara memperebutkan alat-alat kesehatan untuk penanganan Covid-19. Di dalam negeri, sejumlah industri telah mampu memproduksi alat-alat itu dalam jumlah besar. \n\nSaya telah menginstruksikan agar izin produksi atau izin edar perusahaan-perusahaan itu dipercepat. https://t.co/b66MZEwp9z'"
1250040856624545792,2020-04-14 12:38:59,"b'KTT ASEAN Plus Three sore tadi, juga membahas  tantangan pandemi Covid-19 dan pelemahan ekonomi. \n\nMengingat Tiongkok, Jepang dan Korea Selatan termasuk yang pertama menghadapi Covid-19, pengalaman mereka menangani wabah ini perlu dibagi dengan negara-negara ASEAN. https://t.co/B0rLoKyBRy'"
1249994741527134208,2020-04-14 09:35:44,"b'Indonesia dan mayoritas negara lain diprediksi akan mengalami koreksi tajam terhadap target pembangunan dan pertumbuhan ekonomi di tahun 2020 ini akibat pandemi Covid-19.\n\nKendati begitu, kita tetap berikhtiar dan bekerja keras. Kita tidak boleh pesimistis. Insya Allah kita bisa. https://t.co/V19UYiYe7r'"
1249993987844272129,2020-04-14 09:32:45,"b'Pangkas belanja-belanja yang tidak prioritas, potong rencana belanja yang tidak mendesak seperti perjalanan dinas, rapat-rapat, dan belanja-belanja lain yang tidak dirasakan langsung manfaatnya oleh rakyat.'"
1249993839252668417,2020-04-14 09:32:09,b'Saya telah menginstruksikan jajaran pemerintah daerah untuk melakukan refocusing serta realokasi anggaran dan kegiatan sehingga pemerintah pusat dan daerah memiliki satu visi dan prioritas yang sama untuk mengatasi penyebaran Covid-19. https://t.co/GFT2z9LUcK'
1249985065632714754,2020-04-14 08:57:17,"b'Ketiga, kita harus memiliki komitmen melindungi warga ASEAN, termasuk para pekerja migran. Terakhir, terkait kerja sama dengan mitra ASEAN seperti Jepang, Korea dan Tiongkok, saya menyambut baik pembuatan ASEAN Covid-19 Response Fund untuk menghadapi situasi darurat saat ini.'"
1249984904365895681,2020-04-14 08:56:39,"b'Kedua, mencegah hambatan lalu lintas barang. Pergerakan orang dibatasi, tapi pergerakan barang tidak boleh terhambat, utamanya bahan pokok, obat, dan alat kesehatan. \n\nASEAN harus memiliki pengaturan bersama sebagai rujukan untuk menghindari melemahnya ekonomi kawasan.'"
1249984791505539073,2020-04-14 08:56:12,"b'Ekonomi kawasan ASEAN diprediksi hanya akan tumbuh sekitar 1 % tahun ini. Karena itu, negara-negara ASEAN perlu bekerja sama untuk: pertama, memutus mata rantai penyebaran virus di masing-masing negara, di kawasan ASEAN, dan di perbatasan. https://t.co/i7UQzMTx7a'"
1249984002024304640,2020-04-14 08:53:04,b'Konferensi Tingkat Tinggi ASEAN khusus tentang Covid-19 berlangsung secara virtual siang ini yang diikuti seluruh pemimpin negara ASEAN. Saya mengikuti KTT ini dari Istana Kepresidenan Bogor. https://t.co/tZ5HNXBI3h'
1249605812319707138,2020-04-13 07:50:16,"b'Saya mendengar berita tentang warga satu kompleks di Cimahi yang dinyatakan positif Covid-19 dan menjalani isolasi mandiri, tetapi tetangga-tetangganya membantu. Tidak justru mengucilkan.\n\nKegotongroyongan seperti inilah yang harus terus kita gaungkan. https://t.co/lmnLyA3I98'"
1249600727384645633,2020-04-13 07:30:04,"b'Saya telah memerintahkan kepada Menteri Sosial dan Menteri Keuangan, agar semua kebijakan itu, baik Kartu Prakerja, PKH (Program Keluarga Harapan), bantuan sosial langsung, Kartu Sembako, maupun pembagian sembako di Jabodetabek, minggu ini juga bisa berjalan.'"
1249600518206312449,2020-04-13 07:29:14,"b'FAO telah memperingatkan potensi kelangkaan pangan dunia menyusul pandemi Covid-19. \n\nDi sini, selain memastikan ketersediaan bahan pokok, pemerintah telah mengeluarkan sejumlah kebijakan untuk menjaga daya beli masyarakat dan memberikan bantuan bahan pokok yang amat dibutuhkan. https://t.co/z3W2mlUXZ9'"
1249590242970963968,2020-04-13 06:48:24,"b'Dulu hanya ada tiga lab uji sampel tes PCR (polymerase chain reaction), sekarang sudah ada 29 lab dari 78 yang kita siapkan. Menambah lab ini salah satu upaya mempercepat pemeriksaan sampel melalui tes PCR. \n\nSaya berharap, pemeriksaan dapat dilakukan di atas 10.000 tes per hari. https://t.co/FWTa3Yrcp1'"
1248929249303474176,2020-04-11 11:01:51,"b'Pembatasan sosial dan protokol kesehatan yang ketat sudah kita terapkan untuk mengendalikan penyebaran Covid-19. \n\nSementara, untuk mengurangi dampak perekonomian yang mengikutinya, pemerintah mengeluarkan paket insentif ekonomi: untuk warga, rumah tangga, juga dunia usaha. (3/3) https://t.co/Zje5RJlmZi'"
1248928493011755008,2020-04-11 10:58:51,"b'Pembatasan sosial dan protokol kesehatan yang ketat sudah kita terapkan untuk mengendalikan penyebaran Covid-19. \n\nSementara, untuk mengurangi dampak perekonomian yang mengikutinya, pemerintah mengeluarkan paket insentif ekonomi: untuk warga, rumah tangga, juga dunia usaha. (2/3) https://t.co/g8wz3DagoD'"
1248925509997588481,2020-04-11 10:47:00,"b'Pembatasan sosial dan protokol kesehatan yang ketat sudah kita terapkan untuk mengendalikan penyebaran Covid-19. \n\nSementara, untuk mengurangi dampak perekonomian yang mengikutinya, pemerintah mengeluarkan paket insentif ekonomi: untuk warga, rumah tangga, juga dunia usaha. (1/3) https://t.co/adXZwurGEe'"
1248491757316128768,2020-04-10 06:03:25,"b'Menghadapi pandemi Covid-19, kita semua -- tenaga kesehatan, sukarelawan, pekerja fasilitas publik, dan yang tinggal di rumah -- punya peran memutus mata rantai penyebaran virus ini. \nMari, bersatu padu, dengan kedisiplinan yang kuat, bersama-sama keluar dari kesulitan ini. (2/2) https://t.co/9mJsesEb7I'"
1248490705732825089,2020-04-10 05:59:14,"b'Menghadapi pandemi Covid-19, kita semua -- tenaga kesehatan, sukarelawan, pekerja fasilitas publik, dan yang tinggal di rumah -- punya peran memutus mata rantai penyebaran virus ini. \nMari, bersatu padu, dengan kedisiplinan yang kuat, bersama-sama keluar dari kesulitan ini. (1/2) https://t.co/orNEF4Q7GK'"
1248421527017508870,2020-04-10 01:24:21,"b'Pandemi Covid-19 ini adalah ujian yang tengah dihadapi umat manusia. Kita akan melaluinya dengan segenap kesabaran, kedisiplinan, dan tetap saling mengasihi. https://t.co/wjrew3grWt'"
1248239792405409808,2020-04-09 13:22:12,"b'Pemerintah telah memutuskan kebijakan khusus mengenai mudik, yakni: seluruh ASN, TNI dan Polri, serta pegawai BUMN, dilarang mudik. \n\nUntuk masyarakat, sembari memantau dan mengevaluasi hal-hal yang ada di lapangan, pemerintah menganjurkan untuk tidak mudik. https://t.co/DpoZjjmj7x'"
1248225406294999045,2020-04-09 12:25:02,"b'Mengapa ada bantuan khusus untuk Jabodetabek? Kita berikan ini agar warga mengurungkan niatnya untuk mudik, sebagai ikhtiar memutus mata rantai penyebaran Covid-19.'"
1248225275491442688,2020-04-09 12:24:31,"b'Pemerintah pusat akan memberikan bantuan khusus bahan pokok kepada 2,6 juta jiwa (1,2 juta kk) warga DKI Jakarta dan 1,6 juta jiwa (576 ribu kk) warga Bogor, Depok, Tangerang, dan Bekasi. \n\nBantuan tersebut masing-masing sebesar Rp600 ribu per bulan selama tiga bulan. https://t.co/JxMQ5dhd8V'"
1248065820711768064,2020-04-09 01:50:54,"b'Seniman musik yang menginspirasi, Glenn Fredly Deviano Latuihamallo, telah meninggalkan kita untuk selamanya.\n\nTurut berduka cita kepada keluarga besar mendiang, juga kepada seluruh insan musik Indonesia. Glenn Fredly telah berpulang, tapi karyanya tetap abadi dan kita nikmati. https://t.co/A82wmZRLb6'"
1247724391812591618,2020-04-08 03:14:11,"b'@BorisJohnson My thoughts and prayers are with you PM @BorisJohnson and your family in this difficult time. We, in Indonesia, wish you a speedy recovery and best wishes.'"
1247450851175612416,2020-04-07 09:07:14,"b'Prioritasnya pada keluarga-keluarga miskin, pengangguran, atau yang setengah menganggur. \n\nKendati begitu, dalam pelaksanaannya, program ini harus tetap menjalankan protokol kesehatan yang ketat, seperti tetap menjaga jarak dan memakai masker bagi setiap pekerjanya.'"
1247450749690249216,2020-04-07 09:06:49,"b'Di tengah pandemi Covid-19, pemerintah menyiapkan jaring pengaman sosial untuk masyarakat. Khusus untuk warga pedesaan, pemerintah menyiapkan program padat karya tunai. \n\nPelaksanaannya akan dipercepat untuk membuka lapangan kerja dan menjaga daya beli masyarakat di pedesaan. https://t.co/3z8GeEP0Tm'"
1247063384039641088,2020-04-06 07:27:34,"b'WHO merekomendasikan agar masyarakat menggunakan masker saat beraktivitas di luar rumah. Mari, kita patuhi imbauan tersebut. \n\nSilakan memakai masker kain yang dapat dicuci dan dikenakan berkali-kali. Untuk masker bedah dan N-95 saat ini diprioritaskan bagi dokter dan paramedis. https://t.co/yqB0lcJvYm'"
1247045526488363008,2020-04-06 06:16:37,"b'Untuk memutus rantai penyebaran Covid-19 di lembaga pemasyarakatan, pemerintah setuju untuk memberikan pembebasan bersyarat kepada sejumlah narapidana tindak pidana umum. \n\nPembebasan secara bersyarat ini tidak berlaku untuk koruptor. Bahkan dibicarakan di rapat pun tidak pernah https://t.co/eLBsGCbzUY'"
1246613132576870402,2020-04-05 01:38:26,"b'Sudah berapa lama Anda berdiam di rumah? Seminggu? Tiga minggu? Selama itu, sebagian kita mungkin menikmati berkumpul bersama keluarga. Sebagian merasa bosan. \n\nTapi itulah cara terbaik mengambil peran memutus mata rantai pandemi Covid-19. Bagaimana mengatasi kebosanan itu? (2/2) https://t.co/aP3fDjW698'"
1246610625897181186,2020-04-05 01:28:28,"b'Sudah berapa lama Anda berdiam di rumah? Seminggu? Tiga minggu? Selama itu, sebagian kita mungkin menikmati berkumpul bersama keluarga. Sebagian merasa bosan. \n\nTapi itulah cara terbaik mengambil peran memutus mata rantai pandemi Covid-19. Bagaimana mengatasi kebosanan itu? (1/2) https://t.co/kPyzZQbcEb'"
1245966785502785536,2020-04-03 06:50:05,"b'Untuk itulah, diperlukan langkah-langkah perbaikan yang menyeluruh dalam dunia pendidikan di Indonesia ini. Baik aspek peraturan, regulasi, anggaran, infrastruktur, manajemen sekolah, maupun masalah kualitas dan beban administratif guru.'"
1245966675012251650,2020-04-03 06:49:38,"b'Mengacu pada survei PISA (Programme for International Student Assessment) 2018, Indonesia memiliki tiga persoalan pendidikan, yakni, besarnya persentase murid berprestasi rendah, tingginya persentase siswa mengulang kelas, dan tingginya tingkat ketidakhadiran siswa di kelas.'"
1245966579315003394,2020-04-03 06:49:16,b'Ditiadakannya Ujian Nasional 2020 untuk memutus mata rantai penyebaran Covid-19 menjadi momentum bagi pemerintah untuk mengevaluasi standar pendidikan dasar dan menengah secara nasional. https://t.co/IUugUEuO56'
1245963361537253376,2020-04-03 06:36:28,"b'Tapi itu belumlah cukup. Masih terdapat 433 desa yang belum berlistrik di antara 75.000 desa di tanah air yang tersebar di Papua, Papua Barat, NTT, dan Maluku. \n\nSaya meminta jajaran pemerintah terkait untuk segera mengidentifikasi desa-desa tersebut dan menyelesaikannya.'"
1245963270130782208,2020-04-03 06:36:07,"b'Saat warga bekerja dari rumah, belajar dari rumah, beribadah di rumah, kita bersyukur bahwa rasio elektrifikasi Indonesia semakin meningkat tahun ke tahun. Hingga April 2020, rasio tersebut telah mencapai angka 99,48 %, melampaui target RPJMN 2015-2019 sebesar 96 %. https://t.co/wjSDOicygD'"
1245662103651770372,2020-04-02 10:39:23,"b'Ramadan tahun ini kita akan lalui saat kita berusaha mencegah meluasnya penyebaran Covid-19. Persiapannya harus sejak dini, terutama soal ketersediaan bahan pokok dan pangan di tengah masyarakat. \n\nSejauh ini, pasokan beras, daging, telur, gula, terigu, dll masih baik. https://t.co/4e6Omh3Od0'"
1245552219123900416,2020-04-02 03:22:44,"b'Pandemi Covid-19 bukan hanya membawa masalah kesehatan masyarakat tetapi juga implikasi ekonomi yang sangat luas. \n\nKarena itulah, setiap kebijakan pemerintah dalam penanggulangan pandemi ini di Tanah Air, senantiasa memperhitungkan kehidupan ekonomi masyarakat. https://t.co/SZTJXCf0qf'"
1245521805944573958,2020-04-02 01:21:53,"b'Melihat dari dekat fasilitas observasi, penampungan, dan karantina untuk pengendalian Covid-19 di Pulau Galang, 56 km dari Kota Batam. \n\nFasilitas yang direncanakan awal Maret kemarin ini, siap untuk dioperasikan paling lambat Senin depan. https://t.co/ZuElJVX0NC'"
1245339200565567488,2020-04-01 13:16:17,"b'Meninjau pembangunan fasilitas pengendalian infeksi penyakit menular di Pulau Galang, 56 km dari Batam, siang ini. Kapasitas bangunannya 1.000 tempat tidur yang dalam situasi saat ini untuk merawat dan mengisolasi pasien Covid-19. Insya Allah sudah siap hari Senin depan. https://t.co/zB3eCwiEgi'"
1245246993049325572,2020-04-01 07:09:53,"b'Dari Pangkalan TNI AU Halim Perdanakusuma, pukul sepuluh pagi ini saya terbang menuju Bandara Hang Nadim, Batam.\n\nDari Hang Nadim, saya akan langsung ke Pulau Galang, 60 km dari bandara, untuk melihat kesiapan Rumah Sakit Darurat Penanganan Covid-19 yang dibangun di sana. https://t.co/vGZuCh9la2'"
1245220399157145605,2020-04-01 05:24:12,"b'Perppu ini memberikan fondasi bagi pemerintah, bagi otoritas perbankan, dan bagi otoritas keuangan untuk melakukan langkah-langkah luar biasa dalam menjamin kesehatan masyarakat, menyelamatkan perekonomian nasional dan stabilitas sistem keuangan.'"
1245220293150273539,2020-04-01 05:23:47,"b'Pandemi Covid-19 bukan hanya membawa masalah kesehatan masyarakat tetapi juga implikasi ekonomi yang sangat luas. Karena itulah, saya menandatangani Perppu tentang Kebijakan Keuangan Negara dan Stabilitas Sistem Keuangan. https://t.co/N1GDf5nDOp'"
1244977457733627907,2020-03-31 13:18:51,b'Polri juga dapat mengambil langkah-langkah penegakan hukum yang terukur dan sesuai undang-undang agar PSBB dapat berlaku secara efektif dan mencapai tujuan mencegah meluasnya wabah.'
1244977316364578816,2020-03-31 13:18:17,b'Pemerintah sudah menerbitkan PP dan Keppres untuk melaksanakan amanat UU tersebut. Para kepala daerah saya minta tidak membuat kebijakan sendiri-sendiri yang tidak terkoordinasi. Semua kebijakan di daerah harus berada dalam koridor undang-undang dan PP serta Keppres tersebut.'
1244977257535254528,2020-03-31 13:18:03,"b'Menghadapi wabah Covid-19 ini, pemerintah menetapkan status kedaruratan kesehatan masyarakat. Untuk mengatasinya, opsi yang kita pilih adalah pembatasan sosial berskala besar atau PSBB, sesuai UU No 6 Tahun 2018 tentang Kekarantinaan Kesehatan. https://t.co/YaZK7jgLg7'"
1244962271740088321,2020-03-31 12:18:30,"b'Kedua, kita siapkan jaring pengaman sosial untuk masyarakat lapisan bawah agar tetap mampu memenuhi kebutuhan pokok dan menjaga daya beli. \n\nKetiga, menjaga dunia usaha, utamanya UMKM tetap beroperasi.'"
1244962215037304833,2020-03-31 12:18:17,"b'Memperhitungkan karakter negara kita, menghadapi Covid-19 ini, kebijakan pemerintah sangat jelas. Pertama, kesehatan masyarakat adalah yang utama. Kita berusaha mengendalikan penyebaran Covid-19 dan mengobati pasien yang terpapar. https://t.co/JIKejEEukO'"
1244592262983454720,2020-03-30 11:48:13,"b'Saya telah memerintahkan kepada jajaran terkait agar mengutamakan produk dalam negeri. Menurut data yang saya terima, ada 28 perusahaan produsen APD di negara kita. \n\nUntuk mendukung produksi APD tersebut, saya juga meminta agar impor bahan bakunya dipermudah.'"
1244592094657646592,2020-03-30 11:47:33,"b'Pekan lalu, pemerintah pusat telah mengirimkan 165.000 Alat Pelindung Diri ke seluruh provinsi, untuk dikirim lagi ke rumah-rumah sakit yang ada di daerah.\n\nAkan tetapi, Indonesia masih butuh sekitar 3 juta APD hingga akhir Mei. Karena itu, kita usahakan percepatan pengadaan APD. https://t.co/x5n0iWCjEX'"
1244586411149242368,2020-03-30 11:24:58,"b'Saya memerintahkan jajaran terkait memperhatikan ketersediaan alat tes cepat, PCR (polymerase chain reaction), dan VTM (viral transport media) demi kecepatan pemeriksaan di laboratorium. \n\nUntuk rapid test, tenaga kesehatan, keluarganya, khususnya status ODP, agar diprioritaskan. https://t.co/vwzYKG6XWc'"
1244542281547255808,2020-03-30 08:29:37,"b'Untuk keluarga-keluarga yang telanjur mudik ini, saya meminta para gubernur, bupati, dan wali kota untuk meningkatkan pengawasannya dan menerapkan protokol kesehatan yang ketat. \n\nHanya saja, screening yang dilakukan  jangan sampai berlebihan.'"
1244542142225121280,2020-03-30 08:29:03,"b'Delapan hari terakhir, ada 876 bus antarprovinsi yang membawa 14.000-an penumpang dari Jabodetabek ke provinsi lain di Jawa. Belum termasuk yang menggunakan kereta api, kapal, pesawat, dan mobil pribadi.\n\nMobilitas orang sebesar itu sangat berisiko memperluas penyebaran Covid-19. https://t.co/ASc3TLwjg1'"
1244081593871810560,2020-03-29 01:59:00,b'Apa itu isolasi mandiri? Mengapa 14 hari? Apa yang boleh dan tidak boleh dilakukan selama isolasi mandiri?\n\nInilah protokol dasar isolasi mandiri dalam penanganan Covid-19 yang diramu dari sumber resmi WHO dan para ahli kesehatan. (3/3) https://t.co/NoXnmc5N0j'
1244080999337586688,2020-03-29 01:56:38,b'Apa itu isolasi mandiri? Mengapa 14 hari? Apa yang boleh dan tidak boleh dilakukan selama isolasi mandiri?\n\nInilah protokol dasar isolasi mandiri dalam penanganan Covid-19 yang diramu dari sumber resmi WHO dan para ahli kesehatan. (2/3) https://t.co/e2LIHKjWp8'
1244079745605595136,2020-03-29 01:51:39,b'Apa itu isolasi mandiri? Mengapa 14 hari? Apa yang boleh dan tidak boleh dilakukan selama isolasi mandiri?\n\nInilah protokol dasar isolasi mandiri dalam penanganan Covid-19 yang diramu dari sumber resmi WHO dan para ahli kesehatan. (1/3) https://t.co/7YOEU7sm9Q'
1243724290215694337,2020-03-28 02:19:12,"b'Beberapa yang perlu kita jadikan kebiasaan selama pandemi korona belum berlalu. Tidak sulit menerapkannya, hanya membutuhkan kedisiplinan yang kuat. \n\nJaga jarak, karena kita saling menjaga. https://t.co/YjQsfTsDxV'"
1243186943921246208,2020-03-26 14:43:59,"b'Dalam KTT ini, saya mengajak para pemimpin negara G20 untuk bersama-sama memenangkan dua \xe2\x80\x9cpeperangan\xe2\x80\x9d yaitu melawan Covid-19 dan melawan pelemahan ekonomi dunia. \n\nUntuk itu, G20 harus aktif memimpin upaya menemukan anti-virus dan obat Covid-19, tentunya bersama WHO.'"
1243186832319188993,2020-03-26 14:43:32,"b'Dari Istana Bogor, pukul tujuh malam ini, saya mengikuti KTT Luar Biasa G20 yang membahas upaya penanganan Covid-19. \n\nKTT ini digelar secara virtual dan diikuti 20 negara anggota G20, 7 negara undangan, 9 organisasi internasional, dan 2 organisasi regional. https://t.co/UZfkG252W9'"
1242817429220147201,2020-03-25 14:15:40,"b'Telah berpulang ke hadirat Allah SWT, Ibunda kami, Hj. Sudjiatmi Notomihardjo, pukul 16.45 sore tadi di RS DKT Surakarta, karena sakit yang telah diidapnya selama empat tahun ini. \n\nMohon doa dari jauh, semoga segala dosa almarhumah diampuni oleh Allah SWT. Amin Ya Rabbal Alamin. https://t.co/rCsYK81VSz'"
1242721491814252546,2020-03-25 07:54:26,"b'Para penerima manfaat Kartu Sembako akan mendapat tambahan sebesar Rp50.000, menjadi Rp200.000 per keluarga, yang diberikan selama enam bulan. \n\nPemerintah juga mempercepat program Kartu Prakerja. Setiap peserta diberi honor insentif Rp1 juta per bulan selama 3-4 bulan. https://t.co/LEw2BDI1Ok'"
1242648497066618881,2020-03-25 03:04:23,"b'Saya pun tak bosan mengingatkan kita semua agar berdisiplin menerapkan physical distancing ini. Dengan kedisiplinan yang kuat, kita dapat mencegah penyebaran Covid-19. \n\nPercayalah, kita bangsa besar, bangsa petarung. Kita mampu melewati tantangan global yang berat sekarang ini.'"
1242648365516705792,2020-03-25 03:03:52,"b'Saya sungguh-sungguh mengapresiasi gerakan masyarakat yang telah turut menyebarkan informasi tentang physical distancing atau jaga jarak aman untuk menghindari penyebaran virus korona.\n\nKita harus kerja keras, kita harus bersatu dan bergotong-royong menghadapi tantangan ini. https://t.co/i4Cbfy4uFl'"
1242636498463121408,2020-03-25 02:16:42,"b'Pemerintah memberikan stimulus kepada masyarakat berpenghasilan rendah yang mengambil kredit kepemilikan rumah bersubsidi. \n\nYakni, subsidi selisih bunga selama 10 tahun jika bunga kreditnya di atas 5%, dan subsidi uang muka bagi yang akan mengambil kredit rumah bersubsidi. https://t.co/XcXE1ZGCtX'"
1242618657030541312,2020-03-25 01:05:49,"b'Hari Raya Nyepi di Tahun Baru Saka 1942 datang ketika segenap umat beragama, juga masyarakat Hindu, tengah menyepi dari keramaian. \n\nSemoga pandemi ini segera berlalu dan kita semua diberi keselamatan. https://t.co/o8Bdp9wpKW'"
1242396278106902529,2020-03-24 10:22:09,"b'Demi mencegah penyebaran Covid-19, para siswa telah ""belajar di rumah"". Di antara mereka, 8,3 juta siswa seharusnya mengikuti ujian nasional dari 106.000 satuan pendidikan di Tanah Air. \n\nKarena itulah, pemerintah memutuskan untuk meniadakan ujian nasional (UN) tahun 2020 https://t.co/leDC4dIwjG'"
1242395432413564929,2020-03-24 10:18:48,"b'Terhadap tukang ojek dan sopir taksi yang mengambil kredit sepeda motor atau mobil, serta nelayan yang sedang memiliki kredit perahu, mereka tidak perlu khawatir. \n\nTerhadap mereka, ada kelonggaran berupa relaksasi pembayaran bunga dan angsuran selama satu tahun.'"
1242395233863626752,2020-03-24 10:18:00,"b'Terkait keluhan dari usaha-usaha mikro dan kecil yang terdampak dari pandemi Covid-19, OJK memberi kelonggaran berupa relaksasi kredit baik dari perbankan maupun nonbank. \n\nTerhadap mereka, akan diberikan penundaan cicilan sampai satu tahun dan juga penurunan bunga. https://t.co/zddtDbLN0N'"
1242394420281933824,2020-03-24 10:14:47,"b'Saya telah menandatangani Inpres no 4/2020 tentang refocusing kegiatan dan realokasi anggaran sebagai landasan hukum untuk mempercepat penanganan Covid-19, baik terkait isu kesehatan maupun bantuan sosial untuk mengatasi dampak kehidupan ekonomi yang ditimbulkannya. https://t.co/2Bk8JSCpYm'"
1242393186095357953,2020-03-24 10:09:52,"b'Setiap negara memiliki karakter, budaya, dan tingkat kedisplinan yang berbeda-beda. Dengan pertimbangan itu, menghadapi Covid-19 ini, kita tidak memilih jalan lockdown. \n\nDi negara kita, yang paling tepat adalah physical distancing -- meminta setiap warga menjaga jarak aman. https://t.co/BS8iniV8bV'"
1242392049208320000,2020-03-24 10:05:21,"b'Ketika sekolah diliburkan, kantor ditutup, kemudian tempat-tempat transaksi ekonomi seperti pasar ditutup, maka dihitung pula berapa pedagang asongan, becak, atau sopir yang akan tidak bekerja, dll. \n\nDengan begitu, bantuan sosial kepada mereka dapat dihitung dan dialokasikan.'"
1242391968182755331,2020-03-24 10:05:02,"b'Pandemi Covid-19 yang telah menyebar di 189 negara di dunia, benar-benar sulit dicegah masuk ke satu negara, atau ke daerah. \n\nMaka itu, pemerintah pusat dan daerah  harus memiliki kebijakan yang sejalan, menghitung dampak kesehatan dan sosial ekonomi dari setiap kebijakan. https://t.co/lEWMrFWLNk'"
