id,created_at,text
1144479380757835776,2019-06-28 05:35:22,"b'Alhamdulillah, tiba di Jepang, pagi ini, untuk hadir bersama para pemimpin negara-negara ekonomi terbesar dunia di KTT G20 di Osaka, 28-29 Juni 2019, \n\nDi KTT G20 ini saya akan berbicara tentang dua hal: inovasi di bidang ekonomi digital dan upaya mengatasi kesenjangan. https://t.co/MWsAeAWHh0'"
1144428002287030272,2019-06-28 02:11:12,"b'Proses pesta demokrasi yang telah berlangsung beberapa bulan telah usai. Tidak ada lagi 01 dan 02, yang ada hanyalah persatuan Indonesia.\n\nDan saya memastikan bahwa presiden dan wakil presiden terpilih adalah presiden dan wakil presiden bagi seluruh rakyat Indonesia. https://t.co/Sv926VPLSW'"
1144075694567112704,2019-06-27 02:51:16,"b'Argentina adalah mitra perdagangan besar Indonesia di Amerika Selatan.\n\nKepada Presiden Mauricio Macri yang datang kemarin, saya menawarkan produk dan jasa industri strategis Indonesia, dari pesawat, jasa pemeliharaan pesawat, lokomotif dan  gerbong kereta sampai hasil pertanian. https://t.co/zhlmrBw3gL'"
1143866852784791554,2019-06-26 13:01:24,"b'Jersey timnas Argentina dari Presiden Argentina Mauricio Macri yang berkunjung ke Indonesia, hari ini. Sementara saya, menghadiahkan bola sepak buatan Indonesia.\n\nKami bertukar cenderamata seusai pertemuan bilateral di Istana Bogor.\n\nSelamat datang Presiden Mauricio Macri. https://t.co/cHTE7IEEis'"
1143779559701020672,2019-06-26 07:14:32,"b'Selama 12 tahun ini, kontingen TNI AD selalu menjuarai lomba tembak bergengsi di berbagai kompetisi dengan senjata buatan dalam negeri.\n\nYa, senapan mesin, pistol, senjata berat, bahkan panser dan tank sudah lama diproduksi PT Pindad, BUMN Industri Strategis Indonesia. https://t.co/N7ljxTC1uI'"
1142759184691150848,2019-06-23 11:39:55,"b'Lagu The ASEAN Way dinyanyikan dan penampilan budaya berjudul Vivid ASEAN disuguhkan pagi ini di Hotel Athenee, Bangkok. ""Saya menyambut Anda sekalian di Kerajaan Thailand, tempat lahirnya ASEAN,"" kata PM Thailand Prayut Chan-o-cha.\n\nKTT ke-34 ASEAN pun resmi dibuka. https://t.co/HpF332hNfg'"
1142645623193083905,2019-06-23 04:08:40,"b'Obrolan sejenak bersama Perdana Menteri Singapura Lee Hsien Loong sebelum menghadiri pleno KTT ke-34 ASEAN di Hotel Athenee Bangkok, kemarin. \n\nKami hanya bicara soal rencana pertemuan leaders\xe2\x80\x99 retreat di Singapura awal bulan Desember nanti. https://t.co/krs5JJV3fn'"
1142621719238074369,2019-06-23 02:33:41,"b'Akhir pekan yang padat di Bangkok. \n\nKemarin sore, seusai beberapa pertemuan bilateral, saya hadir di Pertemuan Pemimpin ASEAN dengan ASEAN Business Advisory Council, lalu Perwakilan Pemuda ASEAN, AIPA, juga Pleno KTT di mana saya menyampaikan Outlook ASEAN mengenai Indo-Pasifik. https://t.co/xdlHVAIS8V'"
1142427479828623360,2019-06-22 13:41:51,"b'Bertemu Perdana Menteri Viet Nam Nguyen Xuan Phuc di Bangkok tadi, kami saling menyelamati: PM Viet Nam menyampaikan ucapan selamat atas proses dan hasil Pemilu di Indonesia, dan saya menyampaikan selamat kepada Viet Nam yang akan menjadi negara anggota DK PBB pada 2020-2021. https://t.co/5CTCc3Ujk5'"
1142409857812713472,2019-06-22 12:31:49,"b'Bertemu Aung San Suu Kyi, State Counsellor Republik Uni Myanmar yang juga menghadiri KTT ke-34 ASEAN, beberapa jam setiba di Bangkok siang tadi.\n\nTopik pembicaraan kami tentu tak jauh-jauh dari isu Rakhine State yang semenjak dulu telah menjadi perhatian kita. https://t.co/ZSSoGAKkyW'"
1142312530036981760,2019-06-22 06:05:04,b'Bertolak menuju Bangkok pagi ini untuk menghadiri KTT ke-34 ASEAN. KTT ini akan berlangsung selama dua hari dengan agenda yang padat.\n\nMohon doa dari seluruh rakyat agar perjalanan ini lancar. https://t.co/bIsyyPoaXH'
1142027229049737216,2019-06-21 11:11:23,"b'Menjelang salat Jumat tadi, saya ke sini: meninjau perkembangan pembangunan landas pacu ketiga Bandara Internasional Soekarno-Hatta di Tangerang. Dan saya senang, landas pacu ini sudah hampir selesai. Semoga bulan Juli nanti, sudah bisa dioperasikan. https://t.co/e4qzQtcbb2'"
1141914554122637312,2019-06-21 03:43:40,"b'Terima kasih untuk segala perhatian, doa, dukungan, dan amanah yang tercurah dari seluruh rakyat kepada saya dan keluarga.\n\nSaya tak pernah merayakan hari ulang tahun, dan tak perlu ada pesta, kecuali rasa syukur ke hadirat Allah SWT, dan negeri yang menanti kerja bersama kita. https://t.co/yUg9g9MPbG'"
1141681814831947776,2019-06-20 12:18:50,"b'Menyerahkan 3.200 lembar sertifikat hak atas tanah bagi masyarakat Gresik di GOR Tridharma Petrokimia siang tadi.\n\nDi seluruh Jawa Timur, dari 19.498.377 bidang tanah, 54,45 % di antaranya sudah bersertifikat. https://t.co/2odJbu00mj'"
1141555759953485824,2019-06-20 03:57:56,"b'Tiba di Bandar Udara Internasional Juanda, Sidoarjo, pagi ini untuk kunjungan kerja di Jawa Timur.\n\nHari ini, saya menyerahkan ribuan sertifikat hak atas tanah untuk rakyat di Kabupaten Gresik. https://t.co/BWxcBMDUvt'"
1141161673497071617,2019-06-19 01:51:59,"b'Jenis usaha mikro, kecil, dan menengah di Indonesia saat ini ada 62,9 juta unit usaha.\n\nPemerintah tentu akan menyediakan fasilitas kepada UMKM-UMKM ini tetapi harus menimbang satu hal: jangan sampai fasilitas itu justru mematikan jiwa dan karakter kewirausahaan mereka. https://t.co/2TB5isKKOP'"
1140551814472855552,2019-06-17 09:28:37,"b'Ikut berpawai di pembukaan Pesta Kesenian Bali 2019, pesta yang mengusung tema Bayu Pramana. Napas kehidupan, yang memuliakan sumber daya angin. https://t.co/8AOKeNWeNZ'"
1140063722339098624,2019-06-16 01:09:07,"b'Dengan baju adat berwarna coklat, dipadukan dengan udeng, saput dan kamen ungu ini, saya menghadiri pembukaan Pesta Kesenian Bali 2019 di Denpasar, kemarin. Tidak sekadar hadir, saya dan Ibu Negara bahkan turut menjadi peserta pawai dengan naik mobil hias. \n\nTerima kasih, Bali. https://t.co/r3q9kMnMCk'"
1139756640209526784,2019-06-15 04:48:53,"b'Menyusuri tanggul Waduk Muara Nusa Dua, Denpasar, kemarin. Seiring meningkatnya kegiatan pariwisata di Kuta, Tanjung Benoa, dan Nusa Dua, maka pemerintah menata dan merehabilitasinya pada 2017 lalu. \n\nJika rampung akhir 2019, Waduk Muara Nusa Dua juga akan jadi tempat wisata. https://t.co/qkzAajfyuE'"
1139699452669677569,2019-06-15 01:01:38,"b'Bermain bola dengan Jan Ethes di atas hamparan pasir Pantai Sanur, Bali. https://t.co/NhhROFr9AM'"
1139498401945362433,2019-06-14 11:42:44,"b'Sebanyak 3.000 lembar sertifikat hak atas tanah saya serahkan hari ini kepada masyarakat dari tujuh kota dan kabupaten di Provinsi Bali. \n\nYang menggembirakan, Bali akan jadi provinsi pertama di Indonesia yang seluruh bidang tanahnya bersertifikat tuntas tahun ini. Alhamdulillah. https://t.co/GLeR2ATQot'"
1139467130485665794,2019-06-14 09:38:28,"b'Selama tujuh bulan masa kampanye kemarin, kegiatan bagi-bagi sepeda dilarang. Pada acara pembagian sertifikat tanah di Bali, hari ini, saya kembali membagi sepeda untuk mereka yang bisa menjawab pertanyaan.\n\nJadi, selamat kepada pemenang: menerima sertifikat, dapat sepeda pula. https://t.co/FDVQtf0Iz0'"
1139428034581164032,2019-06-14 07:03:07,"b'Dalam lima tahun ini, kita telah membangun lebih dari 5.000 pasar besar dan sekitar 8.900 pasar desa. Ke depan, target pemerintah masih sama.\n\nPasar-pasar di seluruh Indonesia harus hidup sebagai tempat bertemunya penjual dan pembeli, produk-produk petani, nelayan, pengrajin. https://t.co/YxTE3iUp0P'"
1139393177880649734,2019-06-14 04:44:37,"b'Sesaat setelah meninjau Pasar Sukawati, seorang pria mencegat saya di jalan keluar. Di tangannya ada selembar kertas. Ternyata itu foto saya.\n\nRupanya, ia ingin meminta tanda tangan. Katanya untuk kenang-kenangan. Maka berbantalkan punggung ajudan, foto itu saya tanda tangani. https://t.co/EoMHsU6KcV'"
1139383566645653505,2019-06-14 04:06:25,"b'Anda yang ke Bali dan belum ke Pasar Sukawati, itu rasanya belum ke Bali. Pasar seni di Gianyar ini adalah pusat kerajinan seni khas Bali.\n\nSukawati akan direvitalisasi menjadi pasar rakyat yang modern. Jika lancar, wajah dan suasana baru Pasar Sukawati akan rampung tahun depan. https://t.co/jS7fZfsjRX'"
1139346949260206081,2019-06-14 01:40:55,"b'Mendarat di Bandara I Gusti Ngurah Rai di Bali, semalam.\n\nHari ini, Insya Allah, saya hendak bertemu dan menyerahkan sertifikat hak atas tanah kepada masyarakat di Kabupaten Bangli. Setelah itu, meninjau kawasan wisata Waduk Muara Nusa Dua di Kota Denpasar.\n\nSelamat pagi. https://t.co/jD8C6WQiph'"
1138991377927135232,2019-06-13 02:08:00,"b'Perang dagang Amerika Serikat dan Tiongkok yang menimbulkan gejolak perekonomian global bisa jadi peluang bagi Indonesia.\n\nSaat tarif bea masuk terhadap produk Tiongkok dinaikkan oleh AS, para pengusaha bisa manfaatkan peluang ini dengan memperbesar ekspor ke AS. https://t.co/som2MUT0Ms'"
1138734098808131584,2019-06-12 09:05:40,b'Selamat kepada Pak Arinal Djunaidi dan Bu Chusnunia yang hari ini resmi menjadi Gubernur dan Wakil Gubernur Lampung periode 2019-2024.\n\nSelamat bekerja. https://t.co/lUHz7hGFzl'
1138443983661568000,2019-06-11 13:52:51,"b'Senang sekali menerima Pak Jusuf Kalla siang ini di istana. Selain berdiskusi tentang pekerjaan, Pak JK berbagi cerita tentang Lebaran kemarin: apa yang beliau lakukan, makanan favorit, juga tentang cucu-cucunya.\n\nInilah cerita Lebaran Pak JK. https://t.co/jHNHc7LuZr'"
1137959130553962496,2019-06-10 05:46:13,"b'Selamat siang, Indonesia. Libur Lebaran usai sudah. Saatnya kembali bekerja. https://t.co/M7lfcTnjlN'"
1137659221917310976,2019-06-09 09:54:29,"b'Berbelanja alat dapur dan aneka buah di Pasar Gede Solo yang sedang  ramai pengunjung pagi tadi.\n\nBelanjaannya berat, tapi tak apa. Ada Gibran dan @KaesangP yang sigap bantu mengangkatnya \xf0\x9f\x98\x80 https://t.co/M5tSTbvgKf'"
1137543264255393792,2019-06-09 02:13:43,"b'Bila @KaesangP bertanya, dan Jan Ethes menjawab ... https://t.co/UEBfFrDJCc'"
1137303157560578048,2019-06-08 10:19:37,"b'Malam di Yogyakarta, menikmati sate gembus bersama keluarga di Warung Klangenan. Di warung ini, Anda dapat memanggang sendiri sate pada tungku di atas meja. \n\nKami berbagi tugas: Saya merekam, Ibu Iriana menyantap sate, @kaesangp yang mengipasi bara apinya \xf0\x9f\x98\x80 https://t.co/6em4T58DHa'"
1136951905668616194,2019-06-07 11:03:52,"b'Jumatan di Masjid Syuhada, masjid bersejarah di Kotabaru, Yogyakarta, hari ini bersama Jan Ethes, Gibran, dan Kaesang. \n\nDari Masjid Syuhada, kami kembali naik andong untuk pulang ke Gedung Agung. https://t.co/lJwmTIUe4S'"
1136918430919958528,2019-06-07 08:50:51,"b'Bersilaturahmi ke keluarga Keraton Ngayogyakarta Hadiningrat pada hari ketiga Lebaran di Yogyakarta, hari ini. \n\nTerima kasih atas sambutan hangat Sri Sultan Hamengkubuwono X dan keluarga besar keraton. https://t.co/zGShMR0JTC'"
1136833234552086528,2019-06-07 03:12:19,"b'Libur Lebaran di Yogyakarta bersama Jan Ethes dan Kaesang. Mau ke mana? Kota ini menawarkan banyak tempat yang asyik.\n\nSemalam, kami ke Jalan Malioboro, ikon wisata kota ini. Kami ke mal, mencobai beberapa wahana permainan anak, lalu pulang ke Gedung Agung dengan andong wisata. https://t.co/ViCJsgJBhU'"
1136660839824384000,2019-06-06 15:47:17,b'Bila Jan Ethes hormat bendera dan menjawab awak media ... https://t.co/FgL38NTgSy'
1136254202437443584,2019-06-05 12:51:27,b'Berlebaran bersama masyarakat ... https://t.co/j7VPc01Cq7'
1136157454071238658,2019-06-05 06:27:00,"b'Salat Id di Masjid Istiqlal, Jakarta pagi ini. Prof. Said Agil Husin Al-Munawar dalam khotbahnya antara lain menyampaikan, Idulfitri adalah momentum bagi umat untuk saling memaafkan.\n\nAlquran mengajarkan manusia untuk tidak saling bertikai, dan menebar manfaat kepada sesama. https://t.co/VF965k1Fkz'"
1136071700913635328,2019-06-05 00:46:15,"b'Di mana Anda merayakan hari Lebaran? Bagaimana perjalanan mudik Anda? \n\nSemoga lancar dan dapat berbagi kebahagiaan bersama keluarga dan handai taulan di kampung halaman. \n\nMari, kita rayakan hari kemenangan ini dengan saling memberi maaf untuk segala salah dan khilaf. https://t.co/zsdtH1Emlf'"
1135952250814099456,2019-06-04 16:51:36,"b'Setelah sebulan berpuasa, tiba jugalah kita di hari yang fitri. Selamat menikmati silaturahmi dengan keluarga dan handai taulan.\n\nMari, jadikan Idulfitri ini sebagai ajang mempererat persatuan dan persaudaraan kita. Lalu, bersama kita bangun Indonesia yang lebih baik dan maju. https://t.co/GwvN2ix6VZ'"
1135188523139526656,2019-06-02 14:16:49,"b'Dengan memohon rida Allah SWT, kita lepas kepergian Ibu Ani Yudhoyono menghadap kepadaNya dengan tenang. Semoga Allah SWT berkenan menerima amal ibadah dan mengampuni segala khilafnya.\n\nIbu Ani telah pergi, tetapi namanya akan tetap hidup di hati rakyat yang mencintainya. https://t.co/eHIJKuR1rK'"
1135023556587270145,2019-06-02 03:21:18,"b'Mengapa kita memperingati Hari Lahir Pancasila yang dirumuskan 74 tahun lalu? \n\nKita ingin meneguhkan komitmen untuk mengamalkan nilai-nilai luhur Pancasila, saling toleran, hidup rukun, gotong royong, serta melawan paham-paham anti-Pancasila. https://t.co/w4fpy6sFvA'"
1134716125445382147,2019-06-01 06:59:40,"b'Innalillahi wa inna ilaihi rajiun. Selamat jalan Ibu Ani Yudhoyono, seorang perempuan teladan, Ibu Negara dan istri yang setia, dan seorang ibu yang baik. \n\nSemoga amal ibadahnya diterima di sisi Allah SWT dan segenap keluarga besar almarhumah diberiNya kekuatan dan kesabaran. https://t.co/ILGlE8ddsT'"
1134674875992305664,2019-06-01 04:15:46,b'Berpuluh tahun lamanya Pancasila menjadi pemandu langkah bagi bangsa ini untuk mampu bertahan dan tumbuh di tengah deru ombak ideologi lain yang berusaha menggesernya. \n\nPancasila membuat kebinekaan bangsa justru menjadi kekuatan besar. https://t.co/5rVDpCvGMN'
1134630229945643012,2019-06-01 01:18:21,"b'Wajah para pemudik kereta ekonomi di Stasiun Pasar Senen kemarin terlihat lebih cerah. Jumlah pemudik tahun ini naik dari tahun lalu, dengan beragam jalur: kereta, jalan tol, laut dan pesawat udara.\n\nHati-hati di jalan, nanti pulang lagi dan kita kembali bekerja semuanya. https://t.co/DcE8vr50NM'"
1134426224262909952,2019-05-31 11:47:43,"b'Di Stasiun Pasar Senen, Jakarta, bertemu para penumpang kereta api yang hendak mudik Lebaran, sore ini. Suasananya jauh lebih baik dari masa saya mudik dengan kereta tahun 1985-1986 lampau.\n\nSelamat mudik, hati-hati di jalan, salam untuk keluarga dan kerabat di kampung halaman. https://t.co/esbxGeXiSf'"
1133969524389076992,2019-05-30 05:32:57,b'Lebih rapi menyambut Lebaran yang sebentar lagi datang ... https://t.co/Y38aMk1cPt'
1133702925006528513,2019-05-29 11:53:35,"b'Tiga tahun berturut-turut sejak 2016, pemerintah pusat mendapatkan opini wajar tanpa pengecualian (WTP) dari BPK. Alhamdulillah.\n\nArtinya, pertanggungjawaban pemerintah atas pelaksanaan APBN 2018 dalam laporan keuangan, telah disajikan secara standar akutansi pemerintahan. https://t.co/QNXj47nfp0'"
1133537444257624064,2019-05-29 00:56:01,"b'Menerima Syamsuri Firdaus, qari muda asal NTB, yang jadi pemenang MTQ Internasional ke-7 di Istanbul, Turki. Pada MTQ yang digelar pekan lalu di Masjid Agung Camlica Istanbul itu, Syamsuri jadi pemenang di antara peserta dari 68 negara. \n\nSelamat. https://t.co/87RyQbUnSl'"
1132989393667362816,2019-05-27 12:38:16,"b'Kelontong dagangan Pak Usma di Jl. Wahid Hasyim, Jakarta, ludes dalam sekejap dijarah para perusuh pada 22 Mei lalu. Dihitung-hitung, kerugiannya sampai 20-an juta rupiah.\n\nHarapannya hanya satu: ingin berdagang dengan tenang di kota Jakarta yang aman. https://t.co/BjBwXP9Txf'"
1132914238559670272,2019-05-27 07:39:37,"b'Berbuka puasa bersama para pengusaha muda HIPMI semalam. Saya mengajak mereka terlibat dalam dua fokus pembangunan pemerintah: infrastruktur pada lima tahun terakhir, dan pembangunan SDM lima tahun mendatang.\n\nTerima kasih, HIPMI. https://t.co/0Ac7BC0qfl'"
1132814277029519360,2019-05-27 01:02:24,"b'Mahkamah Konstitusi adalah lembaga negara penjaga konstitusi yang menjadi landasan utama tegaknya negara. Dibentuk dalam sistem ketatanegaraan kita, agar memiliki kepercayaan dari publik. \n\nSaya meminta kepada semua pihak untuk tidak merendahkan lembaga penjaga konstitusi ini. https://t.co/YeVq7VY71C'"
1132286589034422272,2019-05-25 14:05:34,"b'Lamun siro sekti, ojo mateni\nLamun siro banter, ojo ndhisiki\nLamun siro pinter, ojo minteri https://t.co/YxDK0CHCJ8'"
1131765490244902912,2019-05-24 03:34:54,b'Heartiest congratulations to PM @narendramodi on the successful elections and for once again winning the trust of the people of India. \n\nThe Government of Indonesia looks forward to working with India in pursuit of our countries\xe2\x80\x99 common goals and shared vision. \xf0\x9f\x87\xae\xf0\x9f\x87\xa9 \xf0\x9f\x87\xae\xf0\x9f\x87\xb3 https://t.co/WCbSGXj5Cu'
1131409572571172864,2019-05-23 04:00:37,"b'Thank you PM @ScottMorrisonMP and warmest regards from all of us in Indonesia. Australia has been one of our great allies, and we look forward to continue deepening our ties and strategic partnership in times to come. https://t.co/KvSZiDom2M'"
1131407304719458304,2019-05-23 03:51:36,"b'Thank you PM @narendramodi for the kind words. I, too, look forward to continue strengthening the partnership between our two great countries in the future. https://t.co/Y5DdAvGHPC'"
1131406688320249856,2019-05-23 03:49:09,b'Terima kasih Dr M @chedetofficial. Indonesia dan Malaysia adalah dua bangsa serumpun. Sampai kapan pun tetap bersaudara dan bekerja sama dengan erat. https://t.co/qy1sekoTOA'
1131395059226750981,2019-05-23 03:02:57,"b""Innalillahi wa inna ilaihi raji'un. Turut berduka cita atas berpulang ke Rahmatullah, Ustaz Muhammad Arifin Ilham di Malaysia, kemarin. \n\nSemoga amal ibadah almarhum diterima di sisi Allah SWT dan seluruh keluarga yang ditinggalkan diberiNya ketabahan dan kesabaran. https://t.co/ZDfYRHghFt"""
1131174461703639040,2019-05-22 12:26:22,"b'Kita tidak akan memberikan ruang untuk perusuh-perusuh yang akan merusak negara kita, Negara Kesatuan Republik Indonesia. \n\nTidak ada pilihan, TNI dan Polri akan menindak tegas sesuai dengan aturan hukum yang berlaku. https://t.co/LS4s1A6PQY'"
1131173874991808514,2019-05-22 12:24:02,"b'Saat ini, situasi masih terkendali. Saya berharap masyarakat tak perlu khawatir.\n\nSaya mengajak masyarakat merajut kembali persatuan, persaudaraan, dan kerukunan kita, karena Indonesia adalah rumah milik bersama. https://t.co/7TP9TjctxU'"
1130776437571514368,2019-05-21 10:04:46,"b'Di antara warga penghuni Kampung Deret di Jakarta, siang ini. Saya telah mendengar pengumuman rekapitulasi suara nasional Pemilu 2019 oleh KPU. \n\nKini saatnya melangkah ke depan. Kita bersatu padu membangun bangsa dan Tanah Air demi kedamaian dan kesejahteraan generasi mendatang. https://t.co/E8CeuEIVyV'"
1130696892801699840,2019-05-21 04:48:41,"b'Pada 28 Desember 2015 lalu, saya meletakkan batu pertama pembangunan Bendungan Rotiklot di Belu, NTT \xe2\x80\x94 tak jauh dari perbatasan Timor Leste. \n\nEmpat setengah tahun kemudian, saya datang untuk meresmikannya.\n\nInilah Bendungan Rotiklot itu. https://t.co/dhcVE3L8Pb'"
1130445864327974912,2019-05-20 12:11:11,"b'Akhirnya selesai juga. Bendungan Rotiklot di Belu, NTT sudah terisi air saat saya resmikan, sore ini. Nantinya, masyarakat Belu bisa bercocok tanam di musim kemarau. \n\nBendungan Rotiklot adalah satu dari tujuh bendungan yang dibangun di NTT sepanjang 2015-2019. https://t.co/dDjSKyZLYc'"
1130352221844004864,2019-05-20 05:59:05,"b'Tiba di Bandar Udara Internasional El Tari, Kota Kupang, NTT pukul dua belas siang ini. Dari Kupang, saya berganti pesawat menuju Kabupaten Belu.\n\nJika tak ada halangan, hari ini, saya meresmikan Bendungan Rotiklot di Dusun Rotiklot, Kecamatan Kakuluk Mesak, Belu. https://t.co/oKKmg0khS5'"
1130294939844194306,2019-05-20 02:11:28,"b'111 tahun lalu, para pemuda menolak terlelap dalam keterbelakangan. Mereka bangkit, memperkuat diri, mendirikan Budi Utomo, dll.\n\nKebangkitan itu kita peringati kini dengan tekad baru: membangun Indonesia yang maju, yang sanggup mengelola perbedaan, damai dan tanpa kekerasan. https://t.co/IJuwBAhMXQ'"
1129983193346560000,2019-05-19 05:32:42,"b'Semoga semua makhluk hidup sejahtera, bebas dari penyakit, damai dan berbahagia. https://t.co/XQeuHu0hTK'"
1129917556083503104,2019-05-19 01:11:52,"b'Berjalan di pinggir Tukad (sungai) Badung di Denpasar Barat, menikmati keindahan sungai yang mengalir berkelok-kelok dan membelah dua pasar tradisional, Pasar Badung dan Pasar Kumbasari.\n\nBantaran Tukad Badung telah ditata, dihiasi lampu-lampu, tempat duduk, dan fasilitas lain. https://t.co/Wh6e1POrG6'"
1129704313595371522,2019-05-18 11:04:31,"b'Baru dua bulan lalu saya resmikan, Pasar Badung di Desa Dauh Puri Kangin, Denpasar Barat, kini sudah ramai. Pasar begitu hidup, wajah para pedagang cerah, lingkungan bersih, dan harga bahan pokok stabil.\n\nDi lantai dua pasar saya sempat belanja buah-buahan untuk berbuka puasa. https://t.co/UnpWPwKONm'"
1129659584874860544,2019-05-18 08:06:47,"b'Jalan-jalan dan belanja cenderamata di kampung Sasak yang alami dan unik di Desa Rembitan, Lombok Tengah, NTB. https://t.co/Y5xpvRmWGt'"
1129595197166252032,2019-05-18 03:50:56,"b'Daerahnya tandus, tapi Desa Kutuh di Badung, Bali jadi desa tujuan sport tourism berkat Dana Desa untuk membangun sarana olahraga, dll. Ada lomba paralayang, penyewaan lapangan bola, juga Pantai Pandawa.\n\nDari semuanya Desa Kutuh mendapatkan revenue sampai Rp50 miliar per tahun. https://t.co/BBzO0rxdh9'"
1129567425383489536,2019-05-18 02:00:35,"b'Berkunjung ke Kawasan Ekonomi Khusus Pariwisata Mandalika di Lombok, NTB, Jumat. Hotelnya sudah tujuh yang bisa disewa, tiga sedang dibangun. \n\nSaya juga ingin memastikan bahwa Mandalika siap untuk menggelar MotoGP 2021. Ini upaya kita menggerakkan perekonomian wilayah sekitar. https://t.co/geuz8pXL7J'"
1129415588265091072,2019-05-17 15:57:14,"b'Buku adalah jendela dunia. Melalui buku manusia melanglang buana ilmu pengetahuan. Ayo, budayakan membaca buku.\n\nSelamat Hari Buku Nasional 2019. https://t.co/dCqOKnUH3t'"
1129415142003826688,2019-05-17 15:55:28,"b'Jumatan di Masjid Nur Syahada di Desa Rembitan, Lombok Tengah, NTB hari ini. Masjidnya unik, beratap dari alang-alang, berdinding bambu, dan tiang kayu. \n\nMasjid ini berdiri di tengah rumah-rumah warga asli Suku Sasak yang adat dan budayanya masih terjaga. https://t.co/U26B6EVq7W'"
1129312366192017409,2019-05-17 09:07:04,"b'Para prajurit TNI dan anggota Polri tengah bersenandung selawat ketika saya tiba di Lapangan Monas, kemarin sore. Indah dan menggugah hati. \n\nLalu, sambil menunggu saat berbuka kami mendengarkan tausiah Ramadan dari Habib Muhammad Lutfhi Bin Yahya. https://t.co/OePrWUnC3v'"
1129236887829270528,2019-05-17 04:07:08,"b'Di luar jajaran penyelenggara dan pengawas Pemilu serentak pada 17 April lalu, soliditas dan kerja profesional seluruh anggota TNI dan Polri memungkinkan perhelatan besar demokrasi itu berjalan dengan demokratis, jujur, adil, aman, dan damai.\n\nTerima kasih TNI dan Polri. https://t.co/Iye7gPRgpK'"
1129190130072186882,2019-05-17 01:01:21,"b'Badan Amil Zakat Nasional menyebutkan, sepanjang tahun 2018 zakat yang terkumpul sebesar Rp8,1 triliun. Sangat kecil dibanding perkiraan potensi zakat nasional 2018 sebesar 1,75 % dari PDB atau Rp232 triliun! \n\nPotensi pertumbuhan dan penyaluran zakat di negara kita sangat besar. https://t.co/RIxGIGUEBl'"
1128985383067197440,2019-05-16 11:27:45,"b'Menunaikan zakat melalui Badan Amil Zakat Nasional (BAZNAS) pada hari ke-11 Ramadan di Istana Negara, siang ini. https://t.co/ruDOCGuAgb'"
1128672915837243392,2019-05-15 14:46:07,"b'""Negara kita ini aturan mainnya, konstitusinya, undang-undangnya, aturannya, jelas. Ikuti."" Itu jawaban saya atas pertanyaan soal hasil Pemilu 2019. Hanya KPU yang berwewenang merekapitulasi dan mengumumkan hasil Pemilu.\n\nKeberatan atas hasilnya? Ya ke Mahkamah Konstitusi. https://t.co/IWFATWOsMH'"
1128489074887544833,2019-05-15 02:35:36,"b'Buka puasa yang penuh tawa dan meriah bersama para wartawan yang bertugas di lingkungan istana, kemarin. Sehari-hari meliput di istana, kali ini mereka berbagi peran: ada yang mengumandangkan azan, memimpin doa, juga jadi imam salat magrib. \n\nTerima kasih. https://t.co/fRs6N2Kxdk'"
1128312016031047681,2019-05-14 14:52:02,"b'Hari ini saya meluncurkan Masterplan Ekonomi Syariah Indonesia 2019-2024 yang jadi pedoman Indonesia menjadi pelaku utama ekonomi syariah dunia. \n\nDalam MEKSI itu kita menguatkan rantai nilai halal pada sektor potensial, menguatkan keuangan syariah, UMKM, dan ekonomi digital. https://t.co/7zmrYyVc12'"
1128104100774604800,2019-05-14 01:05:51,"b'Jalan Tol Pandaan-Malang, berlatar gunung dan sawah-sawah, menuju kemajuan Malang Raya. https://t.co/GSez6Dc5lA'"
1127931090721595392,2019-05-13 13:38:22,"b'Mau melihat indahnya pemandangan gunung-gunung Arjuno, Kawi dan Bromo - Semeru di Jawa Timur sambil melaju mulus di jalan bebas hambatan? \n\nMelintaslah di Jalan Tol Pandaan-Malang yang sebagian, sepanjang 30 km dari Pandaan sampai Singosari, saya resmikan hari ini. https://t.co/pvF2DP6ikg'"
1127802808789430272,2019-05-13 05:08:37,"b'Tiba di Pangkalan TNI AU Abdul Rahman Saleh, Kabupaten Malang, beberapa saat lalu untuk sebuah kunjungan di Jawa Timur. \n\nHari ini, jika tak ada aral melintang, saya akan meresmikan pengoperasian jalan tol Pandaan-Malang di Gerbang Tol Singosari. https://t.co/OQWlGkXLYj'"
1127740936417497088,2019-05-13 01:02:46,"b'Selamat pagi, Indonesia... https://t.co/99P0dpFNpP'"
1127022673261760513,2019-05-11 01:28:39,"b'Sekarang saatnya fokus pada pembangunan SDM. Sebanyak 51 % tenaga kerja kita lulusan SD. Ini harus kita selesaikan besar-besaran dengan pelatihan-pelatihan. \n\nLalu, pendidikan kejuruan dihubungkan dengan industri agar lulusannya sesuai dengan kebutuhan, siap untuk hal-hal baru. https://t.co/YXMPuJqQHz'"
