id,created_at,text
1031140111717548032,2018-08-19 11:25:34,"b'Selamat kepada Defia Rosmaniar, atlet taekwondo putri yang meraih medali emas pertama Asian Games 2018 untuk Indonesia. Saya menyaksikan langsung Defia mengalahkan atlet Marjan Salahshouri dari Iran di Plenary Hall JCC, Jakarta, sore ini.\n\nDefia, rakyat Indonesia bangga padamu! https://t.co/FrSeZMlF5N'"
1031113530471137280,2018-08-19 09:39:57,"b'Medali pertama Indonesia di Asian Games 2018 datang dari cabang wushu. Atlet putra Edgar Xavier Marvelo meraih medali perak pada final nomor changquan, pagi tadi.\n\nMudah-mudahan, apa yang diraih Edgar memacu semangat atlet-atlet Indonesia lainnya untuk semakin percaya diri. https://t.co/vFzHVY6aPd'"
1031013973527674880,2018-08-19 03:04:21,"b'Siapa yang menerbangkan sepeda motor, meliuk-liuk, bergaya stoppie, dan sampai tepat waktu ke GBK, semalam? Hehehe.\n\nYang jelas, saya dan kita semua menyambut gembira, acara pembukaan Asian Games 2018 berlangsung meriah dan lancar. Ini penantian Indonesia selama 56 tahun. https://t.co/MLbiYFpxWq'"
1030650926149713920,2018-08-18 03:01:44,"b'Asian Games 2018 di Jakarta dan Palembang dibuka hari ini. 16.000 atlet dari 45 negara hadir bertanding dan memeriahkan pesta olahraga bangsa-bangsa Asia ini.\n\nJadilah tuan rumah yang baik, tampilkan wajah ramah bangsa kita, nikmati pertandingan dari atlet-atlet terbaik Asia. https://t.co/wGj90B4GLA'"
1030415112706781184,2018-08-17 11:24:41,"b'Peringatan Detik-Detik Proklamasi Kemerdekaan RI di pelataran Istana Merdeka pagi ini ceria tapi khidmat. Hampir 10.000 kursi untuk undangan disediakan, 65 persennya untuk masyarakat umum.\n\nProsesinya berupa kirab, upacara pengibaran bendera, dan atraksi flypast pesawat tempur. https://t.co/rpOBVj9IxC'"
1030289999718051840,2018-08-17 03:07:32,b'Sebelum melangkah ke pelataran istana untuk mengikuti Upacara Peringatan Detik-Detik Proklamasi Kemerdekaan Republik Indonesia ke-73. https://t.co/kCeZIY7Kuf'
1030268001914781696,2018-08-17 01:40:07,"b'Bangsa Indonesia yang tetap bersatu, berbagi, dan peduli pada sesama anak bangsa, membuat negeri ini bukan hanya sekadar nama, atau gambar sederetan pulau di peta dunia, melainkan menjadi sebuah kekuatan yang disegani bangsa-bangsa lain di dunia.\n\nDirgahayu Republik Indonesia. https://t.co/VK7gVPePom'"
1029990140599394309,2018-08-16 07:16:00,"b'Berpidato dalam Sidang Tahunan MPR, sehari menjelang peringatan HUT Kemerdekaan RI, pagi tadi. Saya melaporkan secara ringkas kinerja lembaga-lembaga negara kepada seluruh rakyat Indonesia.\n\nKepercayaan rakyat adalah sumber kekuatan utama kita dalam melangkah. https://t.co/YQW2EJRawb'"
1029948966383673354,2018-08-16 04:32:23,"b'Masakan khas Lombok, Sate Tanjung, membawa Putri Ayu Martha Tilaar asal Mataram menjadi juara Lomba Masak Ikan Nusantara tahun 2018 yang diikuti 75 orang dari seluruh Indonesia. Selamat.\n\nIkan yang melimpah di negara maritim ini bisa kita optimalkan dengan beragam cara masak. https://t.co/pAla4U1RsW'"
1029912685964488705,2018-08-16 02:08:13,"b'Sebanyak 68 pelajar SMA, dua orang dari setiap provinsi di Indonesia, menjadi anggota Paskibraka pada Upacara Peringatan Detik-Detik Proklamasi Kemerdekaan RI pada 17 Agustus 2018 di halaman Istana Merdeka, Jakarta.\n\nSemoga mereka diberi kemudahan dalam tugas negara ini. https://t.co/K1ZJFyHLgJ'"
1029721097489375232,2018-08-15 13:26:55,"b""Delapan tokoh menerima anugerah tanda kehormatan tahun ini menjelang Hari Kemerdekaan RI. Di antaranya, Gusti Kanjeng Ratu Hemas dan Dato' Sri Tahir sebagai penerima Bintang Mahaputra.\n\nMereka berjasa luar biasa di berbagai bidang yang bermanfaat bagi bangsa dan negara. https://t.co/X73UcC5R6t"""
1029663919122440192,2018-08-15 09:39:43,b'Selamat bertugas Pak Syafruddin sebagai Menteri Pendayagunaan Aparatur Negara dan Reformasi Birokrasi. https://t.co/1YRzOgcqKy'
1029561416741662721,2018-08-15 02:52:24,"b'Di usia 57 tahun, saatnya Gerakan Pramuka di Tanah Air menjawab tantangan zaman baru. Anggota Pramuka harus dididik bukan hanya bahasa Morse, tetapi juga pengetahuan digital seperti coding, artificial intelligence, advance robotic, dan internet of things.\n\nSalam Pramuka. https://t.co/aAQXfh6bEp'"
1029343501878587392,2018-08-14 12:26:29,"b'Saat gempa bumi mengguncang Lombok Utara, pelari Lalu Muhammad Zohri tengah di Jakarta bersiap mengikuti Asian Games 2018. Syukurlah, rumah Zohri yang sedang dibangun pemerintah dekat pusat gempa di Desa Pemenang Barat, tidak mengalami kerusakan.\n\nSemoga Zohri tetap berprestasi. https://t.co/2QW3TgJv85'"
1029253914711928832,2018-08-14 06:30:30,"b'Bantuan perbaikan rumah-rumah warga yang rusak akibat gempa 7 SR di Lombok Utara mulai disalurkan hari ini. Rp50 juta untuk yang rusak berat dan Rp25 juta yang sedang.\n\nDibimbing Kementerian PUPR, warga membangun sendiri rumah tahan gempa berteknologi RISHA. https://t.co/auz0kmtQ6n'"
1029188761303699456,2018-08-14 02:11:36,"b'Hampir petang saya tiba di Dusun Karangkates, Lombok Utara, kemarin. Mengobrol dengan warga dan menghibur anak-anak di tenda pengungsian, lalu kami salat Magrib bersama di musala darurat berupa tenda beratap terpal.\n\nDuka Lombok adalah duka kita semua. https://t.co/4khqNMBer8'"
1028959991086993408,2018-08-13 11:02:33,"b'Sampai hari ini, korban meninggal gempa 7 SR di Lombok 5 Agustus lalu sebanyak 436 orang, luka-luka 1.353 orang, dan 352.736 warga mengungsi.\n\nMalam ini, saya akan menginap di tenda setelah bertemu para pengungsi, dan melihat dari dekat penanganan atas dampak bencana di sana. https://t.co/dH5BG3n4XQ'"
1028874715899654144,2018-08-13 05:23:42,"b'Indonesia mengawali langkah di Asian Games 2018 dengan kemenangan Timnas Sepak Bola atas China Taipei di Stadion Patriot, Bekasi, semalam. Tim basket Indonesia juga bertanding besok di Kelapa Gading, Jakarta.\n\nMari merapatkan dukungan untuk perjuangan atlet-atlet Indonesia! https://t.co/nRoTPKQIAW'"
1028812078100828160,2018-08-13 01:14:48,"b'Sepanjang 2015-2019, pemerintah membangun, melanjutkan dan menyelesaikan pembangunan sejumlah bandara di seluruh Tanah Air. Bandara-bandara itu kini lebih luas, megah, nyaman, dan membanggakan.\n\nSaya berharap, semua daerah kelak terhubung melalui jalur darat, laut atau udara. https://t.co/jXvBbZAGOC'"
1028290314656604162,2018-08-11 14:41:30,"b'Garuda Muda tak terbendung di lapangan hijau. Malam ini Timnas Indonesia menjuarai Piala AFF U-16 mengalahkan Thailand dalam laga di Stadion Gelora Delta, Sidoarjo.\n\nSelamat kepada pemain dan pelatih. Gelar ini menjadi kado terindah bagi Indonesia menjelang Hari Kemerdekaan. https://t.co/cohzrGw2Gd'"
1028230863362781184,2018-08-11 10:45:16,"b'Selamat berjuang Timnas Sepak Bola Indonesia di partai final Piala AFF U-16 malam ini di Stadion Gelora Delta, Sidoarjo. Tampilkan permainan terbaik, selalu junjung tinggi nilai-nilai sportivitas.\n\nDoa untuk Garuda Muda, kebanggaan seluruh masyarakat Indonesia. Semoga juara! https://t.co/KPMcglxi4F'"
1028167002848813056,2018-08-11 06:31:30,"b'Prioritas kita selama proses tanggap darurat gempa di Lombok adalah memenuhi segala kebutuhan warga: dari ketersediaan logistik, tenda, selimut, makanan, obat-obatan, air, sampai listrik.\n\nSetelah itu kita fokus melakukan perbaikan rumah masyarakat dan fasilitas umum yang rusak. https://t.co/A9PvBsqVPI'"
1027903742585139201,2018-08-10 13:05:24,"b'Hari ini, tepat pada Hari Veteran Nasional, saya melantik 27 veteran sebagai pengurus pusat Legiun Veteran Republik Indonesia tahun 2017-2022 di Istana Negara.\n\nPemerintah juga menaikkan tunjangan veteran sebesar 25% sejak bulan September yang dirapel dari Januari. Terima kasih. https://t.co/aAdaikiXl7'"
1027810421732851712,2018-08-10 06:54:34,"b'Gempa susulan berkekuatan 6,2 skala Richter kembali mengguncang Lombok, kemarin siang. Saya tetap memantau semua perkembangan penanganan bencana di Lombok ini bahkan sejak gempa bumi yang pertama pada 29 Juli lalu.\n\nMari tetap bergandengan tangan membantu saudara-saudara kita. https://t.co/M95gNTMLNK'"
1027745367951994880,2018-08-10 02:36:04,b'Doa restu Ibunda yang selalu memayungi langkah kaki dan memberikan kesejukan hati di sepanjang perjalanan hidup. https://t.co/Cg2m4RpT3X'
1027464842167246853,2018-08-09 08:01:22,"b'Sampai kemarin, 153.675 jemaah haji Indonesia tiba di Arab Saudi. Pelayanan yang mereka terima jauh lebih baik dari yang saya lihat saat berhaji tahun 2003. Sekarang, rekam sidik jari dilaksanakan di Tanah Air, bumbu masak dan juru masaknya asli Indonesia, dll.\n\nSemoga mabrur. https://t.co/C7HiKQBL4N'"
1027360260116213760,2018-08-09 01:05:48,"b'Dari 1.388 atlet dan official kita untuk Asian Games 2018, sebanyak 452 orang masih latihan dan uji coba di luar negeri. Atlet wushu di Cina, senam ritmik di Bulgaria, judo di Jepang, sambo di Rusia, dll.\n\nMereka pulang sebelum 18 Agustus, demi prestasi di Asian Games 2018. https://t.co/xnn0INKQr7'"
1027182106483421184,2018-08-08 13:17:52,"b'Saya melepas secara resmi atlet-atlet Indonesia yang akan bertanding di Asian Games 2018 di Jakarta dan Palembang. Indonesia menurunkan 938 atlet di 40 cabang olahraga dan memperebutkan 465 medali emas.\n\nSelamat bertanding secara sehat dan fair, dan jagalah nama baik negara. https://t.co/PoBR6B9slR'"
1027036434601979922,2018-08-08 03:39:02,"b'Tidak benar ada serbuan jutaan TKA dari Tiongkok di Morowali, Sulawesi Tengah.\n\nJumlah TKA di kawasan Indonesia Morowali Industrial Park ada 3.121 orang, pekerja lokal 25.447 orang. Jadi jumlah TKA hanya 10,9% seluruh pekerja. Standar gaji TKA dan TKI di sana pun sama belaka. https://t.co/MusSi2vWRf'"
1026868682394284032,2018-08-07 16:32:26,"b'Menerima 213 mahasiswa dari Ikatan Mahasiswa Muhammadiyah di Jakarta, Senin lalu. Sebagian ke Jakarta dengan Hercules TNI AU usai Muktamar IMM di Malang.\n\nKepada mereka saya mengingatkan pentingnya infrastruktur yang mendukung konektivitas bagi negara besar seperti Indonesia. https://t.co/YE58P0FjQB'"
1026854480262787072,2018-08-07 15:36:00,"b'Empat tahun membangun infrastruktur, kini saatnya pengembangan SDM jadi prioritas pemerintah dalam pembangunan.\n\nTerutama untuk pendidikan dan pelatihan vokasi, politeknik, kemitraan dengan industri, peningkatan keterampilan tenaga kerja, dan kementerian yang lain. https://t.co/vCy6CUSjoM'"
1026826488518037507,2018-08-07 13:44:47,"b'Pukul tiga sore tadi, Perdana Menteri Malaysia Mahathir Mohamad menelpon saya dan menyampaikan belasungkawa dan simpatinya atas gempa bumi yang terjadi di Lombok, hari Minggu kemarin.\n\nTerima kasih Tun Mahathir atas perhatian dan kepedulian pemerintah dan rakyat Malaysia. https://t.co/JqgzVqHHnF'"
1026779270901723136,2018-08-07 10:37:09,"b'Seraya membangun infrastruktur, tersedia aneka program untuk rakyat: Kartu Indonesia Pintar, Kartu Indonesia Sehat, Program Keluarga Harapan, Dana Desa, dsb.\n\nNegara besar ini tidak dibangun di atas kemalasan dan serba instan. Butuh perjuangan, optimisme, dan kerja keras. https://t.co/X9XLDUvDu0'"
1026462096257515522,2018-08-06 13:36:49,"b'Pada Asian Games 2018, untuk pertama kalinya pencak silat dipertandingkan di Asian Games. Tim pencak silat Indonesia dengan 22 atlet yang akan bertanding di 16 nomor sudah berlatih sejak tiga tahun lalu demi prestasi di Asian Games 2018.\n\nTargetnya, dua medali emas. Insya Allah. https://t.co/uTI601QpBM'"
1026411826102161410,2018-08-06 10:17:03,"b'Saya bertemu Aero Sutan Aswar, juara dunia jetski tahun 2014 di kelas Pro Runabout Stock di Arizona, Amerika, saat meninjau persiapan para atlet di Ancol, Jakarta, pagi tadi.\n\nAero adalah atlet jetski nasional yang diharapkan merebut medali emas di Asian Games 2018 ini. https://t.co/ZveZ1O0dEm'"
1026314188270923777,2018-08-06 03:49:05,"b'Kepada masyarakat Lombok dan sekitarnya, semoga tetap tenang. Saudara-saudara tidak sendirian menghadapi cobaan ini. Kami bersama Anda semua. Saya terus memantau semua bantuan dan penanganan dampak bencana gempa di Lombok.\n\nSemoga Allah SWT senantiasa melindungi kita. Aamiin https://t.co/p89yjlljdH'"
1026069594404925440,2018-08-05 11:37:09,"b'Hari ini saya menghadiri pemecahan Guinness World Records tari poco-poco di Lapangan Silang Monas, lalu ke Kompleks Gelora Bung Karno untuk ikut dalam acara Harmoni Indonesia 2018.\n\nSemua ini untuk menyemarakkan bulan kemerdekaan 2018, memperingati 73 tahun Indonesia merdeka. https://t.co/uzrFkxS1yt'"
1025976874109829120,2018-08-05 05:28:43,"b'Sebanyak 65.000 peserta dan 1.500 instruktur menari poco-poco di Silang Monas, sepanjang Jalan Sudirman, Jalan MH Thamrin hingga Senayan, pagi ini. Semua bergembira, semua menikmati.\n\nSelamat berpoco-poco semoga kita semua sehat. Rakyat kita sehat. https://t.co/JLAbk1ZSkb'"
1025735631786270720,2018-08-04 13:30:06,"b'Saya baca berita bahwa masyarakat kita ini malas berjalan kaki. Jangankan jauh, agak dekat saja malas.Mau ke mal, cari parkirnya dekat pintu agar jalannya dekat. Iya kan?\n\nMumpung dekat Asian Games 2018, mari kita kumandangkan: biasakan jalan kaki yang sehat untuk masyarakat. https://t.co/Na1OxvTEEv'"
1025275225699565571,2018-08-03 07:00:37,"b'Venue Asian Games 2018 sudah selesai, saatnya meninjau kesiapan infrastruktur kota, jalur pejalan kaki, dan kebersihan ibu kota sebagai tuan rumah.\n\nSetelah ini, saya akan meninjau persiapan atlet. Moga-moga semua atlet siap untuk bertanding sejak tanggal 18 Agustus nanti. https://t.co/rhhHNhB0yV'"
1025193450721832961,2018-08-03 01:35:40,"b'Tahun lalu, saya menyaksikan pengembangan sejenis kendaraan pedesaan di pabrik Kiat Motor di Klaten. Kemarin, saya meluncurkan mobil Angkutan Mekanis Multiguna Pedesaan buatan Kiat Motor di pameran GIIAS 2018.\n\nTugas pemerintah mendorong gagasan seperti ini bisa masuk ke pasar. https://t.co/gAWkLuhcv3'"
1025028206896664576,2018-08-02 14:39:03,"b'Saat ini Indonesia membutuhkan inovasi berupa implementasi biodiesel 20 persen dengan menghadirkan lebih banyak kendaraan ramah lingkungan.\n\nDi luar sana, sudah ada kendaraan berbahan bakar 100% bioethanol dari gula tebu. Masak kita yang bisa produksi sawit jutaan ton tidak bisa? https://t.co/LQXVW4cMkf'"
1024912566588334080,2018-08-02 06:59:32,"b'Beratus tahun kita dijajah, beratus tahun kita berperang, dan rahmat Allah jualah yang membuat kita merdeka.\n\nZikir kebangsaan di halaman Istana Merdeka, semalam, adalah wujud rasa syukur kita atas nikmat kemerdekaan itu. Insya Allah, akan digelar setiap tanggal 1 Agustus. https://t.co/cbkuGUHWc6'"
1024836218398236672,2018-08-02 01:56:09,"b'Setelah 50 tahun dikelola Chevron, blok migas Rokan di Riau diserahkan ke Pertamina. Luas blok migas ini 6.220 km dengan 96 lapangan minyak di antaranya Duri, Minas dan Bekasap. \n\nDengan mengelola Blok Rokan, Pertamina akan menguasai 60% produksi migas nasional tahun 2021. https://t.co/UfSueg7zJ9'"
1024645770463600645,2018-08-01 13:19:23,"b'Tanpa air yang memadai, sawah-sawah di Dompu, NTB, hanya bisa panen sekali setahun. Nanti, dengan beroperasinya Bendungan Tanju di sana, panen di Dompu bisa tiga kali setahun. https://t.co/8MuWmtEMCd'"
1024509773142679552,2018-08-01 04:18:59,"b'Syukur Alhamdulillah, pada pukul 05.50 WIB pagi tadi di Jakarta, telah lahir cucu saya yang kedua - anak Bobby dan Kahiyang -- dalam keadaan sehat walafiat. Mohon doa agar sang bayi kelak menjadi anak yang salihah, yang berbakti kepada orang tua, dan kepada bangsanya. https://t.co/si4q7KaSjq'"
1024129197357203457,2018-07-31 03:06:42,"b'Sebanyak 14.850 bidang tanah di NTB kini telah memiliki bukti kepemilikan yang diakui oleh hukum. Saya sendiri yang menyerahkan 1.037 lembar di antaranya, kemarin, di Sumbawa.\n\nSaya tak ingin melihat lagi model pelayanan kepada masyarakat yang lama dan berbelit-belit. https://t.co/XKQTHi1v9F'"
1023903468317171713,2018-07-30 12:09:44,"b'Berbincang-bincang seputar masalah pertanian dengan para petani Desa Pernek, Sumbawa di Nusa Tenggara Barat. Mereka mengerjakan saluran irigasi dalam program Padat Karya Tunai di sana. https://t.co/Cg1DtMkNma'"
1023817050555219968,2018-07-30 06:26:21,"b'Meninjau posko pengungsi gempa seraya membagi buku tulis dan bahan pokok untuk para pengungsi yang tinggal di tenda-tenda di Lapangan Desa Madayin, Sambelia, Lombok Timur, pagi ini.\n\nSaya datang untuk memastikan penanganan dampak gempa dilaksanakan dengan cepat dan baik. https://t.co/zxut3MhL8e'"
1023761692302274562,2018-07-30 02:46:22,"b'Kampus Pesantren Modern Internasional Dea Malela di Sumbawa Besar, NTB yang fasilitasnya baru saya resmikan, akan menjadi pusat pendidikan Islam unggul di Tanah Air dan dunia.\n\nDi antara 272 santrinya, ada yang dari luar negeri seperti Thailand, Kamboja, Timor Leste dan Rusia. https://t.co/F62x6DKu7I'"
1023531291994537984,2018-07-29 11:30:50,"b'Saya telah tiba di Sumbawa Besar dan langsung memimpin rapat terbatas penanganan dampak gempa bumi 6,4 SR yang terjadi di Lombok, Bali dan Sumbawa pagi tadi.\n\nInsya Allah, besok pagi, saya ke lokasi bencana dan menengok para korban.  Semoga Allah SWT melindungi kita semua. https://t.co/39u27NQl2d'"
1023375432123539456,2018-07-29 01:11:31,b'Jalan sehat bersama warga kota Makassar. https://t.co/mZJDSyJ799'
1023083583664091136,2018-07-28 05:51:48,"b'Bersantap siang sambil mendengar informasi tentang bangsa dari sudut pandang politisi muda di teras Istana Bogor.\n\nMereka adalah tiga orang muda ketua umum partai, Hary Tanoesoedibjo (Perindo), Grace Natalie (PSI) dan Diaz Hendropriyono (PKPI). https://t.co/GrZa83Ne9V'"
1022770446746316800,2018-07-27 09:07:31,"b'Anak-anakku pamong praja lulusan IPDN 2018: tangan kalian-lah yang akan menjalankan adaptasi dan reformasi itu, hati kalian-lah yang akan merawat kedekatan dengan rakyat dan yang melayani rakyat, tekad kalian-lah yang akan memperkokoh Pancasila, NKRI dan Bhinneka Tunggal Ika. https://t.co/9BzPf6HiaN'"
1022729744545021953,2018-07-27 06:25:47,"b'Pada tasyakuran hari lahir Majelis Ulama Indonesia yang ke-43, kemarin, saya meletakkan batu pertama pembangunan Menara MUI di Bambu Apus, Jakarta Timur.\n\nDibangun di lahan 18 hektare, Menara MUI akan memiliki 17 lantai, dan dibiayai sepenuhnya oleh dana wakaf. Selamat. https://t.co/Iui97GOkl6'"
1022665162761756672,2018-07-27 02:09:09,"b'Inflasi tiga tahun terakhir selalu di bawah 4 persen. Tapi saya tetap berharap bisa turun lagi hingga 1-2 persen. Maka, kepala daerah harus lebih proaktif.\n\nContoh, bila inflasi karena kekurangan pasokan, maka ia harus bekerja sama dengan daerah lainnya yang mengalami surplus. https://t.co/os464Jnot6'"
1022390943821922305,2018-07-26 07:59:30,"b'2000-an kepala desa mengikuti acara peningkatan kapasitas di Yogyakarta, kemarin. Terima kasih kepada seluruh aparat desa karena kemarin, 171 pilkada aman dan lancar.\n\nPara kepala desa juga bisa menyadarkan, mematangkan, dan mendewasakan cara-cara berpolitik kita untuk rakyat. https://t.co/pHMUv3OR62'"
1022300761948975105,2018-07-26 02:01:09,"b'Dalam sejarah anggaran kita, pengucuran Rp187 triliun ke desa-desa dalam empat tahun itu besaaar sekali. Tujuannya agar pemerataan pembangunan tercipta di Tanah Air.\n\nTapi, harus tepat sasaran. Uangnya berputar di sekitar desa, tidak kembali lagi ke kota dan berujung di Jakarta. https://t.co/RHrIYoRFpD'"
1022006474921394176,2018-07-25 06:31:46,"b'Cari emping mentah atau kecipir, jangan ke mal, tapi ke pasar tradisional seperti Pasar Kranggan, Yogyakarta ini. Pasarnya juga tertata, ada tempat parkir, tidak becek dan bau.\n\nSaya berharap pasar tradisional lain seperti ini supaya bisa tetap bersanding dengan pasar modern. https://t.co/ZqxXVmL8Sa'"
1021390231054954496,2018-07-23 13:43:02,"b'Bersama para tokoh bangsa, ketua-ketua partai, menanti hidangan gurame goreng kipas, toge ikan asin, sampai minuman bandrek susu kelapa, sambil berbincang-bincang.\n\nMasalah-masalah bangsa tak akan bisa dipikirkan dan diselesaikan hanya oleh satu dua orang sahaja. https://t.co/zbqYm1TSCN'"
1021383636954697728,2018-07-23 13:16:50,"b'\xe2\x80\x9cDulu panen setahun sekali, kini ada bendungan, bisa panen dua kali setahun,\xe2\x80\x9d kata sang petani.\n\nPemerintah membangun 16 bendungan lanjutan, 49 bendungan baru, demi ketahanan air &amp; pangan nasional. https://t.co/qOhlptsHcn'"
1021303989067866112,2018-07-23 08:00:20,"b'Saya sering merasa sedih melihat orang-orang saling menjelekkan hanya karena berbeda pandangan politik. Padahal, norma agama, budaya, dan etika kita, semuanya tak menghendaki perselisihan.\n\nMari, para politisi, berikan pendidikan politik yang baik kepada masyarakat. https://t.co/E33Gg0Bhgp'"
1020897580127940609,2018-07-22 05:05:25,"b'Sebelum tayangan film dimulai, mari mencari posisi menonton yang asyik. https://t.co/QIxdM9qPse'"
1020507953105793024,2018-07-21 03:17:10,"b'Ada satu orang atau perusahaan menguasai 200, 300, atau 600 ribu ha lahan di Indonesia. Tetapi, konsesi itu bukan dari saya. Tak ada satu meter pun saya berikan kepada perusahaan besar!\n\nSebaliknya, akses terhadap lahan lebih banyak diberikan kepada masyarakat dan petani lokal. https://t.co/1p0EM3IEGg'"
1020290459023708160,2018-07-20 12:52:56,"b'Nonton bareng film ""Kulari Ke Pantai"" bersama Ibu Negara dan anak-anak dalam acara Bermain, Berdendang dan Berimajinasi Bersama Anak di Istana Negara, sore tadi. https://t.co/f3KTQKXkpT'"
1020219856887562240,2018-07-20 08:12:23,"b'Suatu saat nanti ketersediaan energi fosil akan habis. Maka, perlu percepatan pengembangan biodiesel dan energi baru terbarukan.\n\nIni bisa menghemat devisa dari pengurangan impor minyak sebagai bahan baku pembangkit energi fosil. Kita bisa hemat kurang lebih USD21 juta per hari. https://t.co/RRnEt5qPSd'"
1019892011019644928,2018-07-19 10:29:38,"b'Ada yang memeluk ayahnya, bersujud di depan ibunya, melempar topi ke udara. Pemandangan mengharukan itu terlihat di halaman Istana Merdeka dari 724 perwira remaja TNI dan Polri yang saya lantik hari ini.\n\nSelamat kepada para kesatria muda sebagai perwira baru. Selamat bertugas. https://t.co/7E4zZ29eBu'"
1019823630320930817,2018-07-19 05:57:55,"b'Membesuk Bapak Susilo Bambang Yudhoyono yang sedang dirawat di rumah sakit, siang ini. \n\nSaya mengajak kita semua berdoa untuk kesembuhan beliau, semoga Pak SBY segera pulih dan kembali berkegiatan seperti sediakala. https://t.co/HGXnNEQHS4'"
1019767305675333633,2018-07-19 02:14:06,"b'Presiden Federasi Mikronesia, Peter Martin Christian berkunjung ke Indonesia sejak kemarin. Selain ke Jakarta dan Bandung, beliau juga ""pulang kampung"" ke Ambon. Pulang kampung?\n\nPresiden Christian adalah keturunan orang Maluku generasi ketiga di Mikronesia. https://t.co/E9rqRZLeB4'"
1019529769652613120,2018-07-18 10:30:13,"b'Lalu Muhammad Zohri, juara dunia lari 100 m U-20, pulang. Media memberitakan ia bangga bila dapat bertemu dengan ""orang besar"". Maksudnya, Presiden.\n\nSaya pun bertemu Zohri di Bogor. Orang besarnya itu bukan saya, tapi Zohri. Dengan segala keterbatasan, ia bisa juara dunia. https://t.co/XYxxQ13AQN'"
1019460137000374273,2018-07-18 05:53:31,"b'Jembatan Ampera dibangun tahun 1962 ketika Indonesia menjadi tuan rumah Asian Games IV. 56 tahun kemudian, Palembang jadi tuan rumah Asian Games 2018, Jembatan Ampera direhabilitasi. \n\nDi dua sisi menara jembatan dipasang jam analog berdiameter 5,5 m yang beratnya sekitar 200 kg. https://t.co/Ai89YIHR5u'"
1019409143952654336,2018-07-18 02:30:54,"b'Kepercayaan publik, rakyat, dan masyarakat terhadap TNI saat ini di posisi yang tinggi.\n\nSeluruh anggota TNI dan Polri agar terus memegang teguh komitmen netralitas dalam menjaga demokrasi. https://t.co/NlKOYUqiLE'"
1019216867179651073,2018-07-17 13:46:51,"b'Sejak 2015, pemerintah telah mengucurkan Rp187 triliun Dana Desa, dana untuk membangun desa di seluruh Indonesia. Agar penggunaannya maksimal, Dana Desa melibatkan banyak pihak, di antaranya para Babinsa.\n\nPeran nyata anggota Babinsa sangat dibutuhkan dalam pembangunan nasional. https://t.co/IL5jzjvOLI'"
1019140818500608001,2018-07-17 08:44:40,"b'Ancaman dari dalam negeri berupa korupsi, kemiskinan, dan kesenjangan. Dari luar seperti perang dagang. Kita hadapi dengan cara meningkatkan produktivitas, etos kerja, elan juang, dan disiplin.\n\nJangan pernah pesimistis, gampang ragu, atau takut menghadapi cobaan dan ujian. https://t.co/S1H9wt5Ol3'"
1019069303721623552,2018-07-17 04:00:30,"b'Meninjau Gelora Jakabaring, Palembang, saya mengajak serta bro Saddiq. Lengkapnya, Syed Saddiq Abdul Rahman, Menteri Pemuda dan Olahraga Malaysia.\n\n#JKWVLOG\n\nhttps://t.co/Oh70vvDpfz'"
1018851088978464768,2018-07-16 13:33:23,"b'Kisah Desa Silawan di perbatasan Indonesia-Timor Leste yang warganya baru menikmati penerangan listrik setelah adanya Dana Desa. Dana itu juga untuk perbaikan rumah dan membangun embung untuk ternak warga.\n\n""Perasaan saya senang, karena sudah ada terang,"" kata seorang Ibu. https://t.co/VpsGSoh11Z'"
1018739784032964608,2018-07-16 06:11:06,"b'Studio alam tempat syuting film ""Sultan Agung: Tahta, Perjuangan, dan Cinta"" di Desa Gamplong, Sleman, dihibahkan sang produser kepada Pemda Sleman. Di dalamnya ada replika pendopo Keraton Mataram, benteng VOC, dll.\n\nIni potensi wisata baru di Desa Gamplong. https://t.co/VDuo2hJ4ph'"
1018447572065607680,2018-07-15 10:49:57,"b'Melewati salah satu gerbang Jalan Tol Kartasura-Sragen di Jawa Tengah seusai meresmikannya, pagi tadi. Ruas tol sepanjang 35 km ini bagian dari Trans Jawa, dari Merak ke Banyuwangi.\n\nSaya berharap jalan tol ini akan menurunkan biaya logistik, dan rest area-nya diisi produk lokal. https://t.co/4Mkt56G5y6'"
1018131720510423041,2018-07-14 13:54:52,"b""Anak muda yang bersama saya meninjau sejumlah venue Asian Games 2018 di Jakabaring Sport City, Palembang ini adalah Syed Saddiq Abdul Rahman. Ia Menteri Belia dan Sukan alias Menteri Pemuda dan Olahraga Malaysia.  \n\nUsianya baru 25 tahun. Saya memanggilnya 'bro' Saddiq. https://t.co/euMM21CgRP"""
