id,created_at,text
641967649669255168,2015-09-10 13:33:09,"b""Malam jum'at teh suka banyak mitos lah, missyou yang atos atos. :((((( #cb"""
641965701092147200,2015-09-10 13:25:24,b'Yah @pidibaiq aku udah ngefollow ayah dari sebelum putus loh yah. Ga akan dipolbek :(((((('
641963506309332992,2015-09-10 13:16:41,"b'PERSIB MENANG, JOMVLO ANGGEUR. SABODO! :( #PersibDay #cb'"
641917685412970496,2015-09-10 10:14:37,"b'Kalo sekiranya pacar km ganggu Persib mah harewosin aja gini ""persib mah hiji ge maung, mun sia hiji ge musingkeun,blog!"" :( #PersibDay #cb'"
641902477613228033,2015-09-10 09:14:11,b'Lurus weh terus nepi oktober belok kiri. :( RT @ammarsk8: caprukbdg rung ini udah di uganda kemana lagi? :('
641901169271377920,2015-09-10 09:08:59,b'Mau ini ga guys? 100ribu aja ih belum termasuk ongkir + di-hai-mamah-kamu-sehat?-in mantan. PIN: 285E451B #cb http://t.co/OxUICD9wRs'
641899885579517952,2015-09-10 09:03:53,b'Ga kemana-kemana? Mandi? Kampungan.. :((((( #cb'
641582700252389377,2015-09-09 12:03:30,b'Ini buat yang nanyain instagramku guys! http://t.co/aa4aLCoxnK #cb http://t.co/LNWSKSJC03'
641562160527601664,2015-09-09 10:41:53,"b'Suka kesel ga sih kalo ada yg pacaran naik motor, lalaunan, tapi ditengah, aing mah kagok gorowokeun weh ""DUNIA MILIK BERDUA BLOGGG?"" :( #cb'"
641168949892091904,2015-09-08 08:39:24,b'Guys jangan lupa follow @BEDEGEmerch buat liat update-an Official Merchandise aku ya? Iya pruk. Atau Add pin: 285E451B. Oke gablag? :( #cb'
641168119759699969,2015-09-08 08:36:06,"b'RT @BEDEGEmerch: READY STOCK TSHIRT TYPOGRAPHY ""TEMENAN AJA"" BY @caprukBDG 100K | READY SIZE TINGGAL M DAN L. CP: 285E451B #BDG! http://t.c\xe2\x80\xa6'"
641168097739599872,2015-09-08 08:36:01,"b""RT @BEDEGEmerch: READY STOCK T-SHIRT DON'T WORRY BE LEGUG BY @caprukBDG 100K BELUM TERMASUK ONGKIR, CP: 285E451B / 081321921077 #BDG! http:\xe2\x80\xa6"""
641168076612894720,2015-09-08 08:35:56,"b'RT @BEDEGEmerch: READY STOCK T-SHIRT ""OH KITU EDAN ATUH YA"" BY @caprukBDG ONLY 100K | READY SIZE M,L,XL. CP ADA DI PIC! #BDG! http://t.co/Y\xe2\x80\xa6'"
641164908864770048,2015-09-08 08:23:21,b'Pacar kamu apa-apanya dibiayain kamu? ADOPSI WEH KAGOK! :((((( #cb'
641159156976586753,2015-09-08 08:00:29,b'Aku ngebbm ke kamu kenapa silang? BB atau soal PG? :((((( #cb'
641157947196706820,2015-09-08 07:55:41,b'Oh jadi yang kemana mana suka make baju barong + sendal bendera gengster teh pacar kamu? EOOHH~ :( #cb'
640541477534236673,2015-09-06 15:06:03,b'Malem-malem gini mah skoteng euy enak..\n\n...Digujubarin. :( #cb'
640412359664623616,2015-09-06 06:32:59,b'Kamu mah dikasih hati teh menta kol goreng. Mitamit ih. :( #cb'
640405715333451776,2015-09-06 06:06:35,b'NAPAK SANCANG AESEEA! :( RT @ismail_T23: Kenging ngagaleuh ti si caprukBDG yang klo cod suka pake aji halimunan http://t.co/GpXx1gJdY3'
640402717681160192,2015-09-06 05:54:40,"b'Percayalah, siapapun yg bernama Patimah adalah jelema beunghar. Karena aku mah imah hiji ge ngontrak, mereka mah punya opat. :( #cb'"
640396287804772352,2015-09-06 05:29:07,b'Karena kalian banyak yang rariweuh nyuruh aku bikin Official Line nih atuh nih mamam! ID: @psd4000f search aja. #cb http://t.co/eDgKxP0L1J'
640394248219590656,2015-09-06 05:21:01,"b'Da di Bandung mah gini guys cuacanya teh, kalo malem hayang tatangkeupan, kalo siang  hayang diangir make es kalapa. :( #cb'"
640071708951474176,2015-09-05 07:59:22,"b""Don't worry be happy~ karena tanpa teman yang belegug, nongkrong kalian ga akan seru. Hidup belegug! :( #cb http://t.co/kM8WDmx6Ej"""
640070841447809024,2015-09-05 07:55:55,b'Hanya orang orang ber IQ lulumpatan yang  paham dan beli baju ini. IQ kamu jongkok? Geus ombeh heula. :( #cb http://t.co/AykAMOLRia'
640070508629786624,2015-09-05 07:54:35,"b'Karena temenan aja dengan alasan ""terlalu baik"" itu podol meuri banget dan mainstream! \xf0\x9f\x91\x87#cb http://t.co/IQu3A59pXV'"
640061743490723840,2015-09-05 07:19:46,"b'Mblo, malam minggu loh ini teh, dirumah aja ya? NGITUNG TEHEUL! :( #cb'"
640057771845484544,2015-09-05 07:03:59,"b'Jir kamu tampak ganteng euy, polbek done. RT @oruknas: Yeuh pruk edan kieu baju maneh @caprukBDG http://t.co/vKmdavvk3H'"
639755490533076992,2015-09-04 11:02:49,b'Gajimu berapa? Sampai berani meninggalkan solat. :) #markisol #cb'
639732477716619264,2015-09-04 09:31:22,"b'Baju aku limited size ya guys, cuma ada M, L dan XL. Buat yang belum manggih sangu, atau yang awaknya sagede BSM, sorry. :* #cb'"
639617742698471424,2015-09-04 01:55:28,"b'Selamat pagi guysss! Udah add instagram aku? Add aja atuh ""caprukbdg"" da moal ngabeledug aisia ih. \xf0\x9f\x98\x98 #cb http://t.co/dsUdFWGC0F'"
639428134366908416,2015-09-03 13:22:01,"b'Kalo ada yang nanya ""jodoh kamu mana?"" Bilang aja gini ""jodohku lagi ngebahagiain pacarnya dulu :)"" bari golerkeun di rel. ya? :( #cb'"
639424303952363520,2015-09-03 13:06:48,"b'Pacaran: ""Ah atulah sayang kamu bangettt!!"", Putus: ""Ah siah dasar sia mah borok kapocel anyinglah!"" :((((( #cb'"
639007402822512641,2015-09-02 09:30:11,b'Wilujeung #PersibDay ! :) #cb'
638982453630140420,2015-09-02 07:51:03,b'Masa kecil kalian dikatakan keren bila kalian pernah ngagayeum plastik urut yoghurt seperti ngagayeum permen karet. :( #cb'
638980195760795648,2015-09-02 07:42:05,b'Followers aku banyak yang hijabers euy. Hehehe. Bu haji daging? :( #cb'
638369391063666692,2015-08-31 15:14:57,"b'Ah da hidup mah gini weh, kadang kita dibawah, kadang kita diatas, kadang ticatrok cingir, kolor nyaweut, tapi ah syukuri aja guys. ;) #cb'"
638365212001763329,2015-08-31 14:58:21,"b':((((( RT @banyolanhidup: Selfie dijalan asia afrika mah udah biasa, sok cobaan gera selfie di jalan yg benar :((((('"
638326122107633664,2015-08-31 12:23:01,"b'Pacar kamu gerang gerung aja, balapin geura ku aing di monumen. :( #cb'"
637934276638445568,2015-08-30 10:25:58,"b'Cewek cantik itu ejaannya bukan K-U-R-U-S. :""&gt; ~anonymous #cb'"
637625515797430272,2015-08-29 13:59:04,b'Karena tidur pake baju alus itu ngeunaheun. :( #cb'
637548861079220224,2015-08-29 08:54:28,b'Panas-panas gini mah iron man ge gogoleran di ruang atm anjir. :( ~@infocapruk #cb'
637061387718496256,2015-08-28 00:37:25,"b""Eumh, btw aing nemu harta karun pagi ini. Thanks Ya Allah I'm 90's. \xe2\x9c\x8c\xef\xb8\x8f\xf0\x9f\x98\x8e #cb http://t.co/wHAqS5IcyK"""
637059873805479936,2015-08-28 00:31:24,"b'Selamat pagi, selamat beraktipitas, selamat berkreatipitas, ingat! Kamu adalah apa yang biasa kamu lakukan, jadi? Kade. Okey? Lopyu! :* #cb'"
636929457211596800,2015-08-27 15:53:10,"b'""Kamu kenapa? | Gpp.."" Tamat. :( #celembeud #cb'"
636927141775474688,2015-08-27 15:43:58,"b'Pada suatu hari hiduplah seorang pemuda yang nge-bbm mantannya bilang ""hai"" lalu didelkon. :( #celembeud #cb'"
636926416567709696,2015-08-27 15:41:05,b'Pada suatu hari hiduplah seekor kucing dan katabrak. Tamat. :( #celembeud #cb'
636922474370744320,2015-08-27 15:25:25,"b'Karena sekarang malam jumat, mari kita cerita serem. #cb'"
636156450000076800,2015-08-25 12:41:31,b'Dollar naek? Aslinya? Alhamdulillah. Kelas berapa sekarang? :( #cb'
635078019149729792,2015-08-22 13:16:13,"b'Santetlah teman kalian yang kalo diajak ngobrol malah bilang gini ""apa ih.. ih.. apa atuh apa.. ih.. ih.."" Please! :( #cb'"
635075985977663490,2015-08-22 13:08:08,"b'Kerja kelompok, biasa. RT @nandiadarozah: mencug teh apa pruk?'"
635074929516376065,2015-08-22 13:03:56,"b'*malam minggu* Pacaran: ""Beb, mencug yuk? | Hayu! :*"", Jomblo: ""Ep.. | Naon? | Teu.."" :((((( #cb'"
635070407523995648,2015-08-22 12:45:58,"b'Kamu mah suka mukulin pacar sendiri ih, dasar siah psikotes! :( #cb'"
635063964523606017,2015-08-22 12:20:22,"b'Bro, mantan km ngurusin siah! | Iya gitu? Engga ah asa masih gen.. | Ngurusin pacarnya maksudnya | Anjeng.. | HAHAHAHA! | GANDENG! | :( #cb'"
634679938709221376,2015-08-21 10:54:23,"b'Maaf guys kalo aku sekarang kurang lucu, da yg lucu mah si A ngobrolin si B, besoknya si A sama si B maen bareng. Hahahahahaha. Blog! :( #cb'"
634677691510206465,2015-08-21 10:45:28,"b'Beb, ngopi yuk? | Ngopi apa? Pileum? | BALEG GOBLOG! | Ya apa? :((((( #cowoselalusalah #cb'"
634260626387304453,2015-08-20 07:08:11,b'Panas-panas gini enak meureun ya jadi pop ice di-cerez-an. :( #cb'
633992847004307456,2015-08-19 13:24:08,"b'Engga lin, yg salah mah tukang nasgor. sangu asak digoreng. :( RT @elindaa02: kalo sayang sama orang yang ga sayang, salah engga ya? #CurCap'"
633992092906160130,2015-08-19 13:21:08,b'Long Dadaekanan Relationship RT @Chikasafa88_: pruk ai LDR teh apa? :(( #CurCap'
633990983529558016,2015-08-19 13:16:44,b'Baleg arisia! :( RT @Kukum4775 : a gaduh casan alit? #CurCap'
633990699868815360,2015-08-19 13:15:36,b'SIANA TONG DITUKANG ATUH GOBLOG! :((( RT @Mailoareme: pruk . mun aya nu bobogohan harepeun urang . urg kudu kmh ? #CurCap'
633989656468520965,2015-08-19 13:11:27,"b'Guys, #CurCap ah, Kalian Curhat, Aku Capruk. Trit! #cb'"
633530682271117312,2015-08-18 06:47:39,b'Kamu mah pacaran teh sebentar ih kaya intro MarioBros. Tereng teng toreng teng.. tot. Geus weh. :((((( #cb'
633296407127048192,2015-08-17 15:16:44,"b'Lagu kamana, nu nyanyi kamana. Baelah sataun sakali. Eh kamu udah putus teh? Lila anying jiga iklan yutub. :((((( #cb'"
633295635999907840,2015-08-17 15:13:40,b'Lomba karokean jam segini. DA GA GANDENG ENGGAAAAAAAAA! \xf0\x9f\x98\x82 #cb'
633206486164893696,2015-08-17 09:19:25,b'Mungkin Tuhan menciptakan ibu-ibu untuk ngariweuhkeun 17an. :( #cb'
633165323236040704,2015-08-17 06:35:51,"b'Didaerah aku mah ga ada lomba panjat pinang, katanya yang mau di pinangnya udah nikah duluan ceunah. Hahahahahahahahahahaha setan. :( #cb'"
633160104691437568,2015-08-17 06:15:07,"b'Merdeka bukan sekedar soal berjuang, tapi juga mempertahankan. Sudahkah Indonesia merdeka? Wallahualam. Wilujeung Indonesiaku. Lopyu! #cb'"
632812282364366848,2015-08-16 07:12:59,"b'Neng, neng kenapa sih minta traktir trus sama Aa? | Ya gpp atuh A! Daripada minta budak sok! Aa sanggup ngalahirkeun? | :((((( #cb'"
632444364409536513,2015-08-15 06:51:01,b'Bro kamari aing diteunggeul anyeng fak! | Dibales teu bro? | Euweuh pulsa.. | SIAP ANJEENGG! | :((((( #cb'
630299808478015488,2015-08-09 08:49:19,"b'Tapi beul guys, ke temen mah jangan itungan, sia rek itungan mah jadi kotretan weh anjir lah, pusing. :( #cb'"
630298572458586112,2015-08-09 08:44:24,"b'Jadi gini, aku punya temen 2 orang, trus aku comblangin, mereka tunangan, aku tinggal kenangan. Kan goblog. :((((( #cb'"
629528231901696000,2015-08-07 05:43:21,"b'RITING KA KANAN, BELOK KA KIRI. IBU SEHAT? :((((( #EUHmoment #bieupisan #cb'"
628374567128469504,2015-08-04 01:19:06,b'Pagi-pagi sarapan sama apa guys? Sama dia di read doang. Hahahahahahahahahahhahahahahanyinghahahahahahahaha. :(((( #cb'
628182070838194176,2015-08-03 12:34:11,"b'Aku mah cari jodoh yang ga macem-macem, asal mau diajak ngalenyap di tanjakan depan stasion Bandung. Udah. Lopyu. :( #cb'"
628071258018611200,2015-08-03 05:13:51,b'Aku mah suka ga habis pikir sama yang tatangkepan di motor wayah gini. 1. Panas poe anying ieu teh. 2. Hayang. Please. :(((( #cb'
628069840759042049,2015-08-03 05:08:13,"b'Tips terhindar dari typo: 1. Bismillah 2. Ngetiknya biasa aja, gausah pake sarung tinju. :((((( #cb'"
628068786000654337,2015-08-03 05:04:02,"b'KEHUARAAN. LEPEHKEUN HEULA GEHU PANASNA EUY! RT @banyolanhidup: Jatuh dari motor mah ga enak euy, da yg enak mah lalajo kehuaraan adu careuh'"
627782382830010368,2015-08-02 10:05:58,"b'Aku pengen deh nulis ""i miss you"" dina bata, trus dibaledogin ke kamu, biar kamu tau sakitnya kangen sama kamu. Bagong. :) #cb'"
623859145138044929,2015-07-22 14:16:25,"b'Da aku mah apa atuh, mau kenalan sama cewe juga ngadon disangka rek ngahipnotis. Anying teh. :( #cb'"
623858025120403456,2015-07-22 14:11:58,"b'Da aku mah apa atuh, di stopin sama yang meuntas juga ngadon ces lain eureun. :((((( #cb'"
623391117933817856,2015-07-21 07:16:39,"b'Pacarmu leor? Tenang, kalo ketemu, bisikin aja gini ""Naaaagin~ Ca ca ca"" bari tembok sungutna pas keur heuay. :( #cb'"
621871415835279360,2015-07-17 02:37:54,"b'Air tak selalu jernih, Ketika tangan tak mampu berjabat, BEUNGEUT SIA REUMPAG! :(((( #atudakesel #cb'"
621861311433998337,2015-07-17 01:57:44,"b'Guys, minal aidzin walfaidzin mohon maaf lahir dan batin, hampura aku sok loba heureuy, da nu loba duit mah agung podomoro. Lopyu. :* #cb'"
621428526109999107,2015-07-15 21:18:00,"b'Sahur terakhir, semoga kita semua masih bisa berkumpul bersama family dan diberikan umur panjang. Amin Ya Allah. AMIN ARISIAAA! :( #cb'"
621275761001902080,2015-07-15 11:10:58,"b'Selamat berbuka puasa guys, semoga puasa dan kangennya barokah. Hehehe. Anying. Lopyu. :(((((( #cb'"
621264463207882753,2015-07-15 10:26:05,"b'Allah mah adil ya? Awewena geulis, lalakina jiga gelasan mambo. :) #cb'"
619960366487855104,2015-07-11 20:04:04,"b'Yuk guys sahur dulu, bisi keburu ada si blue eyes dragon. :( #cb'"
619959492759846912,2015-07-11 20:00:36,b'SAUR HEULA ARISIA LAIN DI DALAMNYA2! :( RT @banyolanhidup: Kalau saat ini saya sangat bahagia percayalah.. sudah tidak ada kamu di dalam nya'
619873026322989056,2015-07-11 14:17:00,b'PEGANGAN PEGANGAN ARI NYEBRANG ENGGA! KAN GOBLOG. :((((( #cb'
618802859652485120,2015-07-08 15:24:33,"b'Kamu tau ga bedanya kuda sama kudra? Kalo kuda mah kakinya empat, kalo kudra mah kakinya emprat. Hahahahahaha kangen kamu banget. :(((( #cb'"
618800538285551616,2015-07-08 15:15:19,"b'Ceuk aing mah nyak, mun sakirana bobogohan rek piributeun wae mah udah weh saur on the road di jalur gaza anyinglah pusing. :( #cb'"
617810417952256000,2015-07-05 21:40:56,"b'Selamat berpuasa guys, 2 rakaat dulu sebelum tidur, biar ga lupa bangun. Bye :* #cb'"
617647968754122752,2015-07-05 10:55:25,"b'Selamat berbuka puasa guys, ingat solat, ingat makan secukupnya dan ingat! dia bukan buat kamu. :((((((( #cb'"
617081883755569153,2015-07-03 21:26:00,b'*telepon* Halo Bro! | Euy? | Ngabuburit yuk ah ti ayeuna? | BEUNGEUT SIAAA HADIAH KARPIL GABLAG! *tuut* | :(((( #cb'
617076110321283072,2015-07-03 21:03:04,"b'Hambur banget, karek sahur geus modol. Hoof. :( #cb'"
616557428587393024,2015-07-02 10:42:00,b'Buka mah kalo ditungguin lamaaaaaa teh. Olo-olo lah gasuka. :(((( #cb'
616556409086345216,2015-07-02 10:37:57,"b'Ya Allah muliakanlah tukang candil dan tukang tajil lainnya ya Allah, karena cuma mereka yang manis tapi ga nyakitin. Amin. :( #cb'"
614904246266257408,2015-06-27 21:12:51,"b'*sms* Sayang bangun, sahur dulu, semangat puasanya yaaa.. :* | Y | Eh gajadi ketang, sok tidur lagi aja nepi bulan desember bagong! :( #cb'"
614520902999408640,2015-06-26 19:49:35,"b'Saur.. Saur..\n\n..SAUR SAHA JOMBLO, JADI WEH GABISA NEMENIN SI DIA NGISI BUKU RAMADHAN DAN PABALAP-BALAP MENTA CAP. :(((( #cb'"
612713047434485760,2015-06-21 20:05:48,"b'Bro saur bro.. | Enyak apal | Eh lain, saur Allah menghadap ceunah.. | ARISIA! | :((((( #yangudah #cb'"
612608378620121088,2015-06-21 13:09:53,"b'Udahan ah maen popolisiannya, capek. :( #cb'"
611861769837936640,2015-06-19 11:43:08,"b'Buka puasa aku mah sama ini aja, mereka mah enak apa adanya. :) #cb http://t.co/PO5W4EDSwa'"
611860406340972548,2015-06-19 11:37:43,"b'Berbukalah dengan yang selalu ada, karena yang manis biasanya ga selalu ada. :((((( #cb'"
611534997141389312,2015-06-18 14:04:39,"b'Bro, kamu tadi buka sama apa? | Sama ayank di putusin :( | Euh. :(((( #EUHmoment #cb'"
611533005597749248,2015-06-18 13:56:44,"b'Guys aku mau ngadain kuis nih, tapi hadiahnya ditekean nepi lebaran haji, mau ga? :( #cb'"
611203212327063552,2015-06-17 16:06:16,b'Ga kerasa ya bro? | Apa? Puasa? Iya ih asa baru kemar... | SIA NGADIUKAN HULU AINGGGG!!! | Eh panyateh bantal emot bro sorry.. :(((( #cb'
610794122786398210,2015-06-16 13:00:41,"b':(((( RT @jibon1910: Aku rindu masa kecilku, ketika masalah terbesarnya hanya sebatas maen bola teu di operan :((('"
610759206719721472,2015-06-16 10:41:56,"b'Aku rindu masa kecilku, ketika masalah terbesarnya hanya sebatas disuruh ngambil bola yang masuk ke kolong mobil pas lagi mengbal. :( #cb'"
610446595235024896,2015-06-15 13:59:44,b'Tidur ah bisi jomblo. :) #cb'
610440242860920832,2015-06-15 13:34:29,b'Cewe dengan luka knalpot di bitis itu lebih seksi daripada model majalah kalender ditoko emas. Lopyu. :* #cb'
610337218394099712,2015-06-15 06:45:07,"b'Jadi intinya adalah kamu ya kamu, aku ya aku, kalo kamu ga suka aku yaudah.... \n\n..Ulah. :((((((( #cb'"
610336260511510528,2015-06-15 06:41:18,b'Pokonya aku gasuka kamu kaya gitu! | Kenapa kamu ngatur2? Kamu mau aku atur? | Sok! | SOK NGAGOLER GOBLOG GELENG KU AING! | Atuhhh.. :( #cb'
610333651524423680,2015-06-15 06:30:56,"b'Pacar kamu maksa kamu buat berubah? Bilang aja gini ""PIDEULMEN KALI AH BERUBAH~ "" bari superglue-an liang irungna. Okey? #cb'"
607193185001959424,2015-06-06 14:31:51,"b'Pasti kalian pernah ga ketemu sm temen kalian dan sekalinya ketemu temen kalian pasti bilang ""Sombong euy geus beunghar mah"". Pasti! :( #cb'"
605381832532619265,2015-06-01 14:34:10,"b""Ngebroadcast nisfu sya'ban nya udah? Solatnya udah belum? HEU! #cb"""
605380881058918400,2015-06-01 14:30:24,"b'Malam ini adalah malam Nisfu Syaban, dimana kita ngumpulin rapot kita, maaf ya guys aku loba heureuy, da yg loba duit mah si bakrie. :( #cb'"
604283435490795522,2015-05-29 13:49:32,b'Kamana atuh gegeberan di jalan bro? Hayang modol? Gagal jemput? Atau di udag gedung sate? Deblo! #cb'
603108381868437504,2015-05-26 08:00:18,"b'Beliau ( @Youlamlam ) hanya butuh waktu ko pak, waktu yg lebih lama, setidaknya sampai buah hatinya lahir. Tolong kang @ridwankamil :) #cb'"
603105825368838144,2015-05-26 07:50:08,"b'Mohon maaf kang @ridwankamil sudah baca pesan dari temen saya ini @Youlamlam , di aos dulu pak, sebentar aja. :) #cb http://t.co/le0dNyIxu0'"
602113441860427776,2015-05-23 14:06:45,"b'Udah malam mingguannya? Udah hehedonannya? Sok pada pulang ya, inget peluknya biasa aja, da moal hibeur. Bagong. :( #cb'"
602104758250287107,2015-05-23 13:32:15,"b'Ada telpon, lg dijalan, nyisi, ngaluarkeun hp, geus ditutup RT @idenry21: pruk, apasih yg lebih nge-bete-in dari bersin teu jadi? :( #CurCap'"
602102916359454720,2015-05-23 13:24:56,"b':(((((( RT @NatashaTheta: aku punya kabogoh, kita LDR. aku di garut, dia di masa lalu..... #CurCap'"
602102547977871361,2015-05-23 13:23:28,b'Caian lagi aja. :( RT @MiraMD_: gajihan jauh keneh mang. odol kuat geus sing purilit :( #curcap'
602100824706129920,2015-05-23 13:16:37,b'Pokalis blackmetal meureun. RT @nandiadarozah: aku punya temen mukanya putih tapi beuheung nya hideung ko bisa ya??:( #CurCap'
602099691694653440,2015-05-23 13:12:07,b'Awewe nu ngadukung karir maneh. RT @aldyansyahKP: Mang mending milih awewe apa karir? :( #CurCap'
602098612068200448,2015-05-23 13:07:50,"b'Jadi yg 4nya kaya sayuran, susu gitu tah yang ke 5nya dicipok. RT @FORnaufALL: Makanan yang 4 sehat 5 sempurna t\xc3\xa8h kaya gimana pruk? #CurCap'"
602098317883940865,2015-05-23 13:06:40,"b""Cari laki-laki, jgn cowo, cowo mah gitu, bagong. :( RT @annsnraini1: kenapa sih pruk cowo the suka ngulangin kesalahan yg sama?:') #CurCap"""
602096660747980800,2015-05-23 13:00:04,"b'Oke guys, #CurCap ? TRIT!!! #cb'"
602055270705942529,2015-05-23 10:15:36,"b'Malam minggu ga kemana-mana? Jangan sedih guys, nanti kita #CurCap okey abis maghrib. Siapin aja curhat kalian sa alinea. :( #cb'"
602046611544379392,2015-05-23 09:41:12,"b'Karena ""kayanya kita temenan aja"" gara-gara terlalu baik itu sudah terlalu mainstream! :((((( #cb http://t.co/E07oZx9nrx'"
599080048784580608,2015-05-15 05:13:08,"b""Innalillahiwainnailaihiroji'un kang Bahar (Didi Petet), Al-fatihah. :) #cb"""
598766265717555200,2015-05-14 08:26:16,b'Kamu mah gandeng ajalah kaya laleur dina kaca. Syeuh.. syeuh.. :(((( #cb'
597923181962272769,2015-05-12 00:36:10,b'Mau tinggi langsing semampai tanpa obat? LEUG-LEUGAN WEH KU SIA TARAJE BEUSI!!! :(((( #atudakesel #cb'
597920410080935936,2015-05-12 00:25:09,b'Ngaku beul siapa yang suka ngabentuk bentol jadi x kaya aku gini sok! :( #cb http://t.co/iJ78GQXdKi'
595774632185241603,2015-05-06 02:18:35,"b'Kemarin ada yg menta nomor aku guys, ya aku ga kasih lah emang aku cowo apaan? Trus dia bilang gini ""MOAL EUSI PULSA TEH GOBLOG?"" gt :( #cb'"
595771508749897730,2015-05-06 02:06:11,"b'Kasian ya anak babi, masih pagi udah haram. Masia. :(((((( #cb'"
594490635421265920,2015-05-02 13:16:27,"b'Mun sakirana malam mingguan rek meakeun duit mah, geus weh ka timezone maen balap nepi ka ditilang anyinglah pusing. :((((( #cb'"
594487262651424768,2015-05-02 13:03:03,b'Malam minggu ngobrol doang? HAHAHAHAHAHAHAHAHAHAHAHAHAHAHAHAHA GEUS WEH KERJA KELOMPOK! :( #cb'
594309133840461824,2015-05-02 01:15:13,"b'Selamat hari pendidikan nasional guys, Sakola sing jujur! :) #cb'"
594307260219723778,2015-05-02 01:07:47,b'Pacar kamu jadul banget kaya kueh mari. :(((((( #cb'
593426035443511296,2015-04-29 14:46:06,b'Yaelah syob. Syoblog. :( #path #cb http://t.co/klbspvVddn'
593423251868557312,2015-04-29 14:35:03,"b'Jangan main-main dengan murka seorang ibu, ketika beliau sudah memanggil kalian dengan nama lengkap kalian. :((((( #cb'"
592674673915252737,2015-04-27 13:00:28,b'KOSONGKEUN TL AING REK ES SKETINGAN MAKE KERESEK!!!! :( #cb'
592674391529549825,2015-04-27 12:59:20,b'RT @KEGOMBRANGAN: Yuk ah open Pre Order official merch @GombrangBDG | Kaos 100k | Totebag 75k | cp: 085759333159 / 25E91FA2 ~ http://t.co/6\xe2\x80\xa6'
590791803047055360,2015-04-22 08:18:36,"b'Sebenernya pribahasa ""berakit rakit ke hulu berenang renang ketepian"" teh ga sopan tau, masa berakit-rakit ke hulu, kagok degungkeun. :( #cb'"
590781393082327040,2015-04-22 07:37:14,b'Mau baju #BANGKONGZUMA kaya si teteh teteh cantik tadi? Gampang atuh tinggal SMS aja ke 081321921077 / 535025F0. SISA SIZE XL DAN XXL guys!'
590780139140734977,2015-04-22 07:32:15,"b""Fix Terr! Bogohin guys~&gt; RT @Ranieaprili: Aku aja pake masa kamu engga? Potona dengdek :') caprukBDG @CPRKBDGMRCH :-* http://t.co/gl05kcygkT"""
590670056964644864,2015-04-22 00:14:50,"b'Kamu udah makan belum? Makan dulu atuh, bisi modar. Ya? Loveyou :* #cb'"
590665148010012674,2015-04-21 23:55:19,"b'Selamat pagi guys, sorry euy kemaren aku ketiduran, ini juga baru kebangunan. Hoof. :( #cb'"
590496914480631808,2015-04-21 12:46:49,"b':( RT @muhammad32ihsan: ker gogoleran di korsi ruang tamu, terus aya tamu :((((( #HoreamMoment'"
590494755433254913,2015-04-21 12:38:15,b'Aing pernah. :( RT @rizkiwrdhn_: dahar lotek kurupuk na te ka dahar #HoreamMoment'
590493929197338624,2015-04-21 12:34:58,"b':(((( RT @lutfiaKN: geus ngagoler, remot tinggaleun :(( #HoreamMoment'"
590493667854393345,2015-04-21 12:33:55,"b'Masia. :( RT @GombrangBDG: Ceuli ka asupan cai, di gerean ku bulu hayam, cai na kaluar, bulu hayamna anu tinggaleun. :(( #HoreamMoment'"
590492440223592450,2015-04-21 12:29:03,b':( RT @RidwanFG: Neukteuk kuku pondok teuing. :( #HoreamMoment'
590491664675835904,2015-04-21 12:25:58,"b'Setan! :((((( RT @syahrialkml: Tukang cuanki, mang antosan, nyokot mangkok, geus indit :( #HoreamMoment'"
590491448367185920,2015-04-21 12:25:06,b'Lagi makan enak..\n\n...Lalu letah kagegel. :( #HoreamMoment #cb'
590490085344161792,2015-04-21 12:19:41,b'DUAARRRR!! :( RT @MR_tulloh: Cingir titajong #HoreamMoment'
590489406399623169,2015-04-21 12:16:59,"b':((((( RT @pemanasan_: caprukBDG ada mang, hayang modol pas jadi pemimpin upacara. :(((( #HoreamMoment'"
590488536731619331,2015-04-21 12:13:32,"b'Hujan, poek, kangen. Ada lagi yang lebih nyiksa dari itu? :(((( #cb'"
590315578847440897,2015-04-21 00:46:16,b'Selamat hari kartini geuullsss! Hidup emansipatiwiritisili wanita! I love you! :* #cb'
590310743070744576,2015-04-21 00:27:03,"b'Suster.. | Iya dok.. | Pasien di kamar 120 kemana ya? | Saya suruh pulang dok, kasian dia lagi sakit.. | ARISIAAAA! :( #path #cb'"
590045496955113472,2015-04-20 06:53:03,b'Kan anjeng. :( #cb http://t.co/GZf1bvkTUk'
590030419153686528,2015-04-20 05:53:08,"b'Keluar geura guys, panasnya ngajak paciduh-ciduh nepi deukok anjir. :( #cb'"
589953442187071488,2015-04-20 00:47:16,"b'Ready stock size L 3 siki lagi guys, buat yg minat bisa langsung sms ke 081321921077 atau pin 535025F0. Muah! #cb http://t.co/KGRHY03rKv'"
589781667646025729,2015-04-19 13:24:41,b'Hari minggu mandi? \xf0\x9f\x98\x8f KAMPUNGAAAN! :( #cb'
589605238635507712,2015-04-19 01:43:37,"b'Beb ini seblak pedes gini cengeknya berapa? | Engga, ga pake cengek | Kenapa atuh lada? Pake saos? | Bukan, geliga. | Bagoooonnng! :((( #cb'"
589574965680164864,2015-04-18 23:43:20,b'Iklan spongebob ko lama sih bagong? Kaburu sangu koneng aing beak. :((((( #cb'
589423457286295552,2015-04-18 13:41:17,b'Malam minggu diem dirumah? HAHAHAHAHAHAHAHAHAHAHAHAHAHAHAHAHAHAHAHAHA LOMARI EXCEL SIA TEH? HMM? :( #cb'
589054176002383872,2015-04-17 13:13:54,"b'Hidup mah jangan malas guys, apalagi neplas, juhlas, panlas, masia. Blog. :( #cb'"
588851437527957506,2015-04-16 23:48:17,"b'Ketika kalian bisa buat gelembung dina ciduh, sementara temen kalian gabisa itu kaya.. \xf0\x9f\x91\x87 :( #cb http://t.co/EI70DXmR5Y'"
588846537284853760,2015-04-16 23:28:49,b'Pagi yang indah untuk jiwa lupatma. :( #cb'
588488829394296832,2015-04-15 23:47:25,"b'Mandi ah, pake seuneu, biar ga dingin. Heu. :( #cb'"
588488301025185792,2015-04-15 23:45:19,"b'Kalian tuh gatau apa-apa soal dilema sebelum kalian ngalamin ""disalimut hareudang, teu disalimut tiris"" moment guys. :( #cb'"
587234616894824448,2015-04-12 12:43:37,"b'Pokonya mah adek-adek yg besok UN optimalin dulu sendiri, klo takut salah jawabnya isi aja ""cinta"" karena cinta ga pernah salah. Bye. :( #cb'"
587233557812084738,2015-04-12 12:39:25,"b'Nanti geura ya, pasti ada temen kalian yg bilangnya sama ga belajar, tapi nilainya leuwih badag sianying itu. Aya pasti! :( #cb'"
587231437092294657,2015-04-12 12:30:59,b'5. Pengawas Ateul. Pengawas terakhir. Geus ah. Hoream mikir deui. :( #cb http://t.co/UvJkTV0Ua0'
