id,created_at,text
399191509431369728,2013-11-09 15:07:27,b'Iya anjir! :((( RT @ammar_fathin: caprukBDG percuma boga kabogoh oge ari foto KTP masih sendiri mah :(( #geuskalemkalem'
399188699155423232,2013-11-09 14:56:17,b'Percumalah punya kabogoh juga ari ombeh sorangan keneh mah.. Ga guna! :(((( #geuskalemkalem #cb'
399186837794611200,2013-11-09 14:48:53,b'BIASA WEH ATUH NENG DIBONCENG NINJANYA GAUSAH DIJUCUNG-JUCUNGIN GITULAH ANJIR BUJURNYA! KAGOK MAKE GATSBY GABLAAAG!!! :(((( #cb'
399186036816752640,2013-11-09 14:45:42,"b'Kalian teh kenapa ya? :((((( RT @GombrangBDG: Keur nitah nebak!! Yes, aing bener!! RT @banyolanhidup: Wilujeung wengi, tebak aing keur naon?'"
399136089358622720,2013-11-09 11:27:13,b'Jomblo + Sepi + Sendiri + Lemari = Dunia Narnia. :(((( #cb'
399114198057115648,2013-11-09 10:00:14,b'*basket* Pemaen: Yaa oper opeerr!! | Wasit: *priiitt* HAAANDD!!!!! | Pemaen: ARISIAAAA!!! | Wasit: :(((( #cb'
399111623828201473,2013-11-09 09:50:00,b'Kami #ABSpride lagi ada di acaranya @TelkomEBSCUP13 di Gor Padjadjaran nih guys. AYO merapat sekalian dukung tim SMA kalian :)'
399103762494545920,2013-11-09 09:18:46,b'Jir kenapa di gor pajajaran teh ga ada prabu siliwangi atau kiansantang gitu? Ah lieurlah. :(((( #cb'
399095436130021376,2013-11-09 08:45:41,"b'Daripada malam minggu ngagulingkeun motor yang bobogohan di jalan, meuning ke Gor Pajajaran liat Acaranya @TelkomEBSCUP13 buruuu!! #cb'"
398818836222193665,2013-11-08 14:26:34,b'Sist @aurelhermansyah kamu teh siapanya Oki Lukman? :(((( #cb'
398817447265845248,2013-11-08 14:21:03,"b'Kalo tipe pacar idaman kamu yang kaya Rio Dewanto, aku sebagai pengamat Hendrik Ceper bisa apa? :(((( #cb'"
398477501082505217,2013-11-07 15:50:14,"b'Apapun yang terjadi aku tidak akan menyerah, karena penyesalan itu datangnya di akhir, yang datang di awal mah regu piket. Anying! :( #cb'"
398476550917455873,2013-11-07 15:46:27,"b'Kalo tipe pacar idaman kamu yang kemana-mana selalu memakai mobil, aku sebagai tukang sari roti bisa apa? :(((( #cb'"
398475166310596608,2013-11-07 15:40:57,"b'Kalo tipe pacar idaman kamu yg selalu membawa iPhone dan dompet badag, aku sebagai pengguna mito dan pengumpul kencring bisa apa? :(((( #cb'"
398473670911197184,2013-11-07 15:35:01,"b'Kalo tipe pacar idaman kamu seperti Edward Cullen, aku sebagai Scooby-Doo bisa apa? :((((( #cb'"
398326931369631744,2013-11-07 05:51:55,"b'Hidup mah gausah banyak pencitraan, kecuali kalo ngerasa hirup kamu hurik. Hehe. :) @olegunnnn #cb'"
398325439946436608,2013-11-07 05:46:00,b'Oh jadi yang beungeutnya kaya mouse simbada itu pacar kamu? Ohhhh~ :( #cb'
398324534576574464,2013-11-07 05:42:24,"b'Ungkapan ""dari mata turun ke hati"" teh ternyata bohong anjir, yang bener mah ""dari wareug turun ke mata"" molor weh. :(((( #cb'"
398035937218670592,2013-11-06 10:35:37,b'*madtari* Mass.. | *leos* | Masss.. | *leos* | MASSSS.. | *leos* | MASSSSIAWEHANYENG! :(((( #cb'
398030850375159808,2013-11-06 10:15:24,b'Internet dulu kalee indomi telor warnet. :( RT @GombrangBDG: Panas-panasan dulu di madtari bareng @caprukBDG hehe..'
397987994402967552,2013-11-06 07:25:06,b'Oh jadi yang beungeutnya ngaheab kaya asbes kacaangan jam 12 beurang teh pacar kamu? Ohhhh~ :( #cb'
397850891430023168,2013-11-05 22:20:18,b'GOOD MORNING I SEE YAA!! Hehehe. Bagong! :( #cb'
397757253844889600,2013-11-05 16:08:13,"b'Kalo ada temen kamu yang caper, kalian bisikin ditelinganya bari letak saeutik gini ""pengen kapuji ya? Kasian"" Ok? Sip! :( #cb'"
397696094781464576,2013-11-05 12:05:12,b'*madtari* MAS MESEN INDOMI GORENG!!! |  Indomi goreng apa mas? Kornet? Keju? | INDOMI GORENG PISAN ANYING! | *degungkeun* ARISIAAA! | :( #cb'
397660695824580609,2013-11-05 09:44:32,b'Neng mau ga jadi pacar aku? | Hmmm.. Gimana ya? Kasih aku waktulah.. | Oke berapa lama? | 2abad.. | Oke! :((( #cb'
397658758542675968,2013-11-05 09:36:50,"b'Nama: Aci, Nama Lengkap: Aciya mah goblog. :(((( #cb'"
397625509086900224,2013-11-05 07:24:43,"b'Leureus abdi mah jalmi alit, da nu badag mah beungeut sia! Jeubag! :( #cb'"
397609990283739136,2013-11-05 06:23:03,b'Ku tau kamu bosan~ ku tau kamu jenuh~ ku tau kamuuuuuuu~ Nugelo budug~ vierra - takut :(((( #nyanyiinaja #cb'
397269453206863872,2013-11-04 07:49:53,"b'Yang bilang dunia itu sempit, pasti sieta hirupna sapopoe dina pas photo anying! Hahahahahahaha eh. :( #cb'"
397266538102681600,2013-11-04 07:38:18,"b'Yang bilang hidup itu singkat, pasti lahirnya dina hape esia anjir. :( #cb'"
396910077434544128,2013-11-03 08:01:51,"b'Ceuli aja berpasangan, masa kamu engga. Sip. Jos! Jreng~ :(((( #cb'"
396773434098601984,2013-11-02 22:58:53,b'Selamat pagi kang emil @ridwankamil .. Ayo kita lari pak.. Jangan jauh-jauh.. Kesitu aja yang deket.. Kamerun. :('
396768973347246081,2013-11-02 22:41:09,b'Lagu lagu apa cik yang paling sakit kalo didengerin? Ari Laso - Lirih! Apalagi dengerinnya sambil dijenggutan abri. Anjir. :( #cb'
396767394363760641,2013-11-02 22:34:53,"b'Jika kau dikhianati pacarmu sendiri, tersenyum dan bisikanlah ""LAILAHAILLALLAH!"" Lalu bungkus make kaen bodas. :) #cb'"
396765625151803392,2013-11-02 22:27:51,b'Ah aku mah kieu weh da nu kitu mah tatoan. Nu kitu Mirzani. Masia! :( #cb'
396760926147190784,2013-11-02 22:09:10,b'Congratulation Morning All! :) #cb'
396675371279458305,2013-11-02 16:29:13,"b'Buat cowo yang suka cewe dugem, NGAJAMIN MODOL SIA KELAP KELIP BURICAK BURINONG KITU? HAAAH! :( #cb'"
396654204749484032,2013-11-02 15:05:06,b'Kamu tipe cewe yang suka cowok pake mobil? KE MAS KAWIN MAKE NAON? BAN SEREP ANYING? HAAAH!! :( #cb'
396642550125051905,2013-11-02 14:18:47,"b'Jomblo itu sendiri, sendiri itu mandiri, mandiri itu bank, bank itu loba duit, jadi jomblo itu loba duit. LUMAH JEFLI MANA HAAH! :((((( #cb'"
396615363317604353,2013-11-02 12:30:46,b'Kerja kelompok. RT @esa_RP: @caprukBDG ari mencug teh naon pruk ?'
396614310434066432,2013-11-02 12:26:35,b'Kamu tau ga bedanya cucunguk sama tali sapatu converse warna pink? Gatau kan? Yaudah berarti kita jodoh! Mencug yu? :( #cb'
396611602750771200,2013-11-02 12:15:49,b'DA GA GAYA ENGGA TATANGKEUPAN DI MOTOR GABLAAAAGGG!!! JIGA MAWA TUYUL SIA APAL? HAHAHAHAHAHAYANG. :(((( #cb'
396570630826377216,2013-11-02 09:33:00,"b'Jangan so ripuh deh hidup kalian, bisi diasupan alfamart kana ceuli ku aing! Syukuri beul! :) #cb'"
396529468744794112,2013-11-02 06:49:27,"b'Kalo malaikat pencabut nyawa ngsms gini ""Bro, pulang yuk? "" kalian mau bales apa? ~@TwiterRun #cb'"
396526377156878336,2013-11-02 06:37:10,"b'Selamat #sataunangombrang @GombrangBDG tetap berkarya, tetap berkreatifitas, ingat! Menghibur diri terbaik adalah menghibur orang lain. #cb'"
396234868322877440,2013-11-01 11:18:48,"b'Beb kamu udah makan belum? Jangan lupa makan ya, nanti aku gorolongin make roda batagor geura kalo modar salatri. :( #cb'"
396228158565126144,2013-11-01 10:52:09,b'Hayu order kaos @GombrangBDG karena 10% nya akan disumbangkeun ke yang membutuhkan #SataunanGombrangBDG #HayuBeramal http://t.co/avfp0CLYyD'
396214062352052224,2013-11-01 09:56:08,"b"":') #geuskalemkalem RT @Seucapnya: Mengamati caramu bicara &amp; tersenyum dari jauh sudah menjadi kebahagiaan kecil untukku #SecretAdmirer :)"""
396207187371884544,2013-11-01 09:28:49,b'Bro ke Bali yuk? | Jir bro pesawatnya mahal euy.. | Ih anjir ada yang murah beul | Wah? Naek apa bro? | Dipaketin JNE bro! | GOBLOG! :( #cb'
396195572584943617,2013-11-01 08:42:40,b'Bertaubatlah kalian para peng-invite pokopang setaaan!!! :(((( #cb'
395890002648788992,2013-10-31 12:28:26,b'Oh jadi yang beungeutnya kaya bumbu cuba itu pacar kamu? O A2 Y E&amp;! :(((( #cb'
395832483150700544,2013-10-31 08:39:52,b'Kenapa kamu sotau? Da sotau mah enaknya make bumbu kacang. #geusgandeng #cb'
395830850333339648,2013-10-31 08:33:23,b'BUSEEETTDAAAH! BUJUR KABESET DIBEDAH! :((((( #cb'
395553068055404544,2013-10-30 14:09:35,b'kalian pelajar dan suka basket &amp; futsal? daftarin tim kalian di kompetisi se jawa barat ini ke  @TelkomEBSCUP13 buruan daftar!'
395530831709487104,2013-10-30 12:41:13,b'Aku + Kamu = Isukan deui. :( #geuskalemkalem #cb'
395527980090261504,2013-10-30 12:29:53,"b'Hujan, jomblo, sendiri, tali rapia, lawang panto, Pas! :((((((((((( #cb'"
395511280078835712,2013-10-30 11:23:32,b'Neng kamu gendut ih! | Seksi ya A? | KOS TITANIC GOBLOG! | :((((( #akuselalusalah #cb'
395510801408094208,2013-10-30 11:21:37,"b'Kalian tau ga ungkapan ""Gerimis Mengundang"" teh mengundang apa cik? Mengundang nu bobogohan digelengan ku aiingg!! :( #geuskalemkalem #cb'"
395140259320590336,2013-10-29 10:49:13,"b'Iya aku mah ga sempurna, yang sempurna mah si Demian. :(((( #cb'"
395126905478733824,2013-10-29 09:56:10,b'Senangnya hatiku~ Turun panas bujurku~ Kini aku bermain dengan sanca~ :(((( #nyanyiinaja #cb'
395123393550225408,2013-10-29 09:42:12,"b'Kalian garandeng aja ih, kaya TL mantan. :( @GombrangBDG @mamaneh_weh @olegunnnn'"
395121425289203713,2013-10-29 09:34:23,"b'Kamu marah-marah aja ih, pengen modol magma? HAH!!! :( #cb'"
395115098634592256,2013-10-29 09:09:15,"b'Aku masih lalieur siah sama nama artis si Gamal Tapiheru, dia teh Gamal? Tapiheru? Jadi gimana? :((((((( #cb'"
395114288206983170,2013-10-29 09:06:01,"b'Kalo sayang itu bilang, gausah takut.. Moal ngabeledug moal. Hehe. :( #cb'"
395108654132654080,2013-10-29 08:43:38,b'*iklan* OM.. OM.. TREUK AJA GANDENGAN MASA OM ENGGA? | SIA NU GANDEEENG!!!! | :(((( #cb'
394807168932646912,2013-10-28 12:45:38,"b'Anying ah. :((( RT @RakaMahardika17: @caprukBDG ngarep cinta kamu mah lama, kaburu cinta fitri tayang deui anying ah! :('"
394806102878990338,2013-10-28 12:41:24,"b'Iya anying teh. :( RT@TaufikHdyt8: Ngarep cinta kamu mah lama, kaburu sangu asak anying ah! :('"
394804904167870464,2013-10-28 12:36:38,"b'Iya anying ah! :( RT @sementara__: @caprukBDG ngarepin cinta kamu mah lama, kaburu lampu merah deui anying ah! :('"
394804081476116481,2013-10-28 12:33:22,"b'Ngarep cinta kamu mah lama, kaburu iklan anying ah! :( #cb'"
394802871012569088,2013-10-28 12:28:34,b'Edan keren euy!! RT @GombrangBDG: #CintaLingkungan jeung #HayuBeramal di kaos #SataunanGombrangBDG hehe mangga di cek http://t.co/dRiCSmUX6s'
394799400582520832,2013-10-28 12:14:46,b'Ah kamu mah Kobe Kolot Belegug. :(((( #cb'
394798917889454080,2013-10-28 12:12:51,b'Mendung dan malam mengingatkanku padamu.. Oh sayang.. Oh hideung.. Oh pensil 2b.. Goblog siah! :(((( #cb'
394763357623836672,2013-10-28 09:51:33,"b'buat kalian yang masih SMA wajib ikutan kompetisi futsal dan basket ini, more info @TelkomEBSCUP13 | http://t.co/zcMJJuZvLZ'"
394668677221470208,2013-10-28 03:35:19,"b'KAMI PUTRA PUTRI INDONESIA MENJUNJUNG BAHASA PERSATUAN, BAHASA INDONESIA! MERDEKAAAA! #inimahserius #cb'"
394666689431748608,2013-10-28 03:27:25,"b'KAMI PUTRA PUTRI INDONESIA MENGAKU, BEUNGEUT YANG PALING GORENG ADALAH BEUNGEUT KABOGOH SIA! :( #cb'"
394665303063289856,2013-10-28 03:21:55,"b'KAMI PUTRA PUTRI INDONESIA MENGAKU, MOAL BANDEUL KA KOLOT DAN MOAL NGAHARKOSAN DEUI BISI KARMA! AMIN. :( #cb'"
394638030712999936,2013-10-28 01:33:33,"b'Tadinya aku mau Ngechat kamu, tapi aku lupa kamu kan bukan tembok. hehehe. Bagong! :( #cb'"
394629926080376832,2013-10-28 01:01:20,"b'Selamat hari sumpah pemuda! Semoga kalian para Pemudseu-pemudseu pada sadar ya cyin, bahwa kalian itu pemudaaa!! #cb'"
394628789377855488,2013-10-28 00:56:49,"b'Sikat gigi pake paniti, selamat pagi tambatan hati. Hahay anyeng aing bisaan kieu. :""&gt; #cb'"
394430508160933889,2013-10-27 11:48:55,b'Ah kamu mah loba gaya siah bungkus saripohaci! Beungeut tah bodas! Punduk hideung! Belegug! :((((( #cb'
394422151706468352,2013-10-27 11:15:43,b'Telkom EBS Cup 2013  kompetisi Olahraga tingkat SMA Se-Jawa Barat | more info @TelkomEBSCUP13 | http://t.co/zcMJJuZvLZ'
394247728743477250,2013-10-26 23:42:37,"b'Kalian yang masa kecilnya belum pernah maen kok make triplek atau piring plastik, pasti hidupnya ga toktak banget anjirlah. :( #cb'"
394246039957286912,2013-10-26 23:35:55,b'Selamat pagi setrit ibu-ibu senaaammm!!!  ;) #cb'
394124445943492608,2013-10-26 15:32:45,b'GABLAAAG HANAS DIBACA!! RT @GombrangBDG: MBLO LAGI PADA NGAPAIN MBLO? GA ADA KERJAAN YAH MAKANYA BACA TWIT INI :)))) #gombrang'
394095912546353152,2013-10-26 13:39:22,"b'KAMANA ATUH ARISIA NONTON DANGDUT WAE KUDU MAKE HELM, DA MOAL REK POTO KELAS GABLAAAGGG!! :(((( #cb'"
393978476132196353,2013-10-26 05:52:43,b'Neng kamu teh cantik cuman sayang.. Kolornya merk alligator anyeng aesea lalaki? :(((( #cb'
393722241608740864,2013-10-25 12:54:32,b'event kejuaraan Futsal &amp; basket putra &amp; putri se-jawabarat antar sekolah click disini : @TelkomEBSCUP13  | http://t.co/zcMJJuZvLZ'
393708330553597952,2013-10-25 11:59:15,b'Belut belut apa yang cocwit banget? Taluk? Belutaha untuk jadi eang teulbaik. :(((( ~@shellazivana #cb'
393662591857205248,2013-10-25 08:57:30,"b'Ternyata omongan ""Geus tong ngumbah motor bro, bisi sore hujan"" itu bener anjirlah. Hoream. :( #cb'"
393526784659963906,2013-10-24 23:57:51,"b'Ngarep cinta kamu mah lama ih, kaburu hutang kabayar. :((( #cb'"
393519237295124480,2013-10-24 23:27:52,"b'Jadi jelema mah ulah sombong, Bisi teurab damri :(((  #cb'"
393503748447682560,2013-10-24 22:26:19,"b'Bro geus hudang? | Geus bro, aya naon? | SARE DEUI IH TIRIS ARISIA!! | MASIA WEH BANGKONG ZUMA!! ~ @takutkurus #cb'"
393391730428346368,2013-10-24 15:01:12,b'Kamu tumben makannya banyak ih.. mau ngaspal jalan ya? :((( #cb'
393366590214795264,2013-10-24 13:21:18,b'yeuh aya turnament Futsal &amp; Basket buat pelajar putra dan putri info lanjut mah follow weh  @TelkomEBSCUP13 | http://t.co/zcMJJuZvLZ HAAAAA~'
393338493113364480,2013-10-24 11:29:39,b'Buat yang punya pacar semoga langgeng ya. Hehehe... TAPI DEULEU TAH AVA AING GABLAAAAG!! :(((( #geuskalemkalem #cb'
393278212043599872,2013-10-24 07:30:07,b'Cewek gendut itu seksi tau. Seksi Kurbanisasi. :(((( #cb'
393276706850496512,2013-10-24 07:24:08,"b'Ini aku dengan segala kekuranganku, dan kamu dengan segala hayangmu. Anying! :(((( #cb'"
393026030329282560,2013-10-23 14:48:02,"b'Hati ini bukan kamper, jadi gausah kau gantungkan begitu aja arisia gablaag! :(((( #geuskalemkalem #cb'"
392863327468019713,2013-10-23 04:01:30,b'KUMAHA SIAAAAA!!!! :( RT @Sebodornya: MALAIKAT JUGA TAUUUUUU SIAPAAAAAAA YANG JADII SILUMANNYAAAAAA!!!!~ glen fredlly'
392858583383035904,2013-10-23 03:42:39,b'TEU KUDU DIANGKAT WEH TELPON AING MAH DA LAIN POPOEAN REK HUJAN! :(((( #geuskalemkalem #cb'
392851537698893826,2013-10-23 03:14:40,"b'Guys ini pin baru aku ya 73ub49, sok cepet invite nanti aku accept. Accept Solihin. :(((((( #cb'"
392673640468054016,2013-10-22 15:27:46,b'Bro naha twitter urg teu bisa dibuka nyak? Salah password kitu? | Cobaan ketrok bro samlekum kitu.. | BALEG GOBLOG!!! | :(((( #cb'
392557729245442048,2013-10-22 07:47:10,b'Mang @olegunnnn soundcloudnya hade euy coveran lagu si rey mysterio ya? SOK LILAA~ :('
392557094525620224,2013-10-22 07:44:39,"b'Kamu mah deket sama aku teh cuma seperlunya aja, strobery mangga apel anjirlah sorry ga lepel! Hih! :( #cb'"
392556115231125504,2013-10-22 07:40:45,b'Aa aku bagus ya pake baju belang-belang? | BAGUS BEUNGEUT SIA REUMPAG! JIGA TROTOAR GABLAAAAG! | :(((( #akuselalusalah #cb'
392128467858227200,2013-10-21 03:21:26,b'Bro kamu mah typo aja euy pake hape teh! | Sorry bro hape aing karek di pel jadi laleueur keneh heu~ | BEUNGEUT SIA BOTOL WIPOL! | :( #cb'
392083948458622976,2013-10-21 00:24:32,"b'Selamat hari senin guys, selamat upacara! KOBARKAN JIWA PEJUANGMU! MERAH ITU BERANI BUKAN BERHENTI! DITILANG? KUMAHA ENGKE! MERDEKAA! #cb'"
392079657148751875,2013-10-21 00:07:29,b'Berikan aku 1 pemuda niscaya aku akan mencabut tangkal caringin bari jojogedan. MERDEKAAA!! JEBREEEEET!!! :( #cb'
391895608258068481,2013-10-20 11:56:08,b'Yu ar biyutipul~ Biyutipul~ Biyutipul~ Kamu cantik cantik~ Tapi kamaarriiii~ :(((( #cb'
391873914747359232,2013-10-20 10:29:56,b'*lagi makan* Bro adeuk? | Adeuk at... | Ciduhan? | Anying!! :(((( #cb'
391567919072571392,2013-10-19 14:14:01,b'Bro kenapa ga malam mingguan? Gapunya pacar ya? Jomblo ya? Goreng patut ya? | APA AI KAMU MEUNI SOK RARIWEUH!!! | :(((( #cb'
391347517197000704,2013-10-18 23:38:13,"b'Oke, buat kalian yang jomblo, waktu senang kalian spesial untuk hari ini tinggal 11 jam 62menit lagi sebelum datang malam minggu. :(((( #cb'"
391136163009806336,2013-10-18 09:38:22,b'Ah kamu mah jahat anjir jiga si Miska. :(((( #yangudah #bae #cb'
391126084118253569,2013-10-18 08:58:19,"b'CATET NIH DINA TARANG! PENTING! RT @SixpointCloth: Tees @caprukBDG sdh masuk tahap jahit, proyeksi selesai keseluruhan produksi pd tgl 23Okt'"
391089732601393152,2013-10-18 06:33:53,b'Oh jadi yang beungeutnya hinyay kaya minyak jalantah itu pacar kamu? EKE BEGINDANG~ EKE BEGINDANG~ EKE BEGINDANG~ DANG DANG DANG~ :((( #cb'
390857394609074176,2013-10-17 15:10:39,"b'Karena ngirim santet lewat dukun itu sudah biasa, ISUKAN AING REK NGIRIM SANTET LEWAT JNE WE LAH LIEUR!!! :(((( #cb'"
390792152487170048,2013-10-17 10:51:24,b'Dibalik Pria Jelek Ada 3 Kemungkinan Tipe Wanita: 1. Sabar 2. Terima Apa Adanya 3. Belegug. :((( ~@arifeira #cb'
390782309336510464,2013-10-17 10:12:17,"b'Permisi, jalan ke hati km kemana ya? | DARISINI LURUS TERUS NEPI NGREDIT MIO TERUS BELOK KANAN DEKET JURANG TERUS NGAJLEUNG WEH SIA! | :( cb'"
390745037165703168,2013-10-17 07:44:11,b'Hati ini bukan tangkal kerseun. Jadi please atuh anying jangan ngeundeug-ngeundeug hati aku aja. :((((( #cb'
390468939408351232,2013-10-16 13:27:04,b'PATDETIK LAGI JADI INIMAH EUY! :( RT @SixpointCloth: Kaos @caprukBDG sdh selesai tahap potong bahan &amp; akan segera naik ke tahap penyablonan.'
390466858744565760,2013-10-16 13:18:48,b'Mungkin dia lelah ~ :((((( #KalimatAnyingBanget #cb'
390462902106202112,2013-10-16 13:03:04,"b'Heunteu, langsung komat. Hehehe. RT @nyenyepiaggio: Saya rek nanya, ai kamu lahirnya di adzanan teu ?'"
390458226212216832,2013-10-16 12:44:30,b'Malam ini aku merindukanmu dulu yang pernah ada disaat kegelapan menghampiriku... Oh patromak. :((( #sorrysorry #cb'
390456934857314304,2013-10-16 12:39:22,b'Iya sama @KabogohBatur dan @GombrangBDG lagi neang impun sama keuyeup. RT@TwiterRun: @caprukBDG pruk keur di bober? Keur naon?'
390406720289128448,2013-10-16 09:19:50,b'Bro ai maneh kamana wae? | Aya wae bro! | Aya wae kumaha? Geuning di imah urg euweuh! | KUMAHA SIA!!! :( #cb'
390397832126951424,2013-10-16 08:44:31,"b'Pacaran: ""Beb jalan yu? | Hayu!"" , Jomblo: ""Ep, jalan yu? | Mbung ah cape, make motor weh yu? | Hayu!!"" :(((( #cb'"
390141236775878656,2013-10-15 15:44:53,b'Mang naek odong-odong patjutaeun mang! | KAJEUN KU AING DIBAYAR 6JUTA SIA GELUT SAPAEHNA JEUNG AING GABLAAAGGG!!!! | :(((( #cb'
390009513551486976,2013-10-15 07:01:28,b'NYATE WEH TERUS NEPI KA BALIKAN JUG!!! :(((( #geuskalemkalem #cb'
390008864256438272,2013-10-15 06:58:53,b'Sate sate apa yang ga usah? Taluk? Satekudu! Masia!!! :( #cb'
389965384222121984,2013-10-15 04:06:07,b'Selamat Darah Tinggi 1434 H. :(((( #cb'
389741393985273856,2013-10-14 13:16:04,b'Domba Biasa: MBEEEEE~ | Domba Iwan Fals: MBEEE MBEEE  MBEEE MBEEEENTO!~ :((((( #cb'
389737506989543424,2013-10-14 13:00:37,b'Asup surga moal? RT @Ryanwar: pruk @caprukBDG boga Ask.fm teu?'
389736482719535104,2013-10-14 12:56:33,b'Jangan pergi dulu sayang aku mohon! | Maaf aku gabisa.. | Tapi yang... | Maaf! | TAPI SENDAL SIA PATUKER JEUNG AING GOBLOG! | Oh.. :((( #cb'
389735719100362752,2013-10-14 12:53:31,"b'Ga ko kamu mah ga salah, yang salah mah tukang anggur jualan jolang. Apa ya? :((( #cb'"
389734079161061378,2013-10-14 12:47:00,"b'Jangan samakan aku, karena aku moal rek piknik. FAAKKKKK! :((( #cb'"
389724496199823360,2013-10-14 12:08:55,"b'Karena meuncit domba atau sapi itu terlalu mainstream, makanya aku mah mening meuncit sifat goreng aja ah biar selalu disenangi. Edan. #cb'"
389701560860553216,2013-10-14 10:37:47,b'IYALAH IYA AING TYPO DA SIA MAH SEMPURNAAAAA GABLAAAAAG!! :((( #cb'
389698556048584704,2013-10-14 10:25:50,b'Stop! | Iya pak kenapa? | Kenapa anda naok motor bertiga? | MUN DALAPAN ORANG AING MAH KAJEUN FUTSAL GABLAG OPATAN OPATAN!! | :((( #cb'
389402497262948354,2013-10-13 14:49:24,b'A beli pulsa A.. | Yang gimana neng? Elektrik atau Vocher? | Yang setia dan ga nyakitin ada? | BALEG GOBLOG!!! | Vocher~ :(((((((( #cb'
389011045278183425,2013-10-12 12:53:55,b'Daki daki apa yang Kasian? Taluk? Dakita mah udah ga sejalan. :(((( #geuskalemkalem #cb'
389010391499407360,2013-10-12 12:51:19,b'Bro! | Oit! | Sapedah Kumbang jeung Panto mun digoreng ngeunah mana? | Panto! | Belegug! Nya ngeunah FriedChicken atuh! hahaha | GOBLOG! #cb'
388954262073389056,2013-10-12 09:08:17,b'EMANG MALAM MINGGUAN ADA DI AL-QURAN HAH?!! RIWEUH SIA! :(((( ~@IntanNathalie #cb'
388948281486622721,2013-10-12 08:44:31,"b'Cantik itu Relatif, Matre itu Primitif. HAA SIAH HAA! :((( #cb'"
388946732861497344,2013-10-12 08:38:22,"b'Hidup itu perjalanan, bukan pengharapan. Jadi, jalani aja... Kalo cape numpak kuda. Hehehe. :( #cb'"
388945521533931520,2013-10-12 08:33:33,"b'Buat yang udah mesen baju @caprukBDG , sekarang baju sudah masuk tahap produksi, untuk info lebih lanjut monggo di cek TL @SixpointCloth #cb'"
388703662672863232,2013-10-11 16:32:29,"b'Neng kamu tambah cantik aja ih, emang camera360 udah ada upgrade-an barunya ya? :(((((( #cb'"
388702549265510400,2013-10-11 16:28:04,"b'KUMAHA SIA DODO RAGAJI!!!! :( RT @Sebodornya: Jangan bermain api, gas lagi mahal soalna dollar naek :((('"
388683562683092992,2013-10-11 15:12:37,b'SAMARUKNA SIA LUCU BOBOGOHAN HAREUPEUN AING TEH HAH? GEUS NGASAAN RODA BATAGOR NYELAP DINA BUJAL CAN? ADEUK?!!! :(((( #geuskalemkalem #cb'
388625487108374528,2013-10-11 11:21:51,"b'Kalian yang tau lagu ini pasti hidupnya haram untuk bergalau ""AWIM MAWEK~ AWIM MAWEK~ AWIM MAWEK~"" :( #cb'"
388509808233435136,2013-10-11 03:42:11,"b'Ingat! Jumatan lah karena Allah, bukan karena hayang ka puji. Edan. :) #cb'"
388260373716946945,2013-10-10 11:11:01,b'Ah kamu mah riweuh lah kaya dicabut borok garing. :( #cb'
388258685811560448,2013-10-10 11:04:18,b'Ngarep cinta kamu mah kaya makan bubur make sedotan tau ga? HESE GOBLOG!!!! :((( #geuskalemkalem #cb'
388203404763217920,2013-10-10 07:24:38,"b'Hidup mah jangan banyak ngomongin orang guys, pengen jadi sampul buku hidayah sia teh? :(((( #cb'"
387931704750780417,2013-10-09 13:25:00,"b'Hidup mah cari aman aja guys, jangan carileupeung. Belegug. :((((( #cb'"
387917646756610048,2013-10-09 12:29:08,b'Ah kamu mah loba gaya jiga ngajuru di distro wae. :((((( #cb'
387911693512491008,2013-10-09 12:05:29,"b'Neng maaf ya kalo aku sering ngesms terus. Risih ga neng? | Ga A, da risih mah kalo poni udah kana panon. Hehehe | ITU DISANAAAAAH!!! :( #cb'"
387796539550085121,2013-10-09 04:27:54,b'*Di Mekdi* Mas saya mau pesen dong.. | Iya pesen apa mas? | Ada paha? | Ada! *calana kaluhurkeun* YEUH!!!! | GOBLOG! :(((( #cb'
387794260826673153,2013-10-09 04:18:51,"b'Pacar orang kaya: ""Yang makan sama apa? | Steak yang!"" | Pacar Seadanya: ""Yang makan sama apa? | Geliga yang!"" :((((( #cb'"
387566774985580544,2013-10-08 13:14:54,b'Merindukanmu itu seperti disanggul pake ban serep tau ga? Berat dan Mamantes anjir. :((( ~@ablehkirky #cb'
387489016779522048,2013-10-08 08:05:55,"b'Kalian belum benar-benar dikatakan manusia, jika kalian belum pernah ticatrok huntu. :(((( #cb'"
387482287031324673,2013-10-08 07:39:10,b'Aku menatap matamu. Cileuhan. Ngagantung. :) RT @kisahFTV: Aku menatap matamu. Menenangkan. Menyenangkan :)'
387481116942159872,2013-10-08 07:34:31,"b'Ini pensil, ini permen mint.. daripada gigitin pensil meuning ngegelan cermin. Anyeeeeeng! :(((( #cb'"
387480138687844352,2013-10-08 07:30:38,"b'Maaf aku mah banyak salah, da yang banyak boong mah pinokio, da neng mah dari kampung, neng mah cuma lulusan SD. :(((( #cb'"
387479117949435904,2013-10-08 07:26:35,b'Lagi hujan-hujan gini mah enaknya malidkeun kenangan euy. KAMANA!! JURAGAN SEHAT? LUMAH JEFLI MANA HAH? :((( #cb'
387108591846449152,2013-10-07 06:54:15,b'Bro aku sakit hati.. | Ah santai bro jauh keneh kana peujit! | DUA JENGKAL GOBLOG!!!! | Oh iya atuh ampun :((( #cb'
387090067522473984,2013-10-07 05:40:38,"b'AKU MAU NGOMONG SESUATU SAMA KAMU, AKU TUH SEBENERNYA SA.... *sebagian text ka oyag-oyag diangkot* :((((( #yangudah #cb'"
387087044142313472,2013-10-07 05:28:37,b'KUMAHA SIAAAA! :((( RT @Sebodornya: Neng lagi apa ? | Lagi cantik2nya a | TEU USUM ATUH AI SIAA NENG !!! :(('
387083447606341632,2013-10-07 05:14:20,b'Sayang kamu lagi apa? | Lagi diem aja.. | Udah makan? | Belum.. | Tanya aku atuh! | Udah modol? | GABLAAAAAAGG IH!!! :(((( #cb'
387075343447638016,2013-10-07 04:42:08,b'Atuh capeeun dilumpatkeun mah aliciaa!! :((( RT RT @detikcom: Satu Korban Tewas Dilarikan ke RS Sartika Asih http://de.'
387074481543340032,2013-10-07 04:38:42,b'Mencintaimu itu seperti budak leutik naek odong-odong patjutaeun tau ga? Seneng!!!! :) #cb'
386701772225400832,2013-10-06 03:57:41,"b""Bro kamu kurban ga? | Kurban bro | Kurban apa bro? Sapi? Domba? | Perasaan bro.. :') | MBEEEE!!! *peluk* #cb"""
386700728380579841,2013-10-06 03:53:32,"b'Iya aku mah banyak boong, da yang banyak huis mah si kakek. :((((( #cb'"
386455529062535168,2013-10-05 11:39:12,"b'Sisanya pada maen futsal ya min? :(((( RT @InilahFaktanya: 2 dari 10 orang di dunia, menikah dgn cinta pertamanya.'"
386454509540503553,2013-10-05 11:35:09,b'ASLINAAAA!! LUMAH JEFLI DIMANA HAAAH! :( RT @InilahFaktanya: Kenangan indah lebih mudah terlupakan.'
386444921676111872,2013-10-05 10:57:03,"b'Iya maaf aku mah banyak bohong, da yang banyak uang mah si aburizal bakrie. :((( #cb'"
386441504803127296,2013-10-05 10:43:29,"b'Iya maaf aku banyak salah, da yang banyak pulsa mah M-Tronik. :(((( #cb'"
386125027269038080,2013-10-04 13:45:55,"b'Punten da abi mah manusa moal jauh ti lepat, mun bala-bala moal jauh ti leupeut. Gablaaaag! :((((( #cb'"
386055066878111744,2013-10-04 09:07:55,b'Kenapa ya aku tiap liat muka pacar kamu asa pengen sholat isya terus? :((((( #cb'
