id,created_at,text
500977701729996801,2014-08-17 12:09:26,"b'Tapi yang enak mah lomba balap karung euy, batur mah aaclogan, aing mah naek motor. HAHAHAHAHAHAHAHAHAHAHAHAHA blog! :( #cb'"
500976997233733632,2014-08-17 12:06:38,"b'Terus aku mah ikutan lomba ngambil koin di buah sirsak, koinna teu kacokot, sirsakna weh ku aing jus da enak. :( #cb'"
500975858660569088,2014-08-17 12:02:07,"b'Di daerah aku mah lomba maraton Hadiahnya teh amplop tulisannya gini ""Selamat anda diperbolehkan muter 2x lagi"" ceunah. :( #cb'"
500974570879217666,2014-08-17 11:57:00,"b'Gelo lah tadi aku lomba balap kerupuk di diskualifikasi, gara-gara mawa angeun kacang. Da atuh enak angeun kacang jeung kurupuk teh! :( #cb'"
500796386091085824,2014-08-17 00:08:57,b'Pagi-pagi beungeut udah kasebrot angin knalpot gandeng. Kan goblog. :( #cb'
500783565752127488,2014-08-16 23:18:00,b'HIIIIIIDUPLAAAAAAH INDONEEEESIA RAYAAAAAAA!!!! MERDEEKAAAAA!!!! #cb'
500189259916398592,2014-08-15 07:56:27,"b'Ih pasti dong stingaks. Mau? Sms aja 08972739387 RT @adytiaivan: Asa nambah tampan make kaos caprukBDG ,nuhun! http://t.co/BmVX5mfA0u'"
500188096361549825,2014-08-15 07:51:49,b'Apa cuma aku di dunia ini yang hoream make sendal baseuh?? Hoof!! #cb'
499469380162301952,2014-08-13 08:15:54,"b'Kalo ngomong jangan tinggi-tinggi, nanti nabrak pesawat. HAHAHAHAHAHAHAHAHAHAHAHAHAHA. :( #cb'"
499463213147095040,2014-08-13 07:51:24,"b'Anying. :(((( RT @Seucapnya: Bukannya aku tidak mau bertemu, tapi nanti saja setelah aku bisa ""biasa saja"" mendengar namamu di telingaku. :)'"
499212965078253568,2014-08-12 15:17:00,b'DOOOOHH GABLAAAAG!! :((((( #cb http://t.co/JWi1RboAbe'
498974221683281920,2014-08-11 23:28:19,b'Aku asli Bandung.. Dan Kamu... Asli Ngangenin. :) #S\xe2\x99\xa5REBUEUN #cb'
498972488689127424,2014-08-11 23:21:26,b'Aku mah suka da di sampo pake pentin teh. Seungit pop ice melon. Heu. #cb'
498855010646499329,2014-08-11 15:34:37,"b'Udahan ya #CurCap nya, isuk deui oke mun hujan salju. Bhaaaay~ #cb'"
498849786049486848,2014-08-11 15:13:51,"b'Aneh, aing mah peureum mun tunduh. RT @dearawies: pruk kenapa yah lamun bersin teh sok peureum? :( #CurCap'"
498847929084297216,2014-08-11 15:06:29,b'Sampe kamu mau berubah. Anying edan. :( RT @nilamSBS: pruk sampe kapan yaa pacar aku marahnya ? :('
498847016068186112,2014-08-11 15:02:51,b'Dunya mana? Goib? Aing setuju. RT @muhamadrizal41: pruk nahanya mun urang ngaca urang teh asa ganteng saalam dunya kitu.'
498846429440266243,2014-08-11 15:00:31,"b'Misalna maneh geuleuh ka lagu CJR, tapi dinyanyikeun wae. RT @ariiochem: Pruk ari anu disebut ongkoh cinta tapi benci teh kumaha sih ??'"
498845950207475712,2014-08-11 14:58:37,b'Geus kalem arisia goblog eeeh dieu nyarande. :( RT @cokroHSN: pruk aing ningali dia bersamanya anying teh kudu dkumahaken atulahh :('
498844846354751489,2014-08-11 14:54:14,b'Ya saeutik nyeri lah kaya digigit semut. RT @apriyantono_: pruk kata temen aku jatuh cinta teh enakeun cenah.bener? #CurCap'
498844661381734400,2014-08-11 14:53:30,"b""Paeh weh heula, da jelema hirup mah moal bisa asup surga. RT @dikikurniawan75: Pruk ai do'a asup surga kumaha?"""
498842362529869824,2014-08-11 14:44:21,"b'GANDENG GOBLOOGG! :(((( RT @GombrangBDG: PRUK HESE MANA, DAHAR BEUSI ATAWA MOVEON? ~ :))'"
498842065208229889,2014-08-11 14:43:11,"b'Pake huruf, mun make angka N4f45. Kitu. Blog. :( RT @FaldesArya: Pruk ari nafas teh pake naon sih?'"
498841597912416257,2014-08-11 14:41:19,"b'Nyerempet tai, biasa. RT @denorp: Pruk kenapa kalo hitut teh bau? #CurCap'"
498839273089400832,2014-08-11 14:32:05,b'1. Ganteng juga bukan buatan maneh sendiri. 2. Sia goreng. RT @trisnanugraha96: Pruk kenapa aing ganteng yah?'
498838532530511875,2014-08-11 14:29:08,"b'Doain bahagia aja. Hehe. TEU KETANG DURUK WEH IMAHNA! :( RT @MutiaraARmdhn: Pruk,kalau mantan gamau diajak balikan kudu diapain yah? #CurCap'"
498837437972353024,2014-08-11 14:24:47,"b'MASIH USUM YANG BEGINI? SUBHANALLAH. PUTUSIN! RT @DwiRinaldhi: pruk kumaha lamun kabogoh jarang ngabaran,tapi di bbm gunta ganti DP? :('"
498837105670254592,2014-08-11 14:23:28,"b""Anteupkeun weh.. Di rel kareta. RT @DonniDeska: pruk urg boga babaturan songong'na moal manggih, kira2 kudu di kumahakeun tah jelema ?"""
498817519595950083,2014-08-11 13:05:38,"b'Jangan emosian bro, bisi nanti kain kafannya corak angry bird. RT @gunkz_stringer: Pruk kenapa aku suka emosian wae yah?? #CurCap'"
498816201905020928,2014-08-11 13:00:24,"b'#CurCap yuk? Kalian Curhat, Aku Capruk. Kemon! Pikachu! #cb'"
498808217569206274,2014-08-11 12:28:41,"b'Neng bapanya tentara ya? | Bapa aku jualan pop ice. | Ibunya tentara berarti ya? | Bukan, tukang indomi. | YA-U-DAH-LAH-YAAAAH!! | :( #cb'"
498472515170471936,2014-08-10 14:14:43,b'Kamu tau ga apa bedanya kamu sama sandra dewi? | Gatau beb emang apa bedanya? | Bedanya? JAUUUUHHH GOBLOOG!! | Hahaha *geleng* | :( #cb'
498416908945743875,2014-08-10 10:33:45,b'Hatur Nuhun #PERSIB . Kami Tetep Bangga! #PersibDay #cb'
498329186440712193,2014-08-10 04:45:11,"b'Wilujeung #PERSIBday , 3 Point untuk alm. Ayi Beutik, Rangga, dan semuanya yang sudah berjuang demi #PERSIB. Amin Ya Allah. :) #cb'"
498154982600740864,2014-08-09 17:12:57,"b'#SMS Haloo, ini aku yang waktu itu tea.. | Y | Hehehe. gimana malam mingguannya nih? | Q2 W.. | MODAAR SIAH JADI ANGKOT SETAAN! | :( #cb'"
498152966356889600,2014-08-09 17:04:57,b'KALO PACAR KAMU SUSAH DIAJAK KETEMU MAH UDAH WEH AJAK BOTRAM ANYINGLAH LIEUR. :(((( #cb'
498146861429952512,2014-08-09 16:40:41,b'YANG MALAM MINGGUANNYA UDAH STAY DI LEMARI BUAT KE DUNIA NARNIA MANA SUARAANYAAAAAAAAA!! :( #cb'
497889411736948737,2014-08-08 23:37:40,"b'Inget ya guys, cantik/ganteng ga ngejamin nyaman, da nyaman mah orang bali. Heu. :( #cb'"
497883752706490368,2014-08-08 23:15:11,b'Bu nasi kuning 1.. | Makan disini atau dibungkus? | Dibungkus. Ibu jualan disini atau dibungkus? | BEUNGEUT SIAA! | :(((( #cb'
497011720552841216,2014-08-06 13:30:02,b'Edaan kiripiknya @kiripiksilet anjir enak banget dan lada lah padahal can didahar ku aing. :((( Mau? 08812186121. #cb http://t.co/1YyVvh1dTa'
496985843404251137,2014-08-06 11:47:13,"b'PDKT: ""Ohok.. Ohok.. | Eh minum obatnya yaa :)"" Jadian: ""Ohok.. Ohok.. | BISMILLAHIROHMANIRROHIM YAAAASIIN.."" :( #cb'"
496984438895423488,2014-08-06 11:41:38,"b'PDKT: ""Eh kamu udah makan? | Belum, tapi makasih loh perhatiannya :)"" Jadian: ""Dahar atau ku aing co\'o panonna ku obor? | ADEUUK!!! :("" #cb'"
496981545031180288,2014-08-06 11:30:08,b'Udah belum jadian teh? Lila! Kaburu diserang belanda. #cb'
496886921868476416,2014-08-06 05:14:08,b'CLBK adalah Cintanya Lama Bobogohannya Kaliwat. :((((( #atuanying #cb'
496884390794764288,2014-08-06 05:04:05,"b'Jangan cari yang apa adanya guys, biasanya yang gitu mah lama kelamaan jadi apa-apanya teh di ada-adain. Heu~ :((( #cb'"
496874974527754240,2014-08-06 04:26:40,b'Langit paling luas adalah hati tanpa kebencian. Bener ga guys? Ga juga ketang DAGOAN DI GANG ANYING!! :( #cb'
496868410215501826,2014-08-06 04:00:35,b'Yuk guys masih ada sisa L sama XL buat t-shirt #NIKE sama #LOVE. SMS aja ke 08972739387 moal ngegel moal. http://t.co/Z0YRUOqt7a #cb'
496866563178237952,2014-08-06 03:53:14,b'Ih terbaik! RT @rawalkalino: Nuhun mang @caprukBDG \xf0\x9f\x98\x98\xf0\x9f\x98\x9a http://t.co/TjYspYQRCI'
496445575613513728,2014-08-05 00:00:23,"b'Nama: Mita, Nama Lengkap: Mitamit. :(((((( #cb'"
496441416390701056,2014-08-04 23:43:51,"b'Sudahkah kalian ""Awake"" di Path sebelum sibeungeut biar kekinian banget? :( #cb'"
496440302802989056,2014-08-04 23:39:26,b'Selamat pagi guys! Selamat pagi Bandung! Selamat pagi Jawa Barat! Jangan lupa sarapan dulu ya sebelum sepuluh. Loveyou. :* #cb'
495907743107002368,2014-08-03 12:23:14,"b'PEGANGIN AJA TERUS TANGAN PACARNYA, ARI MEUNTAS HEUNTEU GOBLOG! :((((( #cb'"
495906471163346947,2014-08-03 12:18:10,b'KETEMU PACAR CUMA NGOBROL DOANG? HAHAHAHAHAHAHAHAHAHAHAHAHAHA GEUS WEH JEUNG NINI AING! :(((( #cb'
495903908393275393,2014-08-03 12:07:59,b'PRE ORDER T-SHIRT @gorillatramp CUMA SAMPAI TANGGAL 9 AGUSTUS. FOR ORDER: 089636930165. #cb http://t.co/hEcvhZP2x7'
495900916730445824,2014-08-03 11:56:06,"b'Aku kemaren ngechat kamu, kamunya ga bales. Ngadon caremong weh anying kos dakocan. :(((( #yaatuhmaap #cb'"
495899494194491392,2014-08-03 11:50:27,"b'Ada angin diatas batu, ku ingin kau kaditu. Syeuh siah syeuh~! :(((( #cb'"
495170872177471489,2014-08-01 11:35:10,b'DA KATA AING JUGA APAAA!!! :((( #cb http://t.co/4ndzCmqIKo'
495148025468035074,2014-08-01 10:04:23,"b'Bisa disebut sombong, Ga bisa disebut ngerendah. GELUT WEH SIA JEUNG MAUNG GOBLOG! :(((( #cb'"
494795772236275713,2014-07-31 10:44:39,b'KAMEKAMEHAAAAAA! :(((( #9gag #cb http://t.co/luSKnl40AQ'
494392456721358848,2014-07-30 08:02:01,b'NANGKEUPNA BIASA WEH ATUH NENG DA MOAL HIBEUR GOBLOG! :((((( #geuskalemkalem #cb'
494128902034292737,2014-07-29 14:34:45,b'TONG NGIRIM-NGIRIM STICKER DI LINE LAH! GEUS LOBA AING STICKER MAH DI HELM! PIH! Eh. :((((( #cb'
494118080876773376,2014-07-29 13:51:45,b'KEMON KEMON NGOBROL SAMA AKU YUK SILATURAHMI. ADD LINE: caprukbdg . #cb'
493558955348475904,2014-07-28 00:49:59,"b'Guys @olegunnnn @Kumaha_Maneh @banyolanhidup @WahRusuh @GombrangBDG @KabogohBatur @bacotaingnya maafin aku ya, korek kalian di aku. :((( #cb'"
493556122423271424,2014-07-28 00:38:44,"b'Minal Aidzin Walfaidzin Guys! Maaf ya guys aku suka heureuy, da yang serius mah ngobrol jeung si limbad. Loveyou. :* #cb'"
493388578571816960,2014-07-27 13:32:58,"b'SUDAHKAH KALIAN DAPET BC ""AIR JERNIH"" ? DELKON HARGA MATIIII!!! #cb'"
493387297283248128,2014-07-27 13:27:53,"b':( RT @bacotaingnya: Mah, lg apa ? | lagi masak ikan goreng | kan sahur na lila keneh mah | iya lama, ini digoreng sama balong2 na | :(('"
493386710206517248,2014-07-27 13:25:33,"b'RT @olegunnnn: @sahabatalaqsha kadeudeuh buat sodara kita di Gaza, smg berkah. Amin @ABSpride @infosebel @ComicSunda @caprukBDG dll http://\xe2\x80\xa6'"
493147796376023040,2014-07-26 21:36:11,b'Bro tadi ketemu pacar aku ya? | Ha? Iya gitu? | Iya yang itu.. | Yang mana? | Yang ada badaknya.. | BLOG!!! | :(((( #cb'
493143708980609026,2014-07-26 21:19:57,b'Semangat sahur hari terakhir sayang yaaa.. Happy fasting! | HAPPY FASTING HAPPY FASTING! SAMARUK SIA AING DAHAR BARI BALAP GOBLOG! | :( #cb'
493047276084793345,2014-07-26 14:56:45,b'Malam minggu masih dirumah? GEUSWEH JADI TUPPERWARE! HAHAHAHAHAHAHAHAHAHAHAHAHAHAHAHAHAHAHA anying. :(((( #cb'
492730839017349121,2014-07-25 17:59:21,b'JANGAN CINTAI AKUUU~ APA ADANYAAA~ JAAAAAA~ JAAAAANG~ (TULUS - JAJANG CINTAI AKU APA ADANYA) LOVEYOU JANG! :* #cb'
492424494544191488,2014-07-24 21:42:02,b'Selamat berpuasa guys! Cemungud ya seperti biasa. Cemangat bau cungud. Loveyou :* #cb'
492420996687618048,2014-07-24 21:28:09,"b'Aku pengen mudik ke kampung halaman, tapi aku lupa halaman berapa. Hoof~ :(((( #path #cb'"
492260111717380096,2014-07-24 10:48:51,b'AKU TAK PUASAAAA~ BILA ADA KAU DISISIKUUU~ :(((( #cb http://t.co/11EnApYiTd'
492249343164825601,2014-07-24 10:06:03,b'GUYS SINI ARISIA KE STANDNYA #ABSPRIDE #SALEONTHEROAD DI TRUNOJOYO. 150 DAPET 2 COBA IRAHA DEUI! #cb http://t.co/wncgatue9n'
492247667066433536,2014-07-24 09:59:24,b'FOLLOW @ENAKcloth LAGI ADA DISKON LOH DI TRUNO GUYS! KEMON! CONTACT VIA: 085759333159 / 764CA231 | FACEBOOK: ENAKcloth - IG: ENAKcloth #cb'
492247230007373824,2014-07-24 09:57:39,"b'RT @ENAKcloth: ""GREY FONT"" available size S M L XL | IDR. 100k | DISC. 20% | GRAB IT!! #ENAK http://t.co/iTHTN8JXZ6'"
492247219680993281,2014-07-24 09:57:37,"b'RT @ENAKcloth: ""RED FONT"" available size S M L XL | IDR. 100k | DISC. 20% | GRAB IT!! #ENAK http://t.co/lyyjKgH0lg'"
492247210038288384,2014-07-24 09:57:35,"b'RT @ENAKcloth: ""BLACK BOX"" available size S M L XL | IDR. 100k | DISC. 20% | GRAB IT!! #ENAK http://t.co/ejB2bWgdoz'"
492247207374884864,2014-07-24 09:57:34,"b'RT @ENAKcloth: ""BROWN BOX"" available size S M L XL | IDR. 100k | DISC. 20% | GRAB IT!! #ENAK http://t.co/0jaEqBr6BO'"
492041785833562112,2014-07-23 20:21:18,b'NAMUN KASIH INIIIIIII~ SILAHKAN KAU ADUUU~ ETA EUY ALUNGKEUN TISU SA KOL BUNTUNGEUN TEU KUAT AING! :(((( #cb'
492039491566051328,2014-07-23 20:12:11,b'Hello kitty ih sia nyak anying! KEZZAAL! :( ~@PastiSandy #cb http://t.co/zAbzJRTELF'
491337424136450048,2014-07-21 21:42:25,b'Puasanya Cemungudh Yuupzzz Cemangad Bau Sungudh. Loveyou. Blog! :( #cb'
491336223009427457,2014-07-21 21:37:38,"b'""Bismillahirohmanirrohim Alhamdulillahhirobbilalamin Astagfirullohhaladzim.."" Itu niat ketika kalian buka puasa. JAM DUABELAS BERANG! :( #cb'"
491335434530598912,2014-07-21 21:34:30,"b'Rindu itu ketika kalian senang mengingatnya. Jika bukan, mungkin itu kasuat-suat. :( #kuwotes #cb'"
491252471646277634,2014-07-21 16:04:50,"b'Kalo tmn kalian nanya ""Bro masih jomblo?"" Kalian jawab aja gini ""hahaha bisa aja"" bari beungkeut beuheungna ku tambang. Oke? :( #cb'"
491251006588481537,2014-07-21 15:59:01,b'Anjir mwuah RT @sebagai_ajay: Nih atuh abis jajan tadi @olegunnnn @Kumaha_Maneh @ABSpride @GombrangBDG @caprukBDG http://t.co/71J8waKNZD'
490970655001567233,2014-07-20 21:25:00,b'Kamu yakin ga sayang aku? Hah? Yakudalah~ Heustineng. :((((( #nawn #cb'
490968585729085440,2014-07-20 21:16:47,"b'Subuh-subuh gegeberan di jalan, kamana atuh? Karek putus? Atau keur ucing Boy-boyan? Blog! :( #cb'"
490515051049021440,2014-07-19 15:14:36,"b'Laleur Hejo, Lalaki Lieur Hese Jodo. Krik Krik anying! :( #cb'"
490471517759614976,2014-07-19 12:21:37,b'Malam minggu teh maen atuh euy da lain gelas melamin. :( #cb'
490246018743554049,2014-07-18 21:25:33,"b'Saurlah dengan yang ada, karena yang ga ada mah kamu buat aku anyiinngg.. *mocelan borok* :(((( #geuskalemkalem #cb'"
489881716689883136,2014-07-17 21:17:57,"b'*BBM* Pagi cantik, udah jam 4 nih ayo saur dulu nanti keburu imsak, mau saur sama apa nih? :D | Tangan | GOBLOG SIAH! :(((( #cb'"
489863441117499392,2014-07-17 20:05:20,"b'Saur mah sama apa aja lah, yang penting ga nyakitin. Blog! :(((( ~@MochRachman #cb'"
489860411248738304,2014-07-17 19:53:17,b'*Dimesjid* Waktos atos jam tilu saparapat~ Nyareuri awak~ Baluuuurr~ Baluuuurrr~ Baluuuurr~ :( #cb'
489770488378322945,2014-07-17 13:55:58,b'Pedah BMX. RT @Fadhil_MFR: Pruk ai gebetan loba tapi teu jadi jadi pedah naon? :( #CurCap\xe2\x80\x9d'
489770334338306048,2014-07-17 13:55:21,"b'Dateng atuh, siapin weh stick baseball yang ada cucukan kaya si mankind. RT @Hanmiw: Pruk kalo di undang nikahan mantan, dateng jangan ?'"
489765464591986689,2014-07-17 13:36:00,b'*Sms* bro kumaha engke maneh rek datang moal ka bukber barudak Sma? Mun adeuk ku urg dijemput. Kumaha? | Y | MODAR WEH ANJEENG! | :( #cb'
489152455012151296,2014-07-15 21:00:07,b'OEEMJII SWALLOW! HARE GENEEE DIBANGUNIN SAUR MASIH SAMA ALARM HAPE? HAHAHAHAHAHAHAHAHAHAHAHAHAHAHAHAHAHA CES! :(((( #cb'
488794498382577664,2014-07-14 21:17:44,"b'Kamu tuh cantik, Tapi sayang.. | Sayang kenapa? | Gpp ko sayang. Loveyou :* | MODUS GOBLOG! | :(((( #cb'"
488779387794227200,2014-07-14 20:17:41,b'YA KEEEELLLEEUUUUSSSS~ :(((( ~@riridiredja #cb http://t.co/JIOPWCXUBQ'
488674529586069504,2014-07-14 13:21:01,"b'Santai weh da Tuhan mah adil, ga kaya kamu, jiga si miska. :( #cb'"
488640078286053376,2014-07-14 11:04:07,"b'Ada cewe, cantik, pake tiung, tapi sagala ngajeundol. Isukan deui ah. :(((( #cb'"
488615049670295552,2014-07-14 09:24:40,b'TAH IEU KULIT MANGGIS ADA EKSTRAKNYA TEH GARA-GARA FILENYA RAR/ZIP. :( #cb http://t.co/F6wDy5Ue4b'
488371188863741956,2014-07-13 17:15:39,b'OOHHHH GUYS TERNYATA KULIT MANGGIS ADA EKSTRAKNYA TEH KARENA FILENYA ZIP. krik.. Krik.. :(((( #cb'
488288325162110976,2014-07-13 11:46:23,b'ISABELLA ADALAAAAHHH~ AKULAH PENDUKUNGMUUUU~ PATRIOT PROKLAMASI~ SETIA BERKORBAN UNTUKMUU~ :( #nyanyiinaja #cb'
488284551806844928,2014-07-13 11:31:23,b'Kalian yang pernah makan pangsit di saos kecapan adalah keren. Jiga aing. Ayeuna. :( #cb'
488226684357718016,2014-07-13 07:41:27,b'Hai guys! Jangan lupa tanggal 19 kita buka bareng + penggalangan dana untuk saudara kita di Gaza. Daratang beul! #cb http://t.co/Ghjs93WhHd'
487709748163145728,2014-07-11 21:27:19,b'DUUHHH! :(((( ~@agadesss #cb http://t.co/1E0FUqnHV9'
487599485111898112,2014-07-11 14:09:11,"b'Aku gatel kaki, Digaro ngadon pindah ka tonggong, Digaro ditonggong ngadon leungit. Setan. Kalian pernah? :( #cb'"
487588359632482305,2014-07-11 13:24:58,b'Tik tik tik~ Bunyi hujan di atas genting~ Airnya turun tidak terkira~ Cobalah tengok di sisi jalan~ Modus semua~ #cb'
487189864538841089,2014-07-10 11:01:29,b'Sia can pernah kaasupan korsel kana ceuli? Adeuk? :( RT @naraazizshika: caprukBDG gaza teh nu kieu lain pruk? :( http://t.co/Hn0Rqmo39m'
487188328916070400,2014-07-10 10:55:23,b'Selamat berbuka puasa guys! Semoga Gaza selalu ada dalam lindungan Allah SWT. Amin ya allah. #PrayForGaza #cb'
487181818437726208,2014-07-10 10:29:31,b'A kalo vila ini seharinya berapa? | Seharinya? | Iya.. | 24jam biasa | ADZAN PLEASE ADZAAAAAAANNNN!!!!!! | :(((( #cb'
486973370135633920,2014-07-09 20:41:13,b'Kamu udah saur? Saur dulu atuh. Bisi modar saacan maghrib. Ya? Loveyou. :* #cb'
486838887688331264,2014-07-09 11:46:50,b'SUDAHKAH KALIAN PUNYA TEMEN BBM YANG DPNYA CINGIR-CINGIR BEKAS TINTA HABIS NYOBLOS? DELCONT HARGA MATI! ALAY! :(((( #cb'
486835334764699648,2014-07-09 11:32:43,"b'Berbukalah dengan yang sayang, karena yang manis belum tentu sayang. :( ~@fajarx3m #cb'"
486758678578470912,2014-07-09 06:28:07,b'#PrayforGaza #PrayforGaza #PrayforGaza #PrayforGaza #PrayforGaza #PrayforGaza #cb'
486627499841814531,2014-07-08 21:46:51,b'0-7 angkot mana? BHAAAYYYY~ :((((( #cb'
486626879646867456,2014-07-08 21:44:23,"b""[1-0] :) | [2-0] :D | [3-0] :'D | [4-0] :| | [5-0] :( | [6-0] :(((( | [7-0] FIX PINDAH AING KA SOREEAAANG!! :((( #BrazilPeople #cb"""
486625027542880256,2014-07-08 21:37:02,b'ANJIR 7-0! GEUS WEH GAWANG LEUTIK-AN JEUNG AEEEEENG!! :(((( #'
486624462662418435,2014-07-08 21:34:47,b'BRAZIL SEHAT? BUYUNG UPI-AN DULU SOK ENGGAL SOK. :(((( #cb'
486401881132904448,2014-07-08 06:50:20,"b'Kamu ga kangen aku? Yaudah gpp, aku nonton si Krisna dulu ya. DIN~ DIN~ DIM~ BETADIN~ BETADIN~ :( #cb'"
486264245621751809,2014-07-07 21:43:25,b'Hambur banget karek ge saur geus modol deui. :(((( #cb'
486259152935583744,2014-07-07 21:23:10,b'GANDENG! :( RT @olegunnnn: IYA ZOOMNYA JUGA NEPI KA MAJALAYA!!'
486258601892147200,2014-07-07 21:20:59,b'Bro Bro! | Woy! | Pacar kamu baru? | Yoi.. | Ada kameranya ga? | .... | HEUREUY ATUH ANYING! :((( #cb'
485901715116269568,2014-07-06 21:42:51,b'Bro kenapa masih makan? Udah adzan arisia! | Ah ringtone.. | SAKAREP SIA WEH SMEAGOL! :(((( #cb'
485896028285988865,2014-07-06 21:20:15,b'Pacarku memang dekat~ 5 langkah dari jurang~ Tak perlu kirim surat~ Tinggal ngajleung ka akherat~ :(((( #nyanyiinaja #cb'
485893940369838081,2014-07-06 21:11:57,b'OK!!!!! :((((( #9gag #cb http://t.co/wwvo8Ja3wU'
485893011247616000,2014-07-06 21:08:15,b'Beb bangun saur.. | ... | Beeeb banggun sauuuur! | ... | BEB BANGUN SAUURR! SAUR ALLAH MENGHADAP!!! | ARISIAAAA!! | :( #cb'
485751787492610048,2014-07-06 11:47:05,"b'Ya allah sehatkan selalu para tukang tajil diseluruh dunia, karena cuma mereka yang manis tapi ga nyakitin. Amin. #cb'"
485463447715328001,2014-07-05 16:41:20,b'Pilpres teh musingin ga kaya pilkoplo? Heu~ lucu anjeng! :((((( #cb'
485449082551672833,2014-07-05 15:44:15,"b'Kamu kemaren lucu deh fotonya ngegemesin banget ih ya allah! | Siapa? | Kamu itu yang kema.. | Engga, maneh siapa? | Oh :(((( #1cak #cb'"
485446865853247489,2014-07-05 15:35:26,"b'Kamu kenapa sih setiap aku tanya selalu bilang gatau? | Ya gatau atuh, Emang kenapa? | GATAU GOBLOG! | :(((( #AllAboutGatau #cb'"
484640261847261184,2014-07-03 10:10:17,"b'Pacaran: ""Sayang kehujanan? Dingin ya? Sini aku peluk *peluk*"", Jomblo: ""Bro sia kahujanan, tiris nyak? Dieu ku aing duruk!"" :( #cb'"
484605475644657664,2014-07-03 07:52:03,"b':( RT @infocapruk: Kalo ketemu cewek/cowok yg so jual mahal. Jengut buukna, Bisikin ditelinganya ""SIA HAYANG DILEASINGKEUN KUAING KA ADIRA?!'"
484604497327452160,2014-07-03 07:48:10,b'Cuacanya cerah ya guys? Hehehe. :( #cb http://t.co/RwIHsMnTdr'
484602428675739648,2014-07-03 07:39:57,"b'Halo guys, lagi apa? :( #cb http://t.co/c3icoaQSLH'"
484345191541637120,2014-07-02 14:37:47,b'DASAR HELOKITTY SETAAAAN! :(((( #twitmurkajamansekarang #cb'
484340051040432128,2014-07-02 14:17:21,b'TONG DIBALES SMS AING MAH. HARAAAM! :((((( #geuskalemkalem #cb'
483935611766575105,2014-07-01 11:30:15,"b'Selamat berbuka puasa guys, ingat ya berbukalah dengan yang manis bukan dengan unyang anying. Loveyou. #cb'"
483727081654611968,2014-06-30 21:41:38,"b'Selamat berpuasa guys, semoga puasanya lancar dan Jgn lupa solatnya, karena begitulah cara kita menyampaikan rindu. MAS NYERAH MAS! :( #cb'"
483700522549923840,2014-06-30 19:56:05,"b'Belom dikasih makan itu teh. RT @kikiaprisya: Apa kabar di indo kesorot kamera jojogedan na pager min? -,-'"
483700370279895040,2014-06-30 19:55:29,"b'Heueuh anying teh. :( RT @un_pejuang45: caprukBDG eweuh nu mamawa karton "" I love antv "" teu mulang tarima orang luar mah'"
483699103134543872,2014-06-30 19:50:27,b'Orang luar negeri mah kalo nonton bola di stadion trus kesorot kamera teh dadah ya? Kampungan anjir. :(((( #cb'
483340603132882945,2014-06-29 20:05:54,b'Selamat saur guyysss.. Hati-hati saurnya sama nasi ya jangan sama dia dicuekin. Kan goblog kalo gitu teh. :( #cb'
482766001704947713,2014-06-28 06:02:38,b'Tong rariweuh sia teh da lain si yunita beubeul! :( #cb'
482751196696834048,2014-06-28 05:03:49,"b'Bro hape aku cepet panas euy, diapain ya? | Make eta weh atuh bro.. | Make naon? | Inzana.. | BALEG GOBLOG! | :(((( #cb'"
482730381674704896,2014-06-28 03:41:06,"b'Eh iya, Selamat berpuasa bagi kalian yang menjalankan puasa hari ini. Semoga puasanya barokah yaa. :) #cb'"
482729012851003393,2014-06-28 03:35:39,b'GUYS ADA KABAR GEMBIRAAA GUYYYYSSS! KINI KULIT MANGGIS ADA ESKTRAKNYAAAA! MASSIIAAAAA! :( #cb'
482344811639218176,2014-06-27 02:08:59,"b'Udahan ah. Mau jumatan dulu, bisi kaburu sabtu. Bhaaaay~ #cb'"
482341380069396480,2014-06-27 01:55:21,b'Iyo Cantok. RT @Tia_Nov: Nih capruk gomana ? :D caprukBDG http://t.co/smiYjv99DC'
482340886508879872,2014-06-27 01:53:23,"b'Ini bagus, kembar siam rengkep buuk. Langka. RT @TardesTari: Nih maang caprukBDG http://t.co/U2S1CZ0tyB'"
482340446652215296,2014-06-27 01:51:38,b'Iya gaga iya cantik. Tapi cantikan mamah aku. RT @gagaaa_ulalaa: Tah atuh min tah \xf0\x9f\x98\x81http://t.co/XjXgERzaIi'
482339988403519488,2014-06-27 01:49:49,b'Ga gosok gigi ya? Itu digiginya nyelap jagong ngadereded. RT @YayaangRF: niiih maang caprukBDG http://t.co/VrWHaJgcrU'
482339140743073792,2014-06-27 01:46:27,b'Itu antingnya bagus. RT @oliveeeAr: caprukBDG taraaaaaaaaaaaaaaa http://t.co/UomGucjBEK'
482337641782718465,2014-06-27 01:40:29,b'Goblog aing kudu adus ieu mah euy. :( RT @hisyamalmarieee: caprukBDG Taraaaaa\xe2\x99\xac http://t.co/Z4bvbQoGKY'
482337406201245696,2014-06-27 01:39:33,b'Cantik. Pinjem duajutalah. RT @anneagustine2: caprukBDG kalo ini gimana pruk http://t.co/Mb0bnnyBCz'
482337050989838336,2014-06-27 01:38:09,b'Itu kursinya jati? bagus euy. RT @ErlinaAstri: caprukBDG nih http://t.co/El1Yhqm4UR'
482335552218603520,2014-06-27 01:32:11,b'Lumayanlah daripada lujeubag. RT @vitaayuliasari: caprukBDG cuntik kan? Masih fresh karak metik ;;) http://t.co/HxHt07tiNu'
482334574144258048,2014-06-27 01:28:18,"b""Katanya mah kalo pagi-pagi gini banyak yang cantik. Ga percaya aku mah da. Cik twitpic-in ke aku. :'&gt; #cb"""
482333043357523968,2014-06-27 01:22:13,b'Pagi-pagi gini aku udah kangen kamu. Kamu kangen ga? Ga ya? Da kamu mah kangennya kangenahan aku kangenin terus goblog teh. :(((( #cb'
481662310084136961,2014-06-25 04:56:58,"b'Tong loba BC unpat inpit PIN BB lah, kamu hayang di invite malaikat izroil suruh menghadap hah? #cb'"
481589641871503360,2014-06-25 00:08:12,b'Udah mau puasa dan kalian masih jomblo? Terus yang ngucapin selamat berbuka nanti siapa? Iklan orson? :((((( #1cak #cb'
481263093406646272,2014-06-24 02:30:37,b'SATU CINTAAAAAAAAAAAAAAAAAAAAAAAAAAAAAAAAAAAAAAAAAAAAAAAAAAAAAAAAAAAAAKUUUU CUMA KAAAAAAAAAAAAAAAAAAAAAAAAAAAMU. KUFAKU - CUMA KAMU :((( #cb'
481259447537262592,2014-06-24 02:16:08,"b'RT @agghhe: aing 60 detik mang, hape aing langsung pareum, aliran :((( RT @caprukbdg: Rekor aku liat vidio ini 28detik. Khalian shanggup? H\xe2\x80\xa6'"
481259375567183874,2014-06-24 02:15:51,b'RT @nia0701: 10 detik udah di pareuman \xf0\x9f\x98\x82\xf0\x9f\x98\x82\xf0\x9f\x98\x82\xf0\x9f\x98\x82 RT @caprukBDG Rekor aku liat vidio ini 28detik. Khalian shanggup? Hah? :(((( http://t.co/lxZNwa\xe2\x80\xa6'
481259273368764416,2014-06-24 02:15:26,b'RT @AbdulrArraisi: aku 50 detik pruk :(( RT @caprukBDG: Rekor aku liat vidio ini 28detik. Khalian shanggup? Hah? :(((( http://t.co/RScdnCqL\xe2\x80\xa6'
481255358308962306,2014-06-24 01:59:53,b'Rekor aku liat vidio ini 28detik. Khalian shanggup? Hah? :(((( http://t.co/238RMvqgF2 #cb'
481246266693648384,2014-06-24 01:23:45,"b'Mantan adalah monster masa lalu. Maka dari itu, jadilah ultraman dan berteriaklah ""KUAT AING MAH KUAAAAT!"". Keyz? :(((( #cb'"
481242357371658240,2014-06-24 01:08:13,b'Nama kamu siapa? | Chua | Wess chua kotak? | Bukan | Chua apa atuh? | Chuagapatmanepjupanlanluh.. | HARAM JACKSON SIAA! | :((((( #cb'
481239913937899520,2014-06-24 00:58:31,b'Motor cowok jantan: Harley Davidson. | Motor cowok tanpa harapan: Harley Daaaaakumahapaatuh. :( #cb'
481238538956984321,2014-06-24 00:53:03,"b'Jika kalian akan melakukan sesuatu, janganlah ditunda-tunda. Kecuali kalo ga ada siapa-siapa. Tunda weh. Luhur kulkas. :(((( #cb'"
481234672148418560,2014-06-24 00:37:41,"b'Anjir keren. Mwuah! RT @Seucapnya: Aku sibuk untuk selalu menjadi apa yang kamu mau, sampai aku lupa menjadi diriku sendiri :)'"
480871255923376128,2014-06-23 00:33:36,"b'Aku mah mau jual mahal ah, da jual imah mah beurat. :( #cb'"
480865988531859456,2014-06-23 00:12:40,b'@Kumaha_Maneh pagi ceng! :*'
